Titel,URL,Date_Info,News_page
Finale der Handball-EM gegen Spanien: Schweden holt in letzter Sekunde per Siebenmeter den Titel,https://www.spiegel.de/sport/handball/handball-em-schweden-besiegt-spanien-im-finale-in-letzter-sekunde-a-6228e0fc-6093-42c3-b5dd-f2f5c6591791,30012022_20:46,Spiegel
Nadals Erfolg bei den Australian Open: Das Comeback seines Lebens,https://www.spiegel.de/sport/tennis/australian-open-rafael-nadal-das-comeback-seines-lebens-a-0f536cad-1b4a-4655-bbcf-b6b11205a357,30012022_20:37,Spiegel
Coronamaßnahmen: Söder hält Lockerungen nach Mitte Februar für möglich,https://www.spiegel.de/politik/deutschland/markus-soeder-haelt-lockerungen-der-coronamassnahmen-nach-mitte-februar-fuer-moeglich-a-801df317-5260-4a08-b727-bd14862c1cc9,30012022_20:25,Spiegel
"Auslosung DFB-Pokal-Viertelfinale: Union Berlin empfängt den FC St. Pauli, Leipzig muss nach Hannover",https://www.spiegel.de/sport/fussball/viertelfinale-im-dfb-pokal-union-berlin-spielt-gegen-den-fc-st-pauli-rb-leipzig-bei-hannover-96-a-b4f4508f-170a-408f-80e7-a35c3d8ed6ea,30012022_19:42,Spiegel
"NFL-Quarterback Matthew Stafford: Der Mann, der das Spektakel nach Los Angeles brachte",https://www.spiegel.de/sport/nfl-football-wie-rams-quarterback-matthew-stafford-das-spektakel-nach-los-angeles-brachte-a-b29e4512-6cd9-43b5-99ed-74616e5c1d80,30012022_19:24,Spiegel
Nach historischem Sieg bei Australian Open: »Beeindruckender Kampfgeist« – Djoković gratuliert Nadal,https://www.spiegel.de/sport/tennis/australian-open-novak-djokovic-und-roger-federer-gratulieren-rafael-nadal-a-7ee90507-78e2-401e-8fe1-a435a879000f,30012022_19:10,Spiegel
Schmuckdiebstahl aus Grünem Gewölbe: Polizei durchsucht Räume in Essen,https://www.spiegel.de/panorama/justiz/essen-spur-im-gruenen-gewoelbe-diebstahl-fuehrt-nach-nrw-a-7649ace1-93ad-48ec-8446-4f183cd61c5b,30012022_19:07,Spiegel
Englischer Nationalspieler: Manchester United suspendiert Greenwood nach Gewaltvorwürfen,https://www.spiegel.de/sport/fussball/manchester-united-suspendiert-mason-greenwood-nach-gewaltvorwuerfen-a-c4fecb52-d832-4b83-81c9-3353529f0345,30012022_19:05,Spiegel
Geschichte-Podcast: Troja – die Fakten hinter dem größten Mythos der Weltgeschichte,https://www.spiegel.de/geschichte/troja-die-fakten-hinter-dem-groessten-mythos-der-weltgeschichte-podcast-a-ebf61ae1-4d75-4656-8166-9966d45b508f,30012022_18:44,Spiegel
Zuflucht bei den Taliban: Schwangere neuseeländische Journalistin in Afghanistan gestrandet,https://www.spiegel.de/panorama/charlotte-bellis-schwangere-neuseelaendische-journalistin-in-afghanistan-gestrandet-a-890daf86-2da9-4fac-8576-700b45454ae8,30012022_18:41,Spiegel
Schöner schreiben: Wie man den Himmel mit Worten malt,https://www.spiegel.de/kultur/bruno-schulz-und-wie-man-den-himmel-mit-worten-malt-schoener-schreiben-die-deutschkolumne-a-20b3df01-2330-4485-962d-2eebd1502732,30012022_18:36,Spiegel
Ex-AfD-Politiker Witt im Bundestag: Die Rückkehr der Zentrumspartei,https://www.spiegel.de/politik/deutschland/zentrumspartei-im-bundestag-ex-afd-politiker-uwe-witt-sorgt-fuer-comeback-a-8ee50dc5-ea44-4dcd-a27a-56da385b3eeb,30012022_18:24,Spiegel
Psychologin über die gesunde Sehnsucht nach Erholung: Bin ich faul oder nur blockiert?,https://www.spiegel.de/psychologie/psychologie-bin-ich-faul-oder-nur-blockiert-interview-ueber-fehlende-motivation-a-ea535b85-8f20-4e48-8932-4d6f271b4d52,30012022_18:06,Spiegel
Sturmtief am Wochenende: Welche Spuren »Nadia« hinterließ,https://www.spiegel.de/panorama/nadia-hinterlaesst-spuren-schaeden-nach-stuermischem-wochenende-a-7d948c44-066a-4c5c-aed3-82cf4a708402,30012022_17:57,Spiegel
Ingrid Betancourt kandidiert in Kolumbien: Der zweite Versuch,https://www.spiegel.de/ausland/kolumbien-zwanzig-jahre-nach-ihrer-geiselnahme-will-ingrid-betancourt-praesidentin-werden-a-19def562-38ef-408d-8b05-1281322ebda1,30012022_17:32,Spiegel
Nadals historischer Sieg bei den Australian Open: »Das wird bis zum Ende meines Lebens in meinem Herzen bleiben«,https://www.spiegel.de/sport/tennis/rafael-nadal-sein-historischer-sieg-gegen-daniil-medwedew-bei-den-australian-open-fotostrecke-a-ea0c9f09-a643-4658-aac2-c222f9bf06a8,30012022_17:18,Spiegel
Zu wenig neue Abonnenten: Wie Netflix seinen Coronakater überwinden will,https://www.spiegel.de/wirtschaft/unternehmen/netflix-wie-der-streamingdienst-seinen-corona-kater-ueberwinden-will-a-73563066-0231-49bb-a206-3c0a4d776f72,30012022_17:09,Spiegel
»Dein SPIEGEL«-Podcast über eine Wildstation: »Unsere Mäusebussarde sind immer hungrig«,https://www.spiegel.de/familie/wildtierstation-unsere-maeusebussarde-sind-immer-hungrig-podcast-a-1abe19e6-2df1-4f7b-8a4d-d8b4116252e7,30012022_17:04,Spiegel
Künstler auf der Corona-Intensivstation: »Ich will den Moment zwischen Leben und Tod nicht ausblenden«,https://www.spiegel.de/kultur/kuenstler-und-pfleger-simon-surjasentana-ich-male-patienten-am-beatmungsgeraet-a-8cbeee14-4fa7-42cd-98fe-9a247d70327a,30012022_16:55,Spiegel
Niedersachsen: Polizei durchsucht IC wegen Sprengstoffverdachts – Staatsschutz ermittelt,https://www.spiegel.de/panorama/justiz/niedersachsen-polizei-durchsucht-ic-wegen-sprengstoffverdachts-staatsschutz-ermittelt-a-70d1a797-ca0e-4d26-8122-4420e9dde025,30012022_16:39,Spiegel
"Rätsel der Woche: Ein Rechteck, zwei Kreise – und der Winkel?",https://www.spiegel.de/karriere/raetsel-der-woche-ein-rechteck-zwei-kreise-und-der-winkel-a-6bb46543-fd2a-41af-9ea9-4237715eb183,30012022_16:26,Spiegel
Putsch in Burkina Faso: Warum es in Afrika so viele Umstürze gibt,https://www.spiegel.de/ausland/putsch-in-burkina-faso-warum-es-in-afrika-so-viele-umstuerze-gibt-a-c5b6d0ce-5557-4492-aa3e-db13e69ab580,30012022_16:21,Spiegel
»Jugend von heute«-Debatte: Die Generation Schneeflocke ist nicht verweichlicht – sondern einfach schlauer,https://www.spiegel.de/wissenschaft/mensch/jugend-von-heute-debatte-die-generation-schneeflocke-ist-nicht-verweichlicht-sondern-einfach-schlauer-kolumne-a-df52de97-9357-4436-9bbd-8408fbb6a640,30012022_16:20,Spiegel
Unwetter: Sturmtief »Nadia« fegt über Norddeutschland,https://www.spiegel.de/panorama/wetter-sturmtief-nadia-sorgt-fuer-orkanboeen-und-eine-sturmflut-a-f6840ebb-9838-470c-b594-99d5a6c547ea,30012022_16:03,Spiegel
NFL-Quarterback Joe Burrow: Verprügelt und verehrt,https://www.spiegel.de/sport/nfl-cincinnati-bengals-quarterback-joe-burrow-verpruegelt-und-verehrt-a-b3694665-3d2a-4820-8d03-92f70799d40d,30012022_15:55,Spiegel
Chef der Arbeitsagentur: Für Ungeimpfte könnte das Arbeitslosengeld wegfallen,https://www.spiegel.de/wirtschaft/impfpflicht-fuer-ungeimpfte-koennte-das-arbeitslosengeld-wegfallen-a-2282634b-96f3-47cb-a306-bafde019875a,30012022_15:54,Spiegel
ARD-Sonntagskrimi: Der deutsch-polnische »Polizeiruf« im Schnellcheck,https://www.spiegel.de/kultur/tv/polizeiruf-heute-mit-gregorowicz-und-kaczmarczyk-hildes-erbe-im-schnellcheck-a-30658a0b-e7e2-40cf-9239-bb617ca6960c,30012022_15:49,Spiegel
Wahl in Nordrhein-Westfalen: SPD und CDU liegen in Umfrage gleichauf,https://www.spiegel.de/politik/deutschland/nrw-landtagswahl-spd-und-cdu-in-umfrage-gleichauf-a-63b997d4-01d4-4b5a-a7c7-c4e4320212b7,30012022_15:40,Spiegel
Coronadebatte um Streamingdienst: Auch Meghan und Harry kritisieren Spotify,https://www.spiegel.de/kultur/corona-debatte-um-streamingdienst-auch-harry-und-meghan-kritisieren-spotify-a-6e44d131-851c-46f6-9846-a81817465016,30012022_15:39,Spiegel
Australian Open: Spektakuläres Comeback gegen Medwedew – Nadal gewinnt historischen 21. Grand-Slam-Titel,https://www.spiegel.de/sport/tennis/australian-open-rafael-nadal-gewinnt-finale-gegen-daniil-medwedew-a-43cdaed0-5be7-4ffa-a20d-0de9c97bb245,30012022_15:12,Spiegel
Nach Bundespräsidenten-Kandidatur für AfD: Otte kündigt Rückzug aus Parteipolitik an,https://www.spiegel.de/politik/deutschland/max-otte-cdu-will-sich-nach-kandidatur-als-bundespraesident-aus-aktiver-parteipolitik-zurueckziehen-a-96048d1b-e176-4d64-9f63-e83ec8375b30,30012022_14:49,Spiegel
Wetterextrem: »Nor’easter« fegt über die Ostküste der USA,https://www.spiegel.de/panorama/nor-easter-wintersturm-fegt-ueber-den-osten-der-usa-a-80770461-3fd0-4b1e-86fe-f89016c606f5,30012022_14:39,Spiegel
"»Bloody Sunday« 1972: Nordirlands Wunde, die nie verheilte",https://www.spiegel.de/geschichte/bloody-sunday-1972-das-nordirische-trauma-a-c5230c1a-e496-4bd7-a942-30e347a12f52,30012022_14:02,Spiegel
Leipzig: Auch Rechtsextreme bei Sturm auf Gelände von Uniklinik dabei,https://www.spiegel.de/politik/leipzig-corona-spaziergaenger-stuermen-klinikgelaende-a-11a290a5-87bf-465e-ab08-28ed721798a1,30012022_13:37,Spiegel
Teenager über seinen unheilbar kranken Vater: »Ich hätte gern mehr von ihm erlebt«,https://www.spiegel.de/familie/alzheimer-ein-teenager-ueber-die-unheilbare-krankheit-seines-vaters-a-a213d3f5-52d2-43d5-aa83-0d2f00929ee3,30012022_13:21,Spiegel
Oberbürgermeisterwahl Tübingen: Palmer tritt als unabhängiger Kandidat an,https://www.spiegel.de/politik/deutschland/boris-palmer-tritt-bei-oberbuergermeisterwahl-in-tuebingen-als-unabhaengiger-kandidat-an-a-2be4af90-5ad1-44d8-9b81-ed2fbdebb11a,30012022_12:55,Spiegel
Urteil nach Berufung: »Tiger King« bleibt in Haft,https://www.spiegel.de/panorama/leute/joe-exotic-tiger-king-bleibt-wegen-versuchten-mordes-in-haft-a-588cb36e-3004-4c6b-bdbe-aa8007b2cd5f,30012022_12:45,Spiegel
"Attacke auf Pop-Superstar der Türkei: Sezen Aksu singt, und Erdoğan hat ein Problem",https://www.spiegel.de/ausland/tuerkei-recep-tayyip-erdogan-nimmt-pop-ikone-sezen-aksu-ins-visier-a-c65d5a5b-aa00-4478-94f3-66829cfd86cb,30012022_12:42,Spiegel
Generalsekretär Stoltenberg: Nato wird auch im Fall einer russischen Invasion keine Soldaten in die Ukraine schicken,https://www.spiegel.de/ausland/jens-stoltenberg-keine-plaene-nato-kampftruppen-in-die-ukraine-zu-entsenden-a-231f5151-082e-493b-9f5e-55259c7ebe6d,30012022_12:22,Spiegel
Australiens Umgang mit Flüchtlingen: »Es ist kein Leben. Es ist bloßes Existieren«,https://www.spiegel.de/ausland/australien-und-die-strikte-asylpolitik-es-ist-kein-leben-es-ist-blosses-existieren-a-28706890-fae1-4eb6-96b7-94dd58056c90,30012022_11:58,Spiegel
Verwirrung um angebliches Karriereende von NFL-Superstar: Das Tom-Brady-Rätsel,https://www.spiegel.de/sport/tom-brady-irritationen-um-moegliches-karriereende-von-nfl-superstar-a-050f9d87-51e6-43c5-8050-2eb2a67c3ddf,30012022_11:57,Spiegel
Orkanböen: Sturmtief »Nadia« richtet schwere Schäden in Norddeutschland an,https://www.spiegel.de/panorama/nadia-sturmflut-in-hamburg-ausnahmezustand-in-berlin-a-4ee3e9a7-e4c6-47b4-b0bc-12677fe548d9,30012022_11:29,Spiegel
Ausnahmezustand: Blizzard treibt Schneemassen und eisige Kälte an US-Ostküste,https://www.spiegel.de/ausland/us-ostkueste-new-york-und-boston-wegen-blizzard-im-ausnahmezustand-a-a6903040-6de8-43c6-b072-31ba099bd1e3,30012022_10:27,Spiegel
Ohio: Mehrere Hotelgäste nach Vergiftung in kritischem Zustand,https://www.spiegel.de/panorama/ohio-mehrere-hotelgaeste-nach-vermeintlicher-kohlenmonoxidvergiftung-im-kritischen-zustand-a-b29b18fe-08a5-48cd-910f-7f82473cef04,30012022_10:06,Spiegel
Diffuse Haltung in Russlandkrise: Ischinger sieht Vertrauensverlust bei Bündnispartnern gegenüber Deutschland,https://www.spiegel.de/politik/deutschland/wolfgang-ischinger-viele-buendnispartner-haben-im-ukraine-konflikt-vertrauen-in-deutschland-verloren-a-d7ab210d-9502-44e1-a5d3-4573e2cc8a51,30012022_10:02,Spiegel
Der neunte Tag im Dschungelcamp: Annalena und Putin? No way!,https://www.spiegel.de/kultur/tv/dschungelcamp-auf-rtl-tag-neun-annalena-und-putin-no-way-a-67e4e8e1-f84b-432a-8e12-623b8ea37684,30012022_09:31,Spiegel
"Die Grünen nach dem Parteitag: Image poliert, Stimmung durchwachsen",https://www.spiegel.de/politik/deutschland/die-gruenen-nach-dem-parteitag-image-poliert-stimmung-durchwachsen-a-b9beb5da-7ecb-4a2a-b126-92e483d619df,30012022_09:16,Spiegel
Protest aus Südkorea und Japan: Nordkorea führt offenbar größten Raketentest seit 2017 durch,https://www.spiegel.de/ausland/nordkorea-offenbar-mit-groesstem-raketentest-seit-2017-suedkorea-und-japan-protestieren-a-ba950d77-7c72-4cfb-8aad-30737fbf42c1,30012022_08:31,Spiegel
Interview mit Finanzminister Lindner: »Die lassen wir nicht im Stich«,https://www.spiegel.de/politik/deutschland/finanzminister-christian-lindner-pocht-auf-diplomatische-loesung-in-der-krise-um-ukraine-a-4a4e1514-7824-46f0-83b2-746d89a8d48e,30012022_08:07,Spiegel
Angriff auf Zentrum der US-Demokratie: Trump stellt Kapitolstürmern Begnadigungen in Aussicht,https://www.spiegel.de/ausland/donald-trump-stellt-erstuermern-des-us-kapitols-begnadigungen-in-aussicht-a-4b397e81-3c1a-4e9d-876f-e57d2f5029d8,30012022_07:59,Spiegel
Schönes Ding: Citroën GS Camargue: Bonjour Raffinesse,https://www.spiegel.de/auto/fahrkultur/citroen-gs-camargue-bonjour-raffinesse-a-8ae74f0f-23d2-494a-9096-69d1759e0a51,30012022_07:42,Spiegel
+++ Corona-News am Sonntag +++: Giffey will Infizierte in Ausnahmefällen arbeiten lassen,https://www.spiegel.de/wissenschaft/medizin/corona-news-am-sonntag-sieben-tage-inzidenz-steigt-auf-1156-8-a-66274fc9-ecea-4174-8f8b-ef5c8fc81bd8,30012022_07:36,Spiegel
Stiftung Warentest: Powerbanks – welche taugen wirklich was?,https://www.spiegel.de/netzwelt/gadgets/powerbanks-im-test-welche-energieriegel-fuer-handy-tablet-und-notebook-sind-die-besten-a-bd6e9b48-318c-4d47-ad73-5f20fa4ea172,30012022_07:24,Spiegel
Folgen von Tief »Nadia«: Sturmnacht in Norddeutschland – Hunderte Einsätze von Feuerwehr und Polizei,https://www.spiegel.de/panorama/sturm-deutsche-bahn-unwetter-in-norddeutschland-hunderte-einsaetze-bahn-verbindungen-im-norden-beeintraechtigt-a-03ef7fbf-1e6f-4323-a36f-d16ee263989c,30012022_06:51,Spiegel
»Deutliche Botschaft an den Kreml«: Johnson will Zahl der britischen Soldaten in Osteuropa verdoppeln,https://www.spiegel.de/ausland/ukraine-konflikt-boris-johnson-will-zahl-der-britischen-soldaten-in-osteuropa-verdoppeln-deutliche-botschaft-an-den-kreml-a-c1dfcf82-662f-4eab-af4b-d22370c24cdd,30012022_00:28,Spiegel
Gemeinsames Manöver: Russland verlegt Militärtechnik nach Belarus,https://www.spiegel.de/ausland/russland-verlegt-militaertechnik-fuer-gemeinsames-manoever-nach-belarus-a-5fa5ce7e-a9c5-4ecf-ae7e-7c6aeddfa4e6,29012022_23:03,Spiegel
Unwetter in Norddeutschland: Sturm bringt Bahnverkehr durcheinander,https://www.spiegel.de/panorama/sturm-in-norddeutschland-unwetter-bringt-bahnverkehr-durcheinander-a-bafe72e1-8e1d-4a57-9b4e-0811d11cce42,29012022_22:22,Spiegel
Chaostage in Rom: Wie Italiens Präsidentenwahl zum absurden Theater wurde,https://www.spiegel.de/ausland/italien-wie-die-praesidentenwahl-zum-absurden-theater-wurde-a-b6ab67a7-2bf6-4a91-b75b-7dd0efd4869f,29012022_21:56,Spiegel
Football-Superstar: Tom Brady beendet offenbar seine Karriere,https://www.spiegel.de/sport/nfl-tom-brady-beendet-offenbar-seine-karriere-a-a2769865-a42d-4406-a4d6-eb5f888707d2,29012022_21:45,Spiegel
»Wir haben total Land unter wegen des Sturms«: Deutsche Bahn stellt Fernverkehr in Norddeutschland ein,https://www.spiegel.de/panorama/sturm-deutsche-bahn-stellt-fernverkehr-in-norddeutschland-ein-a-64ff2b7b-afcc-466c-a3fe-5748929b0bd5,29012022_21:10,Spiegel
"Thailands bekannteste Protestlerin: »Was der Knast kaputt macht, merkt man erst draußen«",https://www.spiegel.de/ausland/proteste-in-thailand-die-rebellin-die-keine-mehr-sein-will-a-92a007fc-041e-460d-99e9-0f9d69b1cefc,29012022_20:59,Spiegel
"Ian Anderson von Jethro Tull: »Nach dem Brexit dachte ich, man würde mich mit Flaschen bewerfen«",https://www.spiegel.de/kultur/musik/ian-anderson-von-jethro-tull-nach-dem-brexit-dachte-ich-man-wuerde-mich-mit-flaschen-bewerfen-a-43c3bf0f-c449-4851-8ab6-5d0614666762,29012022_20:49,Spiegel
Leipzig: Dutzende Teilnehmer eines Coronaprotestzugs stürmen auf Klinikgelände,https://www.spiegel.de/panorama/leipzig-dutzende-corona-gegner-stuermen-bei-protestmarsch-auf-klinikgelaende-a-3f2bf688-372f-4f23-ad26-7985af6b7231,29012022_20:35,Spiegel
Tagelanges Wahlchaos: Mattarella als Präsident Italiens wiedergewählt,https://www.spiegel.de/ausland/italien-sergio-mattarella-als-praesident-wiedergewaehlt-a-5465549f-f420-47e3-a677-182c87451baa,29012022_20:25,Spiegel
Wahlen zum Parteivorstand: Das ist die neue Grünenspitze,https://www.spiegel.de/politik/deutschland/ricarda-lang-omid-nouripour-emily-buening-das-ist-die-neue-gruenen-spitze-a-7a220cc0-4e62-4b3d-8e20-9a51fc4c030c,29012022_20:03,Spiegel
Australian-Open-Finalist Daniil Medwedew: Wird er wieder zum Partycrasher?,https://www.spiegel.de/sport/tennis/australian-open-finalist-daniil-medwedew-wird-er-gegen-rafael-nadal-wieder-zum-party-crasher-a-9059f4bc-bdf4-41af-8d4a-6a827983b973,29012022_19:42,Spiegel
"Serien-Meisterwerk »Station Eleven«: Was bleibt, wenn die Welt zusammenbricht?",https://www.spiegel.de/kultur/tv/station-eleven-was-bleibt-wenn-die-welt-zusammenbricht-a-1204ed4e-a4c7-49c7-9871-cc830d2e2738,29012022_19:30,Spiegel
Nur ein Durchgang in Willingen: Kobayashi trotzt dem Wind – Dämpfer für Geiger und Eisenbichler,https://www.spiegel.de/sport/wintersport/skispringen-in-willingen-ryoyu-kobayashi-trotzt-dem-wind-daempfer-fuer-karl-geiger-a-574dd38d-a839-4f70-950e-b4ef552a9cab,29012022_19:20,Spiegel
Führungswechsel bei den Grünen: »Das war natürlich ein Signal Richtung Volkspartei«,https://www.spiegel.de/politik/deutschland/ricarda-lang-und-omid-nouripour-neue-rolle-fuer-neue-chefs-der-gruenen-videoanalyse-a-b5d33879-82e6-40bb-8dc2-064f4d81dd5e,29012022_19:11,Spiegel
Warnung vor Orkanböen: Bahn stellt Fernverkehr in Norddeutschland ein – Sturmfluten erwartet,https://www.spiegel.de/panorama/sturm-in-norddeutschland-umgestuerzte-baeume-behindern-zugverkehr-sturmfluten-erwartet-a-65a6f458-7cb0-4658-bad2-53be4fa7cb9a,29012022_19:10,Spiegel
Nordrhein-Westfalen: Hendrik Wüsts Problem mit der Frauenförderung,https://www.spiegel.de/politik/deutschland/nrw-ministerpraesident-hendrik-wuests-problem-mit-der-frauenfoerderung-a-059563de-ae5f-4215-b349-b04aff29b0dc,29012022_18:58,Spiegel
"Wildcard-Doppel Kyrgios/Kokkinakis gewinnt Australian Open: »Hätten nicht gedacht, auch nur annähernd so weit zu kommen«",https://www.spiegel.de/sport/tennis/australian-open-nick-kyrgios-und-thanasis-kokkinakis-gewinnen-das-doppel-a-4650d641-071c-48af-85a4-5797e411c04e,29012022_18:47,Spiegel
The Eye of the Storm: Why Does Kyiv Seem So Strangely Calm?,https://www.spiegel.de/international/world/the-eye-of-the-storm-why-does-kyiv-seem-so-strangely-calm-a-2f0c96cd-e18f-4c34-ae2e-28bc933223fc,29012022_18:30,Spiegel
Podcast »Inside Austria«: Die unglaubliche Geschichte des Ibiza-Drahtziehers,https://www.spiegel.de/ausland/julian-hessenthaler-der-mann-der-hinter-dem-ibiza-video-steckte-podcast-a-0dd85ec7-9082-4e83-a9e9-76410091f769,29012022_18:19,Spiegel
Kapitalismus: Den Milliardären ist kein Vorwurf zu machen,https://www.spiegel.de/kultur/kapitalismus-den-milliardaeren-ist-kein-vorwurf-zu-machen-kolumne-a-83e7e741-04cc-49de-baff-d58399c041ae,29012022_18:09,Spiegel
Nachfolger von Baerbock und Habeck: Ricarda Lang und Omid Nouripour zu neuen Grünenvorsitzenden gewählt,https://www.spiegel.de/politik/parteitag-der-gruenen-ricarda-lang-und-omid-nouripour-zu-gruenenchefs-gewaehlt-a-e841a559-61cf-466f-bf67-2808d7be40e9,29012022_17:26,Spiegel
Streit über Inflationsrate: Erdoğan entlässt Chef der Statistikbehörde,https://www.spiegel.de/wirtschaft/recep-tayyip-erdogan-entlaesst-chef-der-statistikbehoerde-nach-streit-ueber-inflationsrate-a-2330b0e8-7c84-4312-877a-cb92b97f192f,29012022_16:57,Spiegel
Nachfolge von Baerbock und Habeck: Grüne wählen Ricarda Lang zur neuen Parteivorsitzenden,https://www.spiegel.de/politik/deutschland/gruene-waehlen-ricarda-lang-zur-neuen-parteivorsitzenden-a-75fe330b-f538-4c0e-ae49-69d6e5664be9,29012022_16:39,Spiegel
"Ashleigh Bartys Sieg bei Australian Open: Ein Kuss für die Frau, die ihre Karriere rettete",https://www.spiegel.de/sport/tennis/australian-open-warum-ashleigh-barty-ihre-karriere-auch-casey-dellacqua-verdankt-a-2693565c-b895-4d13-981c-abf936f407bb,29012022_16:35,Spiegel
NRW-Landtagswahl: Klimaliste soll den Linken ins Parlament verhelfen,https://www.spiegel.de/politik/deutschland/nrw-landtagswahl-klimaliste-tritt-mit-linken-an-a-485b0ee0-72a0-4669-9340-7b013b64db0d,29012022_15:54,Spiegel
"Sean Penn über Männlichkeit: »Feige Gene führen dazu, dass Männer Röcke tragen«",https://www.spiegel.de/panorama/leute/sean-penn-ueber-maennlichkeit-feige-gene-fuehren-dazu-dass-maenner-roecke-tragen-a-b4b6cb9a-6580-4004-92ed-acb5cc8c822d,29012022_15:44,Spiegel
Trotz hoher Inzidenzen: Österreich lockert Coronaregeln stufenweise,https://www.spiegel.de/ausland/oesterreich-lockert-stufenweise-coronamassnahmen-trotz-hoher-inzidenzen-a-cd33d6c8-6331-4bc1-9dcb-1600f84278b5,29012022_14:41,Spiegel
+++ Fußball-Transferticker +++: Juves 70-Millionen-Transfer bekommt Ronaldos Trikotnummer,https://www.spiegel.de/sport/fussball/fussball-transfers-vlahovic-geht-zu-juventus-alario-bleibt-in-leverkusen-a-ccd60877-d530-469b-8fde-5e5202413368,29012022_14:20,Spiegel
Aggression gegen Ukraine: Estlands Premierministerin warnt vor Zugeständnissen an Russland,https://www.spiegel.de/ausland/ukraine-krise-estnische-regierungschefin-warnt-vor-zugestaendnissen-an-russland-a-ae83f725-cafd-4c83-a892-a073aeaf52fc,29012022_14:04,Spiegel
Weinempfehlungen: Zehn gute Österreicher unter 15 Euro,https://www.spiegel.de/stil/weinempfehlungen-zehn-gute-oesterreicher-unter-15-euro-a-e1f6b2a8-f772-4a3a-91a6-5dc15ba77a42,29012022_13:59,Spiegel
Psychiater zum Eberl-Rücktritt: »Die hundertprozentige Identifikation mit einer Sache ist ein großer Risikofaktor«,https://www.spiegel.de/karriere/max-eberls-rueckzug-bei-borussia-moenchengladbach-ein-psychiater-ueber-burnout-und-die-folgen-a-af22cedc-2028-4ece-a6ae-4e738ddd635d,29012022_13:49,Spiegel
Nach »Partygate«: Parteiinterner Kritiker will Boris Johnson ablösen,https://www.spiegel.de/ausland/partygate-boris-johnsons-rivale-tom-tugendhat-will-premierminister-werden-a-6738108e-330b-4580-aa2a-80ec604a8c03,29012022_13:47,Spiegel
Impfpflicht im Seniorenheim: »Wir sollten dankbar sein. Was wären wir ohne Impfungen?«,https://www.spiegel.de/panorama/impfpflicht-im-seniorenheim-was-waeren-wir-ohne-impfungen-a-de9580a5-b853-4b28-b27a-2197c3646f10,29012022_12:59,Spiegel
Italien: Draghi bittet Mattarella um Verbleib im Präsidentenamt,https://www.spiegel.de/ausland/sergio-mattarella-premierminister-draghi-bittet-den-praesidenten-fuer-eine-zweite-amtszeit-zu-beiben-a-a645b6eb-4bb4-4043-b611-3fed2e4711ca,29012022_12:58,Spiegel
Universität Hongkong: China lässt Schriftzug zum Gedenken an Tiananmen-Proteste verschwinden,https://www.spiegel.de/ausland/universitaet-hongkong-schriftzug-zum-gedenken-an-tiananmen-proteste-abgedeckt-a-c69b5c3c-2d53-4cb3-af35-8c15e51ee6fa,29012022_12:53,Spiegel
Wegen Kremlnähe: Unionspolitiker fordert Schließung von Schröders Bundestagsbüro,https://www.spiegel.de/politik/deutschland/ukraine-konflikt-unionspolitiker-fordert-schliessung-von-gerhard-schroeders-bundestagsbuero-a-379a5e09-f113-45e4-aeba-6e6b0b49d6c6,29012022_12:38,Spiegel
Bei Augsburg: Autofahrer will mit fünf Euro Unfall »begleichen«,https://www.spiegel.de/panorama/gesellschaft/unfall-autofahrer-will-mit-fuenf-euro-schaden-begleichen-a-e74a9356-10da-4c86-a04d-847a8b664834,29012022_11:31,Spiegel
Sieg im Finale: Ashleigh Barty gewinnt Australian Open – als erste Australierin seit 1978,https://www.spiegel.de/sport/tennis/australian-open-ashleigh-barty-gewinnt-als-erste-australierin-seit-1978-a-ed5dc47c-39d7-4136-8ea4-413913b98e36,29012022_11:22,Spiegel
"Grünen-Schatzmeister zur Boni-Affäre: »Das Thema dreimal behandeln zu müssen, ist politische Höchststrafe«",https://www.spiegel.de/politik/deutschland/gruene-schatzmeister-marc-urbatsch-bedauert-corona-zahlungen-an-parteispitze-a-d845fadc-4bc9-4a48-ae70-4c0ed124e3f4,29012022_10:55,Spiegel
"Olympia, Neujahr, Omikron: Jetzt kommt die härteste Probe für Chinas Coronapolitik",https://www.spiegel.de/ausland/olympia-neujahr-omikron-jetzt-kommt-die-haerteste-probe-fuer-chinas-corona-politik-a-e5dec264-1581-4e5d-88b9-741c180a30c3,29012022_10:38,Spiegel
Amerikanischer Bürgerrechtsaktivist Barber: »Dies ist die Zeit für offene Türen und Druck von der Straße«,https://www.spiegel.de/ausland/william-barber-buergerrechtler-in-den-usa-ueber-politik-joe-biden-und-aktivismus-a-59d8b32e-02df-4cb8-93e9-05d866003b13,29012022_10:16,Spiegel
"Elementarteilchen: Schöner, wenn es der Arzt erlaubt",https://www.spiegel.de/wissenschaft/schoenheitschirurgie-tierdemenz-luxus-toiletten-die-lese-empfehlungen-der-woche-a-5ad466e9-0112-4b3d-9516-2fc44c9ede32,29012022_10:00,Spiegel
Aus wegen Coronaflaute: Wie Nachwuchspiloten der Lufthansa um ihre Ausbildung kämpfen,https://www.spiegel.de/start/lufthansa-warum-nachwuchs-piloten-gegen-ihre-abgebrochene-ausbildung-klagen-a-287eb651-bfc9-4e41-bd31-b289d6e309a0,29012022_09:55,Spiegel
Über März hinaus: Habeck stellt Verlängerung der Coronahilfen in Aussicht,https://www.spiegel.de/wirtschaft/robert-habeck-kuendigt-moegliche-verlaengerung-der-coronahilfen-an-a-cd7ce080-deb7-445d-8326-c89859b42b30,29012022_09:47,Spiegel
Beziehungen: Wie wir lernen zu lieben,https://www.spiegel.de/partnerschaft/beziehungen-wie-wir-lernen-zu-lieben-podcast-mit-jens-corssen-a-b2bce1a0-0af3-4b6c-828d-63f789dca7fd,29012022_09:39,Spiegel
Debatte über geplantes Gesetz: CDU für Impfpflicht mit zeitlicher Begrenzung,https://www.spiegel.de/politik/deutschland/cdu-gesundheitssprecher-impfpflicht-nur-mit-zeitlicher-begrenzung-a-cef77e25-1e8d-43b6-ad0e-7c4b6b3b214d,29012022_09:27,Spiegel
Solidarität mit Neil Young: Auch Joni Mitchell will ihre Musik von Spotify abziehen,https://www.spiegel.de/kultur/musik/joni-mitchell-sie-folgt-neil-young-und-entfernt-ihre-musik-von-spotify-a-d22217b4-57d3-4ef7-8cc2-25e4e20b5198,29012022_09:21,Spiegel
