Titel,URL,Date_Info,News_page,Kategorie,author+++ Corona-News +++: Wieder Demonstrationen gegen Coronamaßnahmen,https://www.spiegel.de/wissenschaft/medizin/coronavirus-news-am-samstag-die-wichtigsten-entwicklungen-zu-sars-cov-2-und-covid-19-a-3f7c0c9d-29e1-4348-afdc-fab010b68e2f,05022022_05:10,Spiegel,wissenschaft,
Halbfinale von RTL-Show: Harald Glööckler und Peter Althof fliegen aus dem Dschungelcamp,https://www.spiegel.de/kultur/tv/rtl-dschungelcamp-harald-gloeoeckler-und-peter-althof-verpassen-das-finale-a-d2af64b7-2c75-4ded-a73e-a53a73108d69,05022022_03:56,Spiegel,kultur,
Atomdeal: USA gewähren Iran Sanktionserleichterungen,https://www.spiegel.de/ausland/atomprogramm-usa-gewaehren-iran-sanktionserleichterungen-a-b2391bea-49a6-47c3-8814-98110cd868b2,05022022_03:31,Spiegel,ausland,
Aus im FA Cup: Ronaldos Elfmeter-Fehlschuss leitet Uniteds Pokalblamage ein,https://www.spiegel.de/sport/fussball/fa-cup-manchester-united-verliert-nach-elfmeterschiessen-gegen-middlesbrough-a-3f995db6-90f6-41f1-98a3-b7ad70d4bb67,05022022_01:19,Spiegel,sport,
Neue Bildungsministerin Stark-Watzinger: »Eine Grundgesetzänderung wäre die klarste Lösung«,https://www.spiegel.de/panorama/bildung/bettina-stark-watzinger-eine-grundgesetz-aenderung-waere-die-klarste-loesung-a-d0b7c297-02f3-48fa-a7d0-b305edb39347,05022022_00:15,Spiegel,panorama,"Ein Interview von Armin Himmelrath, Veit Medick und Miriam Olbrisch"
"Rapper Hendrik Bolz und seine Jugend im Osten: Wie ist das, wenn man merkt, dass man früher ein Arschloch war?",https://www.spiegel.de/kultur/literatur/hendrik-bolz-von-zugezogen-maskulin-erzaehlt-von-seiner-jugend-im-osten-der-nullerjahre-a-e2f1b64b-7d73-48ee-b215-0940ea22700c,05022022_00:14,Spiegel,kultur,Von Xaver von Cranach
Weitergabe von Staatsgeheimnissen?: Chef des dänischen Geheimdiensts muss in Haft bleiben,https://www.spiegel.de/ausland/daenemark-chef-des-geheimdienstes-lars-findsen-muss-in-haft-bleiben-a-93791539-2230-4c87-97b6-eae0b1cb9e1f,04022022_23:20,Spiegel,ausland,
Wohnzimmer-Begegnung: Wildschwein macht es sich auf Couch gemütlich,https://www.spiegel.de/panorama/gesellschaft/hagen-in-nrw-frau-stoesst-auf-wildschwein-im-wohnzimmer-a-c084822d-ef84-4a09-9cb3-4e4c60d77212,04022022_23:05,Spiegel,panorama,
Mike Pence geht auf Distanz zu seinem Ex-Chef: »Trump hat unrecht«,https://www.spiegel.de/ausland/mike-pence-donald-trump-hat-unrecht-a-18b93859-08de-41dc-b4dd-55f7fa888487,04022022_22:57,Spiegel,ausland,
Remis gegen den VfL Bochum: Belfodils Kopfballtreffer ist für die Hertha zu wenig,https://www.spiegel.de/sport/fussball/fussball-bundesliga-hertha-bsc-spielt-remis-gegen-den-vfl-bochum-a-a5fec0bb-c331-445a-91c2-07088b7300db,04022022_22:22,Spiegel,sport,
Gepanschtes Kontrastmittel: Sieben Röntgen-Patienten in Russland gestorben,https://www.spiegel.de/panorama/justiz/russland-sieben-roentgen-patienten-gestorben-gepanschtes-kontrastmittel-a-08e18c09-e356-46e7-8f2f-836fd77b60ef,04022022_22:07,Spiegel,panorama,
Offizielles Parteidokument: Republikaner nennen Angriff auf Kapitol »legitimen politischen Diskurs«,https://www.spiegel.de/ausland/usa-republikaner-nennen-angriff-auf-kapitol-legitimen-politischen-diskurs-a-ea171b06-4a8b-4f20-93bc-fdeec53a2ed0,04022022_21:45,Spiegel,ausland,
Hamburg: Zeugen bescheinigen Finanzbehörde ungewöhnlichen Umgang mit Cum-Ex,https://www.spiegel.de/wirtschaft/soziales/hamburg-zeugen-bescheinigen-finanzbehoerde-ungewoehnlichen-umgang-mit-cum-ex-a-7245a2bd-73eb-4bb1-8eac-2650232245f4,04022022_21:39,Spiegel,wirtschaft,
Vierte Coronaspritze: Plötzlich ist die Stiko ganz schnell – wieso?,https://www.spiegel.de/wissenschaft/medizin/corona-und-die-vierte-impfung-fuer-wen-ein-zweiter-booster-sinnvoll-ist-a-bfa690f2-8bf1-44cd-8681-3fce27f7592a,04022022_20:53,Spiegel,wissenschaft,Von Julia Merlot
Olympische Coronaspiele: Der nette Barkeeper mit dem Seuchenanzug,https://www.spiegel.de/ausland/olympia-sicherheitsmassnahmen-der-nette-barkeeper-mit-dem-seuchenanzug-a-2fce27a9-482b-46bd-9fd2-dc6760500263,04022022_20:53,Spiegel,ausland,
Dreck und Schäden im Stadion: Der VfB Stuttgart hat ein Fuchsproblem,https://www.spiegel.de/sport/fussball/mercedes-benz-arena-in-stuttgart-dreck-und-schaeden-fuechse-sorgen-fuer-aerger-a-45d93297-8f27-4a67-9f00-a460476ac46e,04022022_20:48,Spiegel,sport,
0:5 in der 2. Fußball-Bundesliga: Nürnberg kommt gegen Schlusslicht Ingolstadt unter die Räder,https://www.spiegel.de/sport/fussball/2-fussball-bundesliga-1-fc-nuernberg-kommt-gegen-schlusslicht-fc-ingolstadt-0-5-unter-die-raeder-a-79efb540-0527-4dd1-ba70-b5720aee56f6,04022022_20:40,Spiegel,sport,
Wegen Verkürzung des Genesenenstatus: FDP rückt von RKI-Chef Wieler ab,https://www.spiegel.de/politik/deutschland/fdp-rueckt-von-rki-chef-lothar-wieler-ab-a-beaddf8d-5554-40bc-9727-3e18e39fca62,04022022_20:19,Spiegel,politik,Von Severin Weiland
Beijing Policy Slowly Crystalizes: Government in Berlin Classifies China as a “Systemic Rival”,https://www.spiegel.de/international/world/germany-rethinks-position-on-beijing-government-in-berlin-classifies-china-as-a-systemic-rival-a-57cf368a-79e9-41f2-8121-73654f3c6c7c,04022022_19:51,Spiegel,international,By Christoph Schult und Gerald Traufetter
Annahmeschwelle verfehlt: Übernahme der Aareal Bank gescheitert,https://www.spiegel.de/wirtschaft/unternehmen/aareal-bank-uebernahme-durch-finanzinvestoren-gescheitert-a-deeea050-709d-4a89-89b7-333340cb8676,04022022_19:33,Spiegel,wirtschaft,
Zum Tod von Dieter Mann: Die Kunst der schmalen Lippe,https://www.spiegel.de/kultur/dieter-mann-nachruf-die-kunst-der-schmalen-lippe-a-5c0f5426-41ed-4fd5-b8d4-37e67323183a,04022022_19:32,Spiegel,kultur,Von Wolfgang Höbel
Eröffnung der Olympischen Winterspiele: Eine verlogene Party,https://www.spiegel.de/sport/olympia/olympia-2022-die-eroeffnungsfeier-ist-eine-verlogene-party-a-abb4130a-dc4f-4dfe-b153-3998a7c38544,04022022_19:19,Spiegel,sport,Aus Peking berichtet Marcus Krämer
Spannungen in Osteuropa: Erste US-Verstärkungstruppen in Deutschland eingetroffen,https://www.spiegel.de/ausland/ukraine-krise-erste-us-verstaerkungstruppen-in-deutschland-angekommen-a-937acd3a-56e7-4114-95b6-76ff9e0ba244,04022022_19:05,Spiegel,ausland,
“We Really Have Other Problems”: What Do Russians Near the Border Think of a Possible Ukraine Invasion?,https://www.spiegel.de/international/world/russia-what-do-russians-near-the-border-think-of-a-possible-ukraine-invasion-a-47a08fc2-3034-4abd-bcfb-711fd0d495da,04022022_18:46,Spiegel,international,By Christina Hebel in Rostov-on-Don
Tod eines IS-Führers: Trotz Schattendasein erwischt,https://www.spiegel.de/ausland/islamischer-staat-in-syrien-toetung-des-is-chefs-trotz-schattendasein-erwischt-a-e724b3fb-10ab-48f0-a610-7121d895ba56,04022022_18:38,Spiegel,ausland,Von Monika Bolliger
Smartphone-Bank: Staatsanwaltschaft ermittelt offenbar gegen N26-Manager,https://www.spiegel.de/wirtschaft/unternehmen/n26-staatsanwaltschaft-ermittelt-offenbar-gegen-n26-manager-a-b0a8ddec-10f1-4acf-8e6d-8eb89c408d93,04022022_18:33,Spiegel,wirtschaft,
Acht Milliarden – Der Auslands-Podcast: Dafür braucht China die Olympischen Spiele,https://www.spiegel.de/ausland/olympia-in-china-dafuer-braucht-china-die-olympischen-spiele-podcast-a-e364ef3f-14fe-418a-adf6-2e153f2f87a5,04022022_18:30,Spiegel,ausland,Von Olaf Heuser
Kolonialkunst: Köln will Benin-Bronzen an Nigeria zurückgeben,https://www.spiegel.de/kultur/koeln-will-benin-bronzen-an-nigeria-zurueckgeben-a-63a31cc1-1a66-47ad-b12b-6e6c5c8a7152,04022022_18:26,Spiegel,kultur,
»Das ist nicht zu fassen«: Nashornsterben im Erfurter Zoo – Ursache noch unklar,https://www.spiegel.de/panorama/erfurter-zoo-zwei-nashoerner-tot-ursache-noch-unklar-a-637af475-9717-4f78-90bc-e52d6887a523,04022022_18:19,Spiegel,panorama,
Die Lage am Abend: Die Akte Maaßen,https://www.spiegel.de/politik/deutschland/news-des-tages-hans-georg-maassen-nato-und-russland-joe-kaeser-a-0ae5262d-d928-4018-88b4-7c5602604991,04022022_17:59,Spiegel,politik,
Moraltheologe über Zölibat-Lockerung: »Priester werden einsamer«,https://www.spiegel.de/panorama/gesellschaft/zoelibat-lockerung-in-der-katholischen-kirche-der-kardinal-lernt-aus-den-zeichen-der-zeit-a-9dbfb391-69c1-4a36-b427-f86193b30abf,04022022_17:52,Spiegel,panorama,Ein Interview von Alexander Preker
"»Tatort« aus Köln: »Der Arzt, dem die Sauen vertrauen«",https://www.spiegel.de/kultur/tv/tatort-vier-jahre-aus-koeln-der-arzt-dem-die-sauen-vertrauen-a-c888ada4-e846-4dc4-ba89-bed983980f51,04022022_17:49,Spiegel,kultur,Von Christian Buß
Offener Brief zum Russland-Ukraine-Konflikt: 350 Kulturschaffende fordern den Abzug russischer Truppen,https://www.spiegel.de/kultur/russland-ukraine-konflikt-kuenstler-fordern-in-einer-erklaerung-sofortigen-abzug-der-russischen-truppen-a-038c5abd-dd65-4389-9453-52ca68792a2c,04022022_17:48,Spiegel,kultur,
Nach über zehn Jahren: EU und USA handeln wieder mit Muscheln,https://www.spiegel.de/wirtschaft/aussenhandel-eu-und-usa-handeln-wieder-mit-muscheln-a-b6b45167-f4c4-4042-b060-bab9c6f41704,04022022_17:37,Spiegel,wirtschaft,
Mali: EU verhängt Sanktionen gegen Interims-Premierminister,https://www.spiegel.de/ausland/mali-eu-beschliesst-sanktionen-gegen-interims-premierminister-a-ee474aaf-3406-44bf-b094-8656381c6a8a,04022022_17:35,Spiegel,ausland,
"Informationspolitik der Biden-Regierung: Wir sind die Guten, vertraut uns",https://www.spiegel.de/ausland/ned-price-und-jen-psaki-das-mauern-der-regierung-von-joe-biden-a-59f5c7a0-bfe5-4988-9585-37d1193181e4,04022022_17:22,Spiegel,ausland,Von Alexander Sarovic
Chipmangel: Volkswagen will fast alle Nachtschichten im Stammwerk streichen,https://www.spiegel.de/wirtschaft/unternehmen/volkswagen-will-fast-alle-nachtschichten-im-stammwerk-streichen-a-e958526c-544b-4ecf-bcef-d8dfd251a58f,04022022_17:20,Spiegel,wirtschaft,
Tiroler Berge: Fünf Menschen kommen bei Lawinenunglück ums Leben,https://www.spiegel.de/panorama/gesellschaft/tirol-fuenf-menschen-kommen-bei-lawinenunglueck-ums-leben-a-aad55dcf-379f-46e8-95e9-f395e00e016d,04022022_17:16,Spiegel,panorama,
"Fotos von der Eröffnungsfeier: Das Stadion leuchtet, Xi strahlt",https://www.spiegel.de/sport/olympia/olympia-2022-die-eroeffnungszeremonie-in-peking-fotostrecke-a-2b02a083-af2c-4ca0-ba86-1ea6e70721d3,04022022_17:01,Spiegel,sport,
Ukraine: Baerbock will an die Donbass-Front reisen,https://www.spiegel.de/politik/deutschland/ukraine-annalena-baerbock-will-an-die-front-reisen-a-99cff059-18a8-446a-bd8a-a90eb29cb752,04022022_16:43,Spiegel,politik,
Impfstoffe gegen Corona: Ein Moderna-Klon aus Afrika,https://www.spiegel.de/wissenschaft/medizin/corona-eine-firma-in-suedafrika-stellt-eine-piratenversion-des-moderna-impfstoffes-her-a-67359d1c-e98b-4755-b264-b745fa120fb2,04022022_16:42,Spiegel,wissenschaft,Von Marco Evers
Hessen: Renitenter Zigarillo-Raucher bringt ICE zum Halten,https://www.spiegel.de/panorama/hessen-renitenter-zigarillo-raucher-bringt-ice-zum-halten-a-56ab0465-8efe-409c-8479-aac220773756,04022022_16:27,Spiegel,panorama,
WM-Held von 1954: Horst Eckel soll wohl kein Ehrengrab bekommen,https://www.spiegel.de/panorama/leute/horst-eckel-fussball-held-von-1954-soll-wohl-kein-ehrengrab-bekommen-a-fb670116-d06f-4003-b477-d9d2914a5098,04022022_16:12,Spiegel,panorama,
Konflikte um Windkraftausbau: Abstand nehmen von Abstandsregeln,https://www.spiegel.de/wissenschaft/mensch/sachverstaendigenrat-was-passieren-muss-damit-der-ausbau-der-windenergie-vorangeht-a-10387d84-b2f0-4c4b-92a6-1c5d6c5870e3,04022022_16:05,Spiegel,wissenschaft,Von Viola Kiel
Auf dem Flohmarkt: Händler erstand Albrecht-Dürer-Werk für 30 Dollar,https://www.spiegel.de/kultur/haendler-erstand-albrecht-duerer-werk-fuer-30-dollar-auf-flohmarkt-a-77cc5e1f-a15b-443d-8d59-c56ec2ec3623,04022022_16:02,Spiegel,kultur,
Eröffnung der Olympischen Winterspiele: Zurückhaltung im Vogelnest,https://www.spiegel.de/sport/olympia/olympia-2022-die-winterspiele-in-peking-sind-offiziell-eroeffnet-zurueckhaltung-im-vogelnest-a-9258b3eb-fc4e-441b-acad-a9c075c053a6,04022022_15:53,Spiegel,sport,
Wilhelmshaven: Trauriger Pfau löst Polizeieinsatz aus,https://www.spiegel.de/panorama/wilhelmshaven-trauriger-pfau-loest-polizeieinsatz-aus-a-bbb40923-3508-46c0-837b-43391d70d817,04022022_15:48,Spiegel,panorama,
IOC-Boss Bach und sein Bezug auf »Hamlet«: Es ist was faul im Staate China,https://www.spiegel.de/sport/olympia/olympia-2022-thomas-bach-beruft-sich-auf-hamlet-es-ist-was-faul-im-staate-china-a-caea9955-fd91-4354-8ac1-ccd5d150b68c,04022022_15:47,Spiegel,sport,Von Peter Ahrens
Kleinwagen größer als gedacht: Steigen 20 Frauen in einen Trabi – Weltrekord,https://www.spiegel.de/panorama/zwickau-steigen-20-frauen-in-einen-trabi-weltrekord-a-3d68c819-2a20-401b-8e44-42d732b12e16,04022022_15:44,Spiegel,panorama,
Streit zwischen SPD und Grünen: Union kritisiert Verzögerung bei Wahl neuer Geheimdienstkontrolleure,https://www.spiegel.de/politik/deutschland/spd-und-gruene-streiten-union-kritisiert-verzoegerung-bei-wahl-neuer-geheimdienstkontrolleure-a-06bd5be3-e824-461a-afd5-f1f3edc00502,04022022_15:37,Spiegel,politik,
TK-Film zu Krebsvorsorge: Hüter der Hoden,https://www.spiegel.de/gesundheit/techniker-krankenkasse-video-ueber-krebs-vorsorge-hueter-der-hoden-a-8e46a0a4-080c-4c1e-a683-6517f3e810bf,04022022_15:23,Spiegel,gesundheit,
Statt E-Auto-Prämie: Autoexperte fordert Strafsteuer auf Verbrenner,https://www.spiegel.de/auto/elektroautos-wuerden-besser-gestellt-ferdinand-dudenhoeffer-fordert-strafsteuer-auf-verbrenner-a-28420fc9-7f3e-46c7-a7cf-f53bc61a3f6f,04022022_15:20,Spiegel,auto,
Album der Woche mit Mitski: Flashdance im Irrgarten der Seele,https://www.spiegel.de/kultur/musik/mitski-jazz-butcher-yeule-black-country-new-road-abgehoert-album-der-woche-a-130e00a7-c430-4b25-83bb-f8ec62e5f594,04022022_15:19,Spiegel,kultur,Von Andreas Borcholte
Ex-Kanzler und Gaslobbyist: Gerhard Schröder soll in Gazprom-Aufsichtsrat einziehen,https://www.spiegel.de/ausland/gerhard-schroeder-soll-in-gazprom-aufsichtsrat-einziehen-a-12350b39-af36-4e52-ad4b-47fecb894cfd,04022022_15:04,Spiegel,ausland,
Bewährungs- und Geldstrafe: Landgericht Mannheim verurteilt Waffen hortenden »Druiden«,https://www.spiegel.de/panorama/justiz/mannheim-landgericht-verurteilt-waffen-hortenden-druiden-zu-bewaehrungs-und-geldstrafe-a-334c93a5-5bc2-49c5-8711-8402ba406ae4,04022022_14:16,Spiegel,panorama,
Neuseeland aus der Vogelperspektive: Bergpapagei filmt seinen Flug mit gestohlener Kamera,https://www.spiegel.de/reise/fernweh/neuseeland-aus-der-vogelperpektive-bergpapagei-filmt-seinen-flug-mit-gestohlener-kamera-a-a9d6f3b0-0d5d-4bb8-aab6-f52b185046e3,04022022_14:13,Spiegel,reise,
Nach SPIEGEL-Bericht: Ampelpolitiker kritisieren Brutalität des griechischen Grenzschutzes,https://www.spiegel.de/ausland/griechenland-ampelpolitiker-kritisieren-brutalitaet-des-grenzschutzes-a-73003db4-56cd-47c7-ad90-0553bf0b017f,04022022_14:04,Spiegel,ausland,
Nach Kiew-Besuch: Erdoğan vermisst Führungsfigur wie Merkel in Konflikt um die Ukraine,https://www.spiegel.de/ausland/recep-tayyip-erdogan-vermisst-fuehrungsfigur-wie-angela-merkel-in-ukraine-konflikt-a-16c453ba-6c0b-43b2-9440-f689ab50d003,04022022_13:49,Spiegel,ausland,
Gedenkgottesdienst für getötete Polizisten: »Das lässt mich im Glauben an die Menschheit zweifeln«,https://www.spiegel.de/panorama/justiz/kusel-gedenkgottestdienst-fuer-getoetete-polizisten-die-gemeinde-ist-schockiert-a-87fc84a2-d153-4d5d-8f9b-fdcc430bf7c9,04022022_13:42,Spiegel,panorama,
Zwölf Jahre nach Eskalation der Finanzkrise: Griechenland will letzte Schulden beim IWF tilgen,https://www.spiegel.de/wirtschaft/griechenland-will-letzte-schulden-beim-iwf-tilgen-a-ce01abb5-77b9-41c5-bc81-c43c80b76544,04022022_13:30,Spiegel,wirtschaft,
Familien in der Pandemie: Vater darf gemeinsame Kinder gegen den Willen seiner Ex-Frau impfen lassen,https://www.spiegel.de/panorama/justiz/corona-impfung-bei-kindern-vater-darf-gemeinsame-kinder-gegen-den-willen-seiner-ex-frau-impfen-lassen-a-94200a79-68f9-4fae-a24a-32053701da6f,04022022_13:28,Spiegel,panorama,
"Marihuana, Haschisch und Kokain: Rentnerin hütete Drogen ihres Nachbarn",https://www.spiegel.de/panorama/justiz/ruesselsheim-rentnerin-hortet-offenbar-drogen-ihres-nachbarn-a-3dff4c52-d609-441f-855c-1453cf8100ed,04022022_13:23,Spiegel,panorama,
TV-Einschaltquoten: Zum Staffelstart holt »GNTM« Topquote,https://www.spiegel.de/kultur/tv/gntm-holt-topeinschaltquoten-das-rennen-machen-andere-a-67181342-20d0-48ac-8a4a-3a3ffc98b07e,04022022_13:20,Spiegel,kultur,
Corona-News am Freitag: In Österreich tritt allgemeine Impfpflicht in Kraft,https://www.spiegel.de/wissenschaft/medizin/corona-news-am-freitag-krebshilfe-erwartet-ab-ende-des-jahres-erhoehte-sterblichkeit-a-f433558f-66b5-4c97-b780-b3b6092c3776,04022022_13:15,Spiegel,wissenschaft,
Ransomware-Attacke auf Swissport: Hackerangriff stört zeitweise Flugbetrieb in der Schweiz,https://www.spiegel.de/netzwelt/web/swissport-hackerangriff-stoert-zeitweise-flugbetrieb-in-der-schweiz-a-44285ac8-ad73-42ea-b751-91559c2ff4c8,04022022_13:10,Spiegel,netzwelt,
Ungeimpfte AfD-Abgeordnete im Bundestag: Die da oben,https://www.spiegel.de/politik/deutschland/ungeimpfte-afd-abgeordnete-im-bundestag-die-da-oben-a-d7d265ac-72ad-42c4-ae8b-4257082ee1d3,04022022_13:00,Spiegel,politik,
So gesehen: Scholz greift ein,https://www.spiegel.de/politik/deutschland/scholz-greift-ein-a-2083fbe1-6d9e-4374-8274-7be35f0e976c,04022022_13:00,Spiegel,politik,
Verdächtiger im Fall Kusel: Das gesetzlose Leben des Andreas S.,https://www.spiegel.de/panorama/justiz/kusel-tatverdaechtiger-im-polizistenmord-war-offenbar-professioneller-wilderer-a-957739a4-66c0-4037-8656-a9e6037fb187,04022022_13:00,Spiegel,panorama,
Geplantes Strategiepapier der Ampel: Bundesregierung stuft China als »systemischen Rivalen« ein,https://www.spiegel.de/ausland/deutschland-und-china-bundesregierung-stuft-peking-als-systemischen-rivalen-ein-a-11c41ab1-dc07-43ee-8881-bf3658850f66,04022022_13:00,Spiegel,ausland,Von Christoph Schult und Gerald Traufetter
Mali-Mission der Bundeswehr: Warum der deutsche Einsatz im Sahel zu scheitern droht,https://www.spiegel.de/ausland/mali-mission-der-bundeswehr-warum-der-deutsche-einsatz-im-sahel-zu-scheitern-droht-a-af18deeb-45de-4d46-96ab-de133bb75d6a,04022022_13:00,Spiegel,ausland,"Von Matthias Gebauer, Heiner Hoffmann und Patricia Huon"
Bundesländer: Rechtsextreme nutzen laut Innenministerien gezielt Presseausweise,https://www.spiegel.de/politik/deutschland/rechtsextreme-nutzen-laut-innenministerien-gezielt-presseausweise-a-62a070ff-236e-416e-9e7a-2e528dcdd8fa,04022022_13:00,Spiegel,politik,
»Ewiger Staatssekretär« im Finanzministerium: Die Tricks und Kniffe des Herrn Gatzer,https://www.spiegel.de/politik/deutschland/werner-gatzer-im-finanzministerium-die-tricks-und-kniffe-des-ewigen-staatssekretaers-a-0643d43a-5bb8-4839-97ed-9941eb3ec6c4,04022022_13:00,Spiegel,politik,Von Christian Reiermann
Zum Platinjubiläum der Queen: Die Beherrschte,https://www.spiegel.de/ausland/queen-elizabeth-ii-und-ihr-70-thronjubilaeum-die-beherrschte-a-866c7a72-41cb-4d68-b874-16c5128d8f0b,04022022_13:00,Spiegel,ausland,"Von Jörg Schindler, London"
AfD nach Meuthens Austritt: Jetzt »rein« völkisch,https://www.spiegel.de/politik/deutschland/afd-nach-austritt-von-joerg-meuthen-was-die-voelkischen-jetzt-mit-der-partei-vorhaben-a-6a89045f-1f8c-46e9-8733-2ebac552e681,04022022_13:00,Spiegel,politik,Von Ann-Katrin Müller und Severin Weiland
Kriminalität: Verdächtiger im Fall Madeleine McCann stellt Strafanzeige gegen TV-Journalistin,https://www.spiegel.de/politik/deutschland/verdaechtiger-im-fall-madeleine-mccann-stellt-strafanzeige-gegen-tv-journalistin-a-61f890b4-b910-490e-92d6-db08bfcb7578,04022022_13:00,Spiegel,politik,
Geldanlagen: 77 Prozent der 16- bis 29-Jährigen sorgen bereits fürs Alter vor,https://www.spiegel.de/wirtschaft/77-prozent-der-16-bis-29-jaehrigen-sorgen-bereits-fuers-alter-vor-a-ca37dc1b-985f-42e9-a751-126d4a518a38,04022022_13:00,Spiegel,wirtschaft,
Patente: SAP-Rivale Teradata geht in Berufung,https://www.spiegel.de/wirtschaft/sap-rivale-teradata-geht-in-berufung-a-3b2abd0d-1e01-4baf-97a8-db8674b003ed,04022022_13:00,Spiegel,wirtschaft,
Bundesversammlung: »Durchs ganze Land nach Berlin«,https://www.spiegel.de/politik/deutschland/durchs-ganze-land-nach-berlin-a-f69ce45d-cf41-47e7-99d3-65b60a7cbd84,04022022_13:00,Spiegel,politik,Ein Interview von Katharina Horban
Verfrühte Rente: Linken-Fraktionsgeschäftsführer gibt einen Monat vor Rente seinen Posten ab,https://www.spiegel.de/politik/deutschland/linken-fraktionsgeschaeftsfuehrer-gibt-einen-monat-vor-rente-seinen-posten-ab-a-34bfe759-bb59-4560-8dd0-044494742113,04022022_13:00,Spiegel,politik,
Pipelines: Ex-Diplomat Haller gibt Posten bei Nord-Stream-2-Tochter auf,https://www.spiegel.de/politik/deutschland/ex-diplomat-haller-gibt-posten-bei-nord-stream-2-tochter-auf-a-e8d63593-529c-4ca4-913d-cec59a50d697,04022022_13:00,Spiegel,politik,
"Warum Marine Le Pen hofft, französische Präsidentin zu werden: Ihre letzte Schlacht",https://www.spiegel.de/ausland/frankreich-warum-marine-le-pen-hofft-praesidentin-zu-werden-a-84eb28a5-4fa0-4005-b0dd-95c8946c4c54,04022022_13:00,Spiegel,ausland,"Von Britta Sandberg, Paris"
Von Eschweiler nach New York: Eine Hochstaplerin macht Karriere,https://www.spiegel.de/panorama/gesellschaft/anna-sorokin-eine-hochstaplerin-macht-karriere-a-358512cf-eff4-4c6c-b18a-fc80ee6a5f0e,04022022_13:00,Spiegel,panorama,Von Philipp Oehmke
Konfrontation mit Putin: Wollen die Deutschen noch Helden sein?,https://www.spiegel.de/kultur/ukraine-krise-konfrontation-mit-putin-wollen-die-deutschen-noch-helden-sein-a-613e8763-0f1d-433a-85b8-994709e2bfd3,04022022_13:00,Spiegel,kultur,
Coronamaßnahmen in Deutschland: Wie viel Kopfschütteln ist gesund?,https://www.spiegel.de/politik/deutschland/corona-massnahmen-in-deutschland-vorsicht-ist-gut-eigenverantwortung-besser-a-6d42a446-edea-4f23-8d95-f0993b3f3419,04022022_13:00,Spiegel,politik,
Promis verdingen sich als Aufsager von Grußbotschaften: Ein Heiratsantrag von Roberto Blanco für 100 Euro,https://www.spiegel.de/wirtschaft/roberto-blanco-andreas-brehme-tine-wittler-promis-verdingen-sich-als-aufsager-von-grussbotschaften-a-7828f975-5a21-42b0-8b9f-a9e483a6e06f,04022022_13:00,Spiegel,wirtschaft,Von Alexander Kühn und Anton Rainer
Corona-Protesttaktik: Spazierkampf,https://www.spiegel.de/panorama/gesellschaft/corona-proteste-warum-der-rechtsstaat-sich-mit-den-spaziergaengern-so-schwertut-a-c2ddcb8e-3c94-45d1-bde8-8bb6136fd050,04022022_13:00,Spiegel,panorama,"Von Jan Friedmann, Dietmar Hipp und Ansgar Siemens"
Lamborghini gegen Skoda auf der A66: Die tödliche Gefahr von der linken Spur,https://www.spiegel.de/panorama/a-66-warum-die-justiz-nach-einem-toedlichen-unfall-gegen-drei-raser-und-einen-pfarrer-ermittelt-a-98f1fe79-3295-4f1d-b64e-2a785c7647ae,04022022_13:00,Spiegel,panorama,Von Bruno Schrep
Long-Covid-Patienten nach der Impfung: Wenn die Qual von vorn beginnt,https://www.spiegel.de/gesundheit/long-covid-und-impfungen-wenn-die-qual-von-vorne-beginnt-a-397efb37-6947-475a-9c23-285ee97b754a,04022022_13:00,Spiegel,gesundheit,Von Katherine Rydlink
"Forscherin über ihr Familiennamen-Wörterbuch: Müller, Meier, Schulze – und (fast) all die anderen Namen auch",https://www.spiegel.de/panorama/gesellschaft/forscherin-erstellt-woerterbuch-von-familiennamen-mehr-als-50-000-eintraege-geschafft-a-830b6f74-fb75-4f7d-ae53-8041b4076bd0,04022022_13:00,Spiegel,panorama,Aufgezeichnet von Sophia Ahrens
Pläne von Tesla-Mitgründer Straubel: Milliarden für Müll,https://www.spiegel.de/wirtschaft/tesla-mitgruender-will-milliarden-in-europaeische-recycling-fabriken-investieren-elon-musks-muellmann-a-9171fa29-bfd8-4adc-9577-68a41fae5722,04022022_13:00,Spiegel,wirtschaft,Von Simon Hage
Zeitreise – Der SPIEGEL vor 50 Jahren: Warum Heinrich Böll »Gnade und freies Geleit« für Ulrike Meinhof forderte,https://www.spiegel.de/geschichte/der-spiegel-vor-50-jahren-gnade-fuer-ulrike-meinhof-wie-heinrich-boell-die-raf-sah-a-03f74396-1fdf-47c1-a5d7-e6fa9d6c43fc,04022022_13:00,Spiegel,geschichte,Von Rainer Lübbert
Konsequenzen aus Missbrauchsskandal: Wird die Politik die Macht der Kirchen beschneiden?,https://www.spiegel.de/politik/deutschland/missbrauchsskandale-muss-die-politik-die-macht-der-kirchen-beschneiden-a-a8ab2d46-bede-4526-9279-1af52af1a7eb,04022022_13:00,Spiegel,politik,
Rheinland-Pfalz: Trauerfeier in Kusel – Dreyer verurteilt hämische Kommentare,https://www.spiegel.de/panorama/justiz/kusel-malu-dreyer-verurteilt-haemische-kommentare-nach-polizistenmorden-a-b91b27cd-b1dd-4c57-860c-483a190b045e,04022022_12:57,Spiegel,panorama,
+++ Olympia im Liveblog +++: Das Feuer brennt – Winterspiele von Peking sind offiziell eröffnet,https://www.spiegel.de/sport/olympia/olympia-2022-so-laeuft-die-eroeffnung-der-olympischen-winterspiele-in-peking-a-39447668-87ff-4911-9692-6d68c4b63d2c,04022022_12:51,Spiegel,sport,
Munitionsaffäre: Anklage gegen früheren KSK-Kommandeur Kreitmayr,https://www.spiegel.de/politik/deutschland/bundeswehr-anklage-gegen-frueheren-ksk-kommandeur-kreitmayr-a-085ceb73-5b5f-45e8-a264-62963a96ec8f,04022022_12:41,Spiegel,politik,
»Aufstand der letzten Generation«: Klimaaktivisten blockieren Berliner Autobahn,https://www.spiegel.de/panorama/berlin-klimaaktivisten-blockieren-autobahn-a-91894f88-7c70-40a6-af3b-a4cc4a2ccd4e,04022022_12:31,Spiegel,panorama,
Für Davis-Cup-Team und Jugendmannschaften: Ungarns Tennis-Teamarzt soll fiktive Coronatests ausgestellt haben,https://www.spiegel.de/sport/tennis/tennis-ungarns-teamarzt-soll-fiktive-coronatests-ausgestellt-haben-a-a9cc07b6-2cfc-4ddc-a2dc-2e09584eaa52,04022022_12:29,Spiegel,sport,
