Titel,Date_Info,URL,Overline,Breadcrumb,author,detailed_informations,Zugriff_Datum,News_page,Kategorie
Der Gott der Streichungen,10122021_13:35,https://www.sueddeutsche.de/kultur/gustave-flaubert-madame-bovary-geburtstag-literatur-1.5484965,Flaubert 200,,Von Lothar Müller,"Vor 200 Jahren wurde Gustave Flaubert geboren. Seine Romane bewegen Generationen von Lesern bis heute, er selbst jedoch stritt bis ans Ende seines Lebens jede innere Beteiligung ab. 
                        
                            Von Lothar Müller",10122021,Sueddeutsche,kultur
Die Realität ist Kulisse,10122021_13:35,https://www.sueddeutsche.de/kultur/gustave-flaubert-bouvard-und-pecuchet-literatur-jahrestag-literatur-1.5484996,"Flauberts Roman ""Bouvard und Pécuchet""",,Von Thomas Steinfeld,"Flauberts Romane sind in der Regel so genau recherchiert, dass man jede Straße findet, wenn man sucht. Gilt das auch für das Herrenhaus in seinem letzten Roman ""Bouvard und Pécuchet?"" Ein Selbstversuch. 
                        
                            Von Thomas Steinfeld",10122021,Sueddeutsche,kultur
Impfpflicht für Mitarbeiter im Gesundheitswesen kommt,10122021_13:34,https://www.sueddeutsche.de/politik/corona-aktuell-deutschland-gesundheitswesen-berufsbezogene-impfpflicht-1.5481008,Coronavirus in Deutschland,,Nachrichten aus Deutschland,"Von März an müssen Beschäftigte einen entsprechenden Nachweis vorlegen. Außerdem sollen künftig mehr Berufsgruppen impfen dürfen. Der neue Gesundheitsminister Lauterbach macht der Ständigen Impfkommission Druck: ""Das muss schneller gehen.""
                        
                            Nachrichten aus Deutschland",10122021,Sueddeutsche,politik
Was für eine Wut!,10122021_13:34,https://www.sueddeutsche.de/kultur/gustave-flaubert-200-geburtstag-deutsch-franzoesischer-krieg-briefe-1.5484952,200. Geburtstag von Gustave Flaubert: Der Kriegsgegner,,Von Gustav Seibt,"Sein Hass war ein bewegliches Geschütz: Flaubert wettert gegen den deutsch-französischen Krieg von 1870/71.
                        
                            Von Gustav Seibt",10122021,Sueddeutsche,kultur
Beweihräucherung für den guten Zweck,10122021_13:33,https://www.sueddeutsche.de/kultur/drake-kanye-west-ye-konzert-hoover-1.5484968,Konzert von Drake und Ye in Los Angeles,,"Von Jürgen Schmieder, Los Angeles","Die lange verfeindeten Rapper Ye und Drake geben ein gemeinsames Konzert: gegen die Haftstrafe von Larry Hoover und für Gefängnisreform in den USA.
                        
                            Von Jürgen Schmieder, Los Angeles",10122021,Sueddeutsche,kultur
Bilder des Tages,10122021_13:32,https://www.sueddeutsche.de/kultur/fotografie-bilder-des-tages-dpa.urn-newsml-dpa-com-20090101-211210-99-325593,Fotografie,dpa,,,10122021,Sueddeutsche,kultur
Bundestag verschärft Corona-Maßnahmen,10122021_13:30,https://www.sueddeutsche.de/gesundheit/gesundheit-bundestag-verschaerft-corona-massnahmen-dpa.urn-newsml-dpa-com-20090101-211210-99-327039,Gesundheit,dpa,,,10122021,Sueddeutsche,gesundheit
Kinderärzte: Stiko-Empfehlung angemessen,10122021_13:29,https://www.sueddeutsche.de/wissen/wissenschaft-kinderaerzte-stiko-empfehlung-angemessen-dpa.urn-newsml-dpa-com-20090101-211210-99-331381,Wissenschaft,dpa,,,10122021,Sueddeutsche,wissen
Begrenzte Impfpflicht kommt - auch Bundesrat stimmt zu,10122021_13:28,https://www.sueddeutsche.de/gesundheit/gesundheit-begrenzte-impfpflicht-kommt-auch-bundesrat-stimmt-zu-dpa.urn-newsml-dpa-com-20090101-211210-99-332782,Gesundheit,dpa,,,10122021,Sueddeutsche,gesundheit
Tschechien führt Impfpflicht für alle ab 60 Jahren ein,10122021_13:27,https://www.sueddeutsche.de/politik/corona-weltweit-impfpflicht-tschechien-1.5481011,Corona weltweit,,Aktuelle Meldungen weltweit,"Auch Gesundheits- und Pflegepersonal, Ärzte und Medizinstudenten, Polizisten, Feuerwehrleute und Soldaten müssen sich impfen lassen. Doch die Entscheidung könnte wieder rückgängig gemacht werden. England verschärft die Maskenpflicht wegen Omikron.
                        
                            Aktuelle Meldungen weltweit",10122021,Sueddeutsche,politik
GEW beklagt unzureichendes Corona-Management,10122021_13:26,https://www.sueddeutsche.de/bildung/bildung-schwerin-gew-beklagt-unzureichendes-corona-management-dpa.urn-newsml-dpa-com-20090101-211210-99-332730,Bildung - Schwerin,dpa,,,10122021,Sueddeutsche,bildung
Semperopernball fällt aus: Silvesterkonzert ohne Publikum,10122021_13:24,https://www.sueddeutsche.de/kultur/musik-dresden-semperopernball-faellt-aus-silvesterkonzert-ohne-publikum-dpa.urn-newsml-dpa-com-20090101-211210-99-332558,Musik - Dresden,dpa,,,10122021,Sueddeutsche,kultur
Stromausfall in JVA: Gefangene sitzen im Dunkeln,10122021_13:23,https://www.sueddeutsche.de/panorama/justiz-heilbronn-stromausfall-in-jva-gefangene-sitzen-im-dunkeln-dpa.urn-newsml-dpa-com-20090101-211210-99-331473,Justiz - Heilbronn,dpa,,,10122021,Sueddeutsche,panorama
Steuer und Recht,10122021_13:22,https://advertorial.sueddeutsche.de/ffb/Steuer-und-Recht/,Anzeige,,,,10122021,Sueddeutsche,ffb
Weitere Ermittlungen nach tödlichen Schüssen in Bielefeld,10122021_13:22,https://www.sueddeutsche.de/panorama/kriminalitaet-bielefeld-weitere-ermittlungen-nach-toedlichen-schuessen-in-bielefeld-dpa.urn-newsml-dpa-com-20090101-211209-99-323466,Kriminalität - Bielefeld,dpa,,,10122021,Sueddeutsche,panorama
US-Riese Kraft Heinz übernimmt Gewürz-Start-up Just Spices,10122021_13:21,https://www.sueddeutsche.de/wirtschaft/lebensmittel-duesseldorf-us-riese-kraft-heinz-uebernimmt-gewuerz-start-up-just-spices-dpa.urn-newsml-dpa-com-20090101-211210-99-332629,Lebensmittel - Düsseldorf,dpa,,,10122021,Sueddeutsche,wirtschaft
Biathlon-Überraschung: Kühn gewinnt Sprint,10122021_13:21,https://www.sueddeutsche.de/sport/biathlon-biathlon-ueberraschung-kuehn-gewinnt-sprint-dpa.urn-newsml-dpa-com-20090101-211210-99-332268,Biathlon,dpa,,,10122021,Sueddeutsche,sport
Warum Bayerns Unis schon wieder im Lockdown-Modus sind,10122021_13:20,https://www.sueddeutsche.de/bayern/bayern-hochschule-sibler-corona-1.5484492,Hochschule,,Von Viktoria Spinrad,"Eigentlich sollte dieses Semester wieder in Präsenz stattfinden. Doch statt im Kolloquium sitzen die meisten Studierenden wieder in ihrem WG-Zimmer. Ein Lagebericht.
                        
                            Von Viktoria Spinrad",10122021,Sueddeutsche,bayern
Steuer und Recht,10122021_13:19,https://advertorial.sueddeutsche.de/st/Steuer-und-Recht/,Anzeige,,,,10122021,Sueddeutsche,st
Fahrzeit für Berlin-Hamburg wieder unter zwei Stunden,10122021_13:19,https://www.sueddeutsche.de/wirtschaft/bahn-fahrzeit-fuer-berlin-hamburg-wieder-unter-zwei-stunden-dpa.urn-newsml-dpa-com-20090101-211210-99-331963,Bahn,dpa,,,10122021,Sueddeutsche,wirtschaft
Kürzungen in Alstom-Werken: Aber Aufbau neuer Jobs geplant,10122021_13:18,https://www.sueddeutsche.de/wirtschaft/bahn-salzgitter-kuerzungen-in-alstom-werken-aber-aufbau-neuer-jobs-geplant-dpa.urn-newsml-dpa-com-20090101-211210-99-331596,Bahn - Salzgitter,dpa,,,10122021,Sueddeutsche,wirtschaft
Steuer und Recht,10122021_13:18,https://advertorial.sueddeutsche.de/da/Steuer-und-Recht/,Anzeige,,,,10122021,Sueddeutsche,da
Stahl-Greif aus Untersteinach immer noch verschwunden,10122021_13:18,https://www.sueddeutsche.de/bayern/kriminalitaet-untersteinach-stahl-greif-aus-untersteinach-immer-noch-verschwunden-dpa.urn-newsml-dpa-com-20090101-211210-99-331414,Kriminalität - Untersteinach,dpa,,,10122021,Sueddeutsche,bayern
Bundestag beschließt Impfpflicht in Pflegeberufen ab Mitte März,10122021_13:17,https://www.sueddeutsche.de/politik/bundestag-beschliesst-impfpflicht-in-pflegeberufen-ab-mitte-maerz-1.5485059,,,,"Video
                    
                    
                        Der neue Gesundheitsminister Karl Lauterbach hatte für die Maßnahmen geworben.",10122021,Sueddeutsche,politik
Steuer und Recht,10122021_13:17,https://advertorial.sueddeutsche.de/lkm/Steuer-und-Recht/,Anzeige,,,,10122021,Sueddeutsche,lkm
Alice Weidel positiv auf Corona getestet,10122021_13:15,https://www.sueddeutsche.de/politik/bundestag-alice-weidel-positiv-auf-corona-getestet-dpa.urn-newsml-dpa-com-20090101-211210-99-332344,Bundestag,dpa,,,10122021,Sueddeutsche,politik
Aktuell vier Omikron-Fälle in Niedersachsen,10122021_13:14,https://www.sueddeutsche.de/gesundheit/gesundheit-hannover-aktuell-vier-omikron-faelle-in-niedersachsen-dpa.urn-newsml-dpa-com-20090101-211210-99-332002,Gesundheit - Hannover,dpa,,,10122021,Sueddeutsche,gesundheit
Steuerliche Erleichterungen sollen Corona-Folgen abmildern,10122021_13:13,https://www.sueddeutsche.de/wirtschaft/finanzen-magdeburg-steuerliche-erleichterungen-sollen-corona-folgen-abmildern-dpa.urn-newsml-dpa-com-20090101-211210-99-332329,Finanzen - Magdeburg,dpa,,,10122021,Sueddeutsche,wirtschaft
Hansa-Trainer Härtel: Jatta-Fall hat keinen Einfluss auf HSV,10122021_13:13,https://www.sueddeutsche.de/sport/fussball-rostock-hansa-trainer-haertel-jatta-fall-hat-keinen-einfluss-auf-hsv-dpa.urn-newsml-dpa-com-20090101-211210-99-332511,Fußball - Rostock,dpa,,,10122021,Sueddeutsche,sport
Pferdehof-Brand verursacht Schaden in Millionenhöhe,10122021_13:13,https://www.sueddeutsche.de/panorama/braende-gross-zimmern-pferdehof-brand-verursacht-schaden-in-millionenhoehe-dpa.urn-newsml-dpa-com-20090101-211210-99-328514,Brände - Groß-Zimmern,dpa,,,10122021,Sueddeutsche,panorama
Inflationssorgen wachsen - Teuerungsrate über 5 Prozent,10122021_13:10,https://www.sueddeutsche.de/wirtschaft/preise-inflationssorgen-wachsen-teuerungsrate-ueber-5-prozent-dpa.urn-newsml-dpa-com-20090101-211210-99-330629,Preise,dpa,,,10122021,Sueddeutsche,wirtschaft
Brezen als Berufung,10122021_13:10,https://www.sueddeutsche.de/muenchen/wolfratshausen/sz-adventskalender-brezen-als-berufung-1.5484783,SZ-Adventskalender,,Von Kathrin Müller-Lancé,"Trust Osadolor, vor sechs Jahren aus Nigeria geflüchtet, ist für seine Ausbildung zum Bäcker  mit einem  Preis ausgezeichnet worden. Geholfen haben ihm sein Ehrgeiz und der Benediktbeurer Verein Zammlebn.
                        
                            Von Kathrin Müller-Lancé",10122021,Sueddeutsche,muenchen
Carl-Zuckmayer-Medaille: Verleihung an Schami verschoben,10122021_13:09,https://www.sueddeutsche.de/kultur/literatur-mainz-carl-zuckmayer-medaille-verleihung-an-schami-verschoben-dpa.urn-newsml-dpa-com-20090101-211210-99-330702,Literatur - Mainz,dpa,,,10122021,Sueddeutsche,kultur
"Ringer Stäbler warnt Kimmich: ""Wird ein steiniger Weg""",10122021_13:08,https://www.sueddeutsche.de/sport/fussball-ringer-staebler-warnt-kimmich-wird-ein-steiniger-weg-dpa.urn-newsml-dpa-com-20090101-211210-99-332419,Fußball,dpa,,,10122021,Sueddeutsche,sport
Jungk Zweiter vor Grotheer beim Skeleton-Weltcup,10122021_13:08,https://www.sueddeutsche.de/sport/skeleton-jungk-zweiter-vor-grotheer-beim-skeleton-weltcup-dpa.urn-newsml-dpa-com-20090101-211210-99-332418,Skeleton,dpa,,,10122021,Sueddeutsche,sport
SEK-Einsatz in Berlin nach Millionen-Coup im Norden,10122021_13:06,https://www.sueddeutsche.de/panorama/kriminalitaet-norderstedt-sek-einsatz-in-berlin-nach-millionen-coup-im-norden-dpa.urn-newsml-dpa-com-20090101-211210-99-329872,Kriminalität - Norderstedt,dpa,,,10122021,Sueddeutsche,panorama
Getränkeflaschen vergiftet: 57-Jährige muss in Psychiatrie,10122021_13:04,https://www.sueddeutsche.de/muenchen/muenchen-gift-getraenke-urteil-1.5485028,Prozess in München,,,"Die Frau brachte fünf Menschen in Lebensgefahr, darunter auch zwei Kinder. Das Gericht ist jedoch überzeugt davon, dass sie ihr Handeln nicht steuern konnte.",10122021,Sueddeutsche,muenchen
Daimler Truck zum Börsendebüt mit 23 Mrd Euro bewertet,10122021_13:04,https://www.sueddeutsche.de/wirtschaft/daimler-truck-zum-boersendebuet-mit-23-mrd-euro-bewertet-1.5485033,,,,"Video
                    
                    
                        Für Daimler-Aktionäre hat sich die Abspaltung des Geschäfts mit Lkw und Bussen nach 125 Jahren unter einem Dach allerdings bereits gerechnet.",10122021,Sueddeutsche,wirtschaft
Erstmals digitales Zeugnis für Abiturienten an zwölf Schulen,10122021_13:04,https://www.sueddeutsche.de/bildung/schulen-mainz-erstmals-digitales-zeugnis-fuer-abiturienten-an-zwoelf-schulen-dpa.urn-newsml-dpa-com-20090101-211210-99-330411,Schulen - Mainz,dpa,,,10122021,Sueddeutsche,bildung
Reduziertes Zuschauerkontingent: Saarbrücken gegen Freiburg,10122021_13:02,https://www.sueddeutsche.de/sport/fussball-saarbruecken-reduziertes-zuschauerkontingent-saarbruecken-gegen-freiburg-dpa.urn-newsml-dpa-com-20090101-211210-99-331444,Fußball - Saarbrücken,dpa,,,10122021,Sueddeutsche,sport
Neun Jahre Haft für 14-Jährigen nach Mord an 13-Jährigen,10122021_13:01,https://www.sueddeutsche.de/panorama/prozesse-neun-jahre-haft-fuer-14-jaehrigen-nach-mord-an-13-jaehrigen-dpa.urn-newsml-dpa-com-20090101-211210-99-330415,Prozesse,dpa,,,10122021,Sueddeutsche,panorama
Urteil im millionenschweren Kali-Streit soll fallen,10122021_13:00,https://www.sueddeutsche.de/wirtschaft/bergbau-weimar-urteil-im-millionenschweren-kali-streit-soll-fallen-dpa.urn-newsml-dpa-com-20090101-211210-99-332186,Bergbau - Weimar,dpa,,,10122021,Sueddeutsche,wirtschaft
Sieben Meter,10122021_13:00,https://www.sueddeutsche.de/muenchen/dachau/hebertshausen-dachau-christbaum-oberweilbach-1.5484379,Dachau,,"Von Helmut Zeller, Dachau","Ein Landwirt soll einen Brunnen statt auf 40 auf 47 Meter Tiefe gebohrt haben und die Anlage zurückbauen. Sein Anwalt aber sagt: Der Bau war rechtens.
                        
                            Von Helmut Zeller, Dachau",10122021,Sueddeutsche,muenchen
"Deutscher Entwicklerpreis für ""Dorfromantik""",10122021_12:59,https://www.sueddeutsche.de/leben/spiele-deutscher-entwicklerpreis-fuer-dorfromantik-dpa.urn-newsml-dpa-com-20090101-211210-99-330985,Spiele,dpa,,,10122021,Sueddeutsche,leben
"Unpünktliche Menschen, wieso seid ihr immer zu spät dran?",10122021_12:57,https://jetzt.de/querfragen/wieso-kommen-manche-menschen-immer-zu-spaet,Querfragen,,Von Lisa Miethke und Lisa Bartelmus,"Findet ihr nicht, dass es respektlos ist, andere warten zu lassen? Oder könnt ihr eure Zeit einfach nicht richtig einteilen?


                        
                            Von Lisa Miethke und Lisa Bartelmus",10122021,Sueddeutsche,querfragen
11. Dezember: Weekender,10122021_12:55,https://sz-magazin.sueddeutsche.de/91016,SZ-Magazin,,Von ,"Driving home for christmas? Da braucht's nur noch eine schicke Tasche. Wir verlosen eine aus weichem Leder.
                        
                            Von",10122021,Sueddeutsche,91016
Habeck schwört NRW-Grüne auf Regierungsbeteiligung ein,10122021_12:54,https://www.sueddeutsche.de/politik/parteien-duesseldorf-habeck-schwoert-nrw-gruene-auf-regierungsbeteiligung-ein-dpa.urn-newsml-dpa-com-20090101-211210-99-332184,Parteien - Düsseldorf,dpa,,,10122021,Sueddeutsche,politik
Drogen und gefälschte Impfpässe: Verdächtiger in U-Haft,10122021_12:54,https://www.sueddeutsche.de/panorama/kriminalitaet-ludwigshafen-am-rhein-drogen-und-gefaelschte-impfpaesse-verdaechtiger-in-u-haft-dpa.urn-newsml-dpa-com-20090101-211210-99-331406,Kriminalität - Ludwigshafen am Rhein,dpa,,,10122021,Sueddeutsche,panorama
Begrenzte Impfpflicht und mehr: Das sind die neuen Maßnahmen,10122021_12:53,https://www.sueddeutsche.de/gesundheit/gesundheit-begrenzte-impfpflicht-und-mehr-das-sind-die-neuen-massnahmen-dpa.urn-newsml-dpa-com-20090101-211210-99-332057,Gesundheit,dpa,,,10122021,Sueddeutsche,gesundheit
Menschenrechtspreis geht an inhaftierten kurdischen Anwalt,10122021_12:51,https://www.sueddeutsche.de/leben/auszeichnungen-weimar-menschenrechtspreis-geht-an-inhaftierten-kurdischen-anwalt-dpa.urn-newsml-dpa-com-20090101-211210-99-332174,Auszeichnungen - Weimar,dpa,,,10122021,Sueddeutsche,leben
