Titel,Date_Info,URL,Overline,Breadcrumb,author,detailed_informations,Zugriff_Datum,News_page,Kategorie
Nach Wutausbruch von Zverev: 40 000 Dollar Strafe,24022022_22:00,https://www.sueddeutsche.de/sport/tennis-nach-wutausbruch-von-zverev-40-000-dollar-strafe-dpa.urn-newsml-dpa-com-20090101-220224-99-277000,Tennis,dpa,,,24022022,Sueddeutsche,sport
Alba Berlin siegt vier Tage nach Pokalsieg in Villeurbanne,24022022_21:57,https://www.sueddeutsche.de/sport/basketball-berlin-alba-berlin-siegt-vier-tage-nach-pokalsieg-in-villeurbanne-dpa.urn-newsml-dpa-com-20090101-220224-99-276976,Basketball - Berlin,dpa,,,24022022,Sueddeutsche,sport
Borussia Dortmund verpasst Achtelfinale der Europa League,24022022_21:56,https://www.sueddeutsche.de/sport/fussball-borussia-dortmund-verpasst-achtelfinale-der-europa-league-dpa.urn-newsml-dpa-com-20090101-220224-99-276949,Fußball,dpa,,,24022022,Sueddeutsche,sport
Dortmund verabschiedet sich aus der Europa League,24022022_21:54,https://www.sueddeutsche.de/sport/bvb-rangers-europa-league-1.5536414,Fußball,,,Der BVB spielt bei den Glasgow Rangers nur 2:2 - zu wenig nach der 2:4-Niederlage im Hinspiel. Damit ist die Borussia aus allen Pokal-Wettbewerben ausgeschieden.,24022022,Sueddeutsche,sport
Unwetter sorgt für Feuerwehreinsätze in Hannover,24022022_21:51,https://www.sueddeutsche.de/panorama/notfaelle-hannover-unwetter-sorgt-fuer-feuerwehreinsaetze-in-hannover-dpa.urn-newsml-dpa-com-20090101-220224-99-276910,Notfälle - Hannover,dpa,,,24022022,Sueddeutsche,panorama
Krankenhausgesellschaft von geplantem Pflegebonus enttäuscht,24022022_21:49,https://www.sueddeutsche.de/bayern/gesundheit-muenchen-krankenhausgesellschaft-von-geplantem-pflegebonus-enttaeuscht-dpa.urn-newsml-dpa-com-20090101-220224-99-276852,Gesundheit - München,dpa,,,24022022,Sueddeutsche,bayern
Biden kämpft an drei Fronten,24022022_21:49,https://www.sueddeutsche.de/politik/ukraine-usa-biden-sanktionen-1.5536191,Reaktion der USA,,"Von Fabian Fellmann, Washington","Die USA verschärfen die Sanktionen gegen Russland deutlich. Der Präsident sagt, er hätte gerne noch härtere Maßnahmen verhängt. Sorgen bereiten ihm die steigenden Energiepreise.
                        
                            Von Fabian Fellmann, Washington",24022022,Sueddeutsche,politik
Handball: Flensburg-Handewitt verliert 30:33 in Paris,24022022_21:44,https://www.sueddeutsche.de/sport/handball-paris-handball-flensburg-handewitt-verliert-3033-in-paris-dpa.urn-newsml-dpa-com-20090101-220224-99-276837,Handball - Paris,dpa,,,24022022,Sueddeutsche,sport
SG Flensburg-Handewitt kassiert Niederlage in Paris,24022022_21:42,https://www.sueddeutsche.de/sport/handball-sg-flensburg-handewitt-kassiert-niederlage-in-paris-dpa.urn-newsml-dpa-com-20090101-220224-99-276774,Handball,dpa,,,24022022,Sueddeutsche,sport
Peters fordert von UEFA Prüfen der Gazprom-Partnerschaft,24022022_21:36,https://www.sueddeutsche.de/sport/fussball-peters-fordert-von-uefa-pruefen-der-gazprom-partnerschaft-dpa.urn-newsml-dpa-com-20090101-220224-99-276621,Fußball,dpa,,,24022022,Sueddeutsche,sport
"Scholz: ""Putin wird nicht gewinnen""",24022022_21:33,https://www.sueddeutsche.de/politik/konflikte-scholz-putin-wird-nicht-gewinnen-dpa.urn-newsml-dpa-com-20090101-220224-99-261309,Konflikte,dpa,,,24022022,Sueddeutsche,politik
VW geht Porsche-Börsengang an: 25 Prozent an den Markt,24022022_21:31,https://www.sueddeutsche.de/wirtschaft/auto-wolfsburg-vw-geht-porsche-boersengang-an-25-prozent-an-den-markt-dpa.urn-newsml-dpa-com-20090101-220224-99-275564,Auto - Wolfsburg,dpa,,,24022022,Sueddeutsche,wirtschaft
Russland: 1700 Festnahmen bei Anti-Kriegs-Demos,24022022_21:30,https://www.sueddeutsche.de/politik/demonstrationen-russland-1700-festnahmen-bei-anti-kriegs-demos-dpa.urn-newsml-dpa-com-20090101-220224-99-273168,Demonstrationen,dpa,,,24022022,Sueddeutsche,politik
Demonstrationen und Mahnwache gegen Krieg in der Ukraine,24022022_21:28,https://www.sueddeutsche.de/politik/konflikte-greifswald-demonstrationen-und-mahnwache-gegen-krieg-in-der-ukraine-dpa.urn-newsml-dpa-com-20090101-220224-99-276662,Konflikte - Greifswald,dpa,,,24022022,Sueddeutsche,politik
Bilder des Tages,24022022_21:19,https://www.sueddeutsche.de/kultur/fotografie-bilder-des-tages-dpa.urn-newsml-dpa-com-20090101-220224-99-259269,Fotografie,dpa,,,24022022,Sueddeutsche,kultur
"Biden kündigt weitere ""starke"" Sanktionen an",24022022_21:18,https://www.sueddeutsche.de/politik/konflikte-biden-kuendigt-weitere-starke-sanktionen-an-dpa.urn-newsml-dpa-com-20090101-220224-99-260374,Konflikte,dpa,,,24022022,Sueddeutsche,politik
Lambrecht: Werden Nato-Ostflanke verstärken,24022022_21:16,https://www.sueddeutsche.de/politik/nato-lambrecht-werden-nato-ostflanke-verstaerken-dpa.urn-newsml-dpa-com-20090101-220224-99-266841,Nato,dpa,,,24022022,Sueddeutsche,politik
Mit Reife bestanden: RB Leipzig zieht ins Achtelfinale ein,24022022_21:14,https://www.sueddeutsche.de/sport/fussball-mit-reife-bestanden-rb-leipzig-zieht-ins-achtelfinale-ein-dpa.urn-newsml-dpa-com-20090101-220224-99-275530,Fußball,dpa,,,24022022,Sueddeutsche,sport
Mahnwache und Friedensgebet für die Ukraine,24022022_21:14,https://www.sueddeutsche.de/muenchen/fuerstenfeldbruck/fuerstenfeldbruck-mahnwache-friedensgebet-ukraine-endigna-gruene-jugend-krieg-1.5536410,In Fürstenfeldbruck,,"Von Christian Hufnagel, Fürstenfeldbruck","Im Landkreis finden die ersten Solidaritätskundgebungen für das vom Krieg heimgesuchte Land statt
                        
                            Von Christian Hufnagel, Fürstenfeldbruck",24022022,Sueddeutsche,muenchen
Russland warnt USA: Wer wird ISS vor Absturz bewahren?,24022022_21:05,https://www.sueddeutsche.de/politik/konflikte-russland-warnt-usawer-wird-iss-vor-absturz-bewahren-dpa.urn-newsml-dpa-com-20090101-220224-99-276295,Konflikte,dpa,,,24022022,Sueddeutsche,politik
"Folk aus Irland, Humor aus Frankreich",24022022_20:55,https://www.sueddeutsche.de/muenchen/ebersberg/theaterverein-markt-schwaben-matching-ties-der-vorname-1.5535967,Kulturvorschau,,,"Theaterverein Markt Schwaben beendet seine Winterpause mit einem Konzert und einer selbst inszenierten Komödie: Auf dem Programm stehen ""Matching Ties"" und ""Der Vorname"".",24022022,Sueddeutsche,muenchen
Mieterverein nur noch direkt anschreiben,24022022_20:55,https://www.sueddeutsche.de/muenchen/ebersberg/grafing-landkreis-ebersberg-mieterverein-1.5535752,Postfächer aufgelöst,,,,24022022,Sueddeutsche,muenchen
Neue Heimat für Senioren,24022022_20:55,https://www.sueddeutsche.de/muenchen/ebersberg/kirchseeon-senioren-alter-wohnen-gemeinderat-1.5535634,Leben im Alter,,"Von Andreas Junkmann, Kirchseeon","Weil das Awo-Seniorenheim am Dachsberg in die Jahre gekommen ist, soll im Kirchseeoner Zentrum ein moderner Neubau entstehen. Bis zu 120 Bewohner können dort künftig ihren Lebensabend verbringen.
                        
                            Von Andreas Junkmann, Kirchseeon",24022022,Sueddeutsche,muenchen
Testpflicht für Seniorenheime wird verlängert,24022022_20:55,https://www.sueddeutsche.de/muenchen/ebersberg/ebersberg-corona-inzidenz-seniorenheim-pflege-1.5536144,Corona in Ebersberg,,,Das Ebersberger Landratsamt verlängert die Testpflicht in Pflegeeinrichtung. Grund ist die immer noch hohe Corona-Inzidenz.,24022022,Sueddeutsche,muenchen
Krapfen für den guten Zweck,24022022_20:55,https://www.sueddeutsche.de/muenchen/ebersberg/landkreis-ebersberg-rotary-club-ebersberg-grafing-kreisklinik-ebersberg-1.5535824,Rotary-Club Ebersberg-Grafing,,,,24022022,Sueddeutsche,muenchen
"Eine Zeugin für mich, eine für dich...",24022022_20:55,https://www.sueddeutsche.de/muenchen/ebersberg/landkreis-ebersberg-amtsgericht-sexuelle-belaestigung-1.5536200,Amtsgericht Ebersberg,,"Von Merlin Wassermann, Ebersberg","Der Prozess um den Geschäftsführer eines Bekleidungsgeschäfts geht in die nächste Runde. Die Verteidigung versucht, die Zeuginnen und Zeugen der Gegenseite als psychisch labil und voller Groll darzustellen - mit mäßigem Erfolg.
                        
                            Von Merlin Wassermann, Ebersberg",24022022,Sueddeutsche,muenchen
Satz mit X,24022022_20:55,https://www.sueddeutsche.de/muenchen/ebersberg/landkreis-ebersberg-stadt-ebersberg-nachmittagsbetreuung-waldhort-oberndorf-1.5535807,Nachmittagsbetreuung in Ebersberg,,"Von Wieland Bögel, Ebersberg","Zusätzlicher Transportdienst für Hortkinder in Ebersberg wird abgelehnt.
                        
                            Von Wieland Bögel, Ebersberg",24022022,Sueddeutsche,muenchen
Große Italienliebe,24022022_20:55,https://www.sueddeutsche.de/muenchen/ebersberg/aja-leuthner-via-torino-ebersberg-roman-1.5536024,Bücher von SZ-Autoren,,"Von Michaela Pelz, Ebersberg","Deutsch-italienische Familiengeschichte von Journalistin Alexandra Leuthner.
                        
                            Von Michaela Pelz, Ebersberg",24022022,Sueddeutsche,muenchen
Lastwagenfahrer rammt Auto und flüchtet,24022022_20:55,https://www.sueddeutsche.de/muenchen/ebersberg/markt-schwaben-unfall-polizei-lastwagen-zeugen-1.5536004,Unfall in Markt Schwaben,,,"Die Polizei sucht Zeugen, die den Unfall in Markt Schwaben beobachtet haben.",24022022,Sueddeutsche,muenchen
"""Unsere Tiere sind deutlich gesünder als vorher""",24022022_20:55,https://www.sueddeutsche.de/muenchen/ebersberg/biobauern-traxl-hofladen-ebersberg-1.5536060,Landwirtschaft,,"Von Korbinian Eisenberger, Ebersberg","Als Monika und Johann Hilger ihren Hof auf Bio umstellten, gab es zunächst fast nur Probleme. Und jetzt? Eröffnen sie einen Hofladen in der Innenstadt. Was ist passiert? Ein Besuch im Stall zwischen Kühen und Kälbern.
                        
                            Von Korbinian Eisenberger, Ebersberg",24022022,Sueddeutsche,muenchen
Grafings Freie Wähler sagen Geldbeutelwaschen ab,24022022_20:55,https://www.sueddeutsche.de/muenchen/ebersberg/landkreis-ebersberg-grafing-freie-waehler-geldbeutelwaschen-1.5535777,Wegen Corona,,,,24022022,Sueddeutsche,muenchen
"""Das hat die selbsternannte 'Stadt der Künste' nicht verdient""",24022022_20:55,https://www.sueddeutsche.de/muenchen/dachau/dachau-architekturforum-md-gelaende-1.5535717,Architekturforum Dachau,,"Interview von Gregor Schiegl, Dachau","Das Architekturforum Dachau geht mit der Stadtverwaltung hart ins Gericht: Anders als diese suggeriere, seien die neuen Pläne für die Bebauung des MD-Geländes kein großer Fortschritt in Sachen Nachhaltigkeit und Wohnqualität. In einem Offenen Brief fordert der Verein nun umfassende Nachbesserungen.
                        
                            Interview von Gregor Schiegl, Dachau",24022022,Sueddeutsche,muenchen
Berufsinfotag beim Landratsamt Dachau,24022022_20:55,https://www.sueddeutsche.de/muenchen/dachau/landratsamt-dachau-ausbildung-beamtenlaufbahn-1.5535880,Landkreis Dachau,,,,24022022,Sueddeutsche,muenchen
Eine Kurskorrektur ist nötig,24022022_20:55,https://www.sueddeutsche.de/muenchen/dachau/dachau-kz-gedenkstaette-dachau-1.5536323,KZ-Gedenkstätte Dachau,,"Kommentar von Helmut Zeller, Dachau","Es geht nicht um die Priorisierung einzelner Projekte - die Erinnerungskultur selbst muss oberste Priorität haben.
                        
                            Kommentar von Helmut Zeller, Dachau",24022022,Sueddeutsche,muenchen
Hauptstraße komplett gesperrt,24022022_20:55,https://www.sueddeutsche.de/muenchen/dachau/haimhausen-unfall-hauptstrasse-1.5535716,Unfall in Haimhausen,,"Von SZ, Haimhausen","Von SZ, Haimhausen",24022022,Sueddeutsche,muenchen
Solidarität mit der Ukraine,24022022_20:55,https://www.sueddeutsche.de/muenchen/dachau/dachau-spontandemonstration-solidaritaet-mit-ukraine-1.5535797,Dachau,,,Spontandemonstration am Schrannenplatz,24022022,Sueddeutsche,muenchen
Aufruf zu Klassenfahrten und Worte des Dankes,24022022_20:54,https://www.sueddeutsche.de/muenchen/wolfratshausen/jugendherberge-klassenfahrt-bad-toelz-wolfrathausen-jugendsiedlung-hochland-corona-kurzarbeit-staatshilfen-1.5536157,Jugendherbergen in der Krise,,Von Marie Heßlinger,"Jugendherbergen in Bayern hoffen, dass sie bald wieder von Schulklassen aufgesucht werden. Und bedanken sich für die Verlängerung der Kurzarbeit.
                        
                            Von Marie Heßlinger",24022022,Sueddeutsche,muenchen
Häner aus Ausschüssen verbannt,24022022_20:54,https://www.sueddeutsche.de/muenchen/wolfratshausen/geretsried-edmund-haener-stadtrat-1.5535697,Stadtrat Geretsried,,,"Weil die Fraktionsgemeinschaft zwischen Freien Wählern und FDP aufgekündigt wurde, werden Gremien neu besetzt.",24022022,Sueddeutsche,muenchen
Grüne fordern besseren Anschluss,24022022_20:54,https://www.sueddeutsche.de/muenchen/wolfratshausen/geretsried-expressbus-x-bus-peter-curtius-michael-mueller-e-mobilitaet-elektro-auto-1.5535937,Expressbus nach Geretsried,,,Geretsrieds Bürgermeister Michael Müller hat die Kreispolitik in Sachen Verkehrswende kritisiert. Nun reicht Grünen-Sprecher Peter Curtius zwei Anträge ein.,24022022,Sueddeutsche,muenchen
Grüne scheitern mit Laubbläser-Verbot,24022022_20:54,https://www.sueddeutsche.de/muenchen/wolfratshausen/geretsried-gruene-scheitern-mit-laubblaeser-verbot-1.5535709,Geretsried,,,"Einen Antrag, die lauten Geräte zu untersagen, lehnt der Stadtrat mehrheitlich ab. Ihre Nutzung soll aber eingeschränkt werden.",24022022,Sueddeutsche,muenchen
Fürstenfeldbruck sucht Namen für neuen Jugendtreff,24022022_20:54,https://www.sueddeutsche.de/muenchen/fuerstenfeldbruck/fuerstenfeldbruck-jugendtreff-namenswettbewerb-1.5536048,Wettbewerb,,,Vorschläge können bis zum 9. März beim Stadtjugendrat eingereicht werden.,24022022,Sueddeutsche,muenchen
"""Extras für die Community""",24022022_20:54,https://www.sueddeutsche.de/muenchen/wolfratshausen/gelting-kleinkunstbuehne-hinterhalt-thorsten-thane-hiha-community-patreon-1.5530806,Geltinger Kulturbühne,,"Von Stephanie Schwaderer, Geretsried","Thorsten Thane und das ""Hinterhalt""-Team setzen auf ein neues Finanzierungskonzept.
                        
                            Von Stephanie Schwaderer, Geretsried",24022022,Sueddeutsche,muenchen
Einbrecher scheitern an Tür,24022022_20:54,https://www.sueddeutsche.de/muenchen/fuerstenfeldbruck/polizei-fuerstenfeldbruck-grafrath-einbruch-einbruchsversuch-1.5536256,Grafrath,,,Unbekannte richten Sachschaden an.,24022022,Sueddeutsche,muenchen
Jugendgruppe will christliches Festival besuchen,24022022_20:54,https://www.sueddeutsche.de/muenchen/fuerstenfeldbruck/germering-christliches-festival-1.5536265,Freie evangelische Gemeinde Germering,,,Interessierte können sich bei Jugendreferent Michael Weber anmelden,24022022,Sueddeutsche,muenchen
Stimmzettel tauchen überraschend auf,24022022_20:54,https://www.sueddeutsche.de/muenchen/fuerstenfeldbruck/erich-raff-sportbeirat-wahl-stimmzettel-fuerstenfeldbruck-1.5535867,Sportbeirat,,"Von Stefan Salger, Fürstenfeldbruck","Nach der Wahl des Sportbeirats von Fürstenfeldbruck gab es Gerüchte und sich widersprechende Aussagen des Oberbürgermeisters. Nun ist das Ergebnis bekannt .
                        
                            Von Stefan Salger, Fürstenfeldbruck",24022022,Sueddeutsche,muenchen
Kreis-FDP sagt politischen Ascherdonnerstag ab,24022022_20:54,https://www.sueddeutsche.de/muenchen/fuerstenfeldbruck/eichenau-krieg-absage-politischer-ascherdonnerstag-1.5536205,Reaktion auf den russischen Einmarsch in die Ukraine,,,Vorsitzender Martin Koch hält Bierzeltstimmung derzeit nicht für angemessen.,24022022,Sueddeutsche,muenchen
Bürgerbegehren entzweit Gemeinderat,24022022_20:54,https://www.sueddeutsche.de/muenchen/fuerstenfeldbruck/alling-sportplatz-kindergarten-buergerbegehren-1.5535942,Bürgerbegehren,,"Von Manfred Amann, Alling","Allinger Kommunalpolitiker kritisieren, dass Unterstützer des Kindergartenbaus die Seite gewechselt und bei den Gegnern unterschrieben haben.
                        
                            Von Manfred Amann, Alling",24022022,Sueddeutsche,muenchen
Caritas-Tagesstätte erweitert Plätze,24022022_20:54,https://www.sueddeutsche.de/muenchen/fuerstenfeldbruck/germering-psychiatrie-tagesstaette-1.5535975,Germering,,,"Bis zu 15 psychisch kranke Menschen werden nun in der Einrichtung ""Aufwind"" betreut.",24022022,Sueddeutsche,muenchen
Historische Motive im Fokus,24022022_20:54,https://www.sueddeutsche.de/muenchen/fuerstenfeldbruck/foto-fotowettbewerb-brucker-buidl-fuerstenfeldbruck-1.5535924,Fürstenfeldbruck,,,Am 15. März ist Einsendeschluss beim Fotowettbewerb Brucker Buidl.,24022022,Sueddeutsche,muenchen
Sammelstellen für Gartenabfälle wieder geöffnet,24022022_20:54,https://www.sueddeutsche.de/muenchen/fuerstenfeldbruck/fuerstenfeldbruck-gartenabfaelle-sammelstellen-1.5536242,Landkreis Fürstenfeldbruck,,,Grünzeug kann aber auch an allen großen Wertstoffhöfen abgegeben werden.,24022022,Sueddeutsche,muenchen
