Titel,Date_Info,URL,Overline,Breadcrumb,author,detailed_informations,Zugriff_Datum,News_page
Trübes Wetter in Niedersachsen,16012022_09:28,https://www.sueddeutsche.de/panorama/wetter-truebes-wetter-in-niedersachsen-dpa.urn-newsml-dpa-com-20090101-220116-99-727998,Wetter,dpa,,,16012022,Sueddeutsche
Inzidenz in Bremen steigt wieder auf über 1400,16012022_09:27,https://www.sueddeutsche.de/gesundheit/gesundheit-bremen-inzidenz-in-bremen-steigt-wieder-auf-ueber-1400-dpa.urn-newsml-dpa-com-20090101-220116-99-727991,Gesundheit - Bremen,dpa,,,16012022,Sueddeutsche
Sherrocks Darts-Jahr startet mit Rückschlag,16012022_09:27,https://www.sueddeutsche.de/sport/darts-sherrocks-darts-jahr-startet-mit-rueckschlag-dpa.urn-newsml-dpa-com-20090101-220116-99-727917,Darts,dpa,,,16012022,Sueddeutsche
Hoher Sachschaden bei Brand in Holtriem,16012022_09:26,https://www.sueddeutsche.de/panorama/braende-hoher-sachschaden-bei-brand-in-holtriem-dpa.urn-newsml-dpa-com-20090101-220116-99-727961,Brände,dpa,,,16012022,Sueddeutsche
"""In Melbourne geschah die größte Schande in der Geschichte""",16012022_09:25,https://www.sueddeutsche.de/sport/djokovic-reaktionen-tennis-1.5508284,Stimmen zum Fall Djokovic,,,Serbische Medien beklagen mit drastischen Worten die Abschiebung des Tennisprofis. In Australien überwiegt Zufriedenheit mit dem eigenen Rechtsstaat. Die Reaktionen.,16012022,Sueddeutsche
Fünfköpfige Familie bei Unfall zum Teil schwer verletzt,16012022_09:25,https://www.sueddeutsche.de/panorama/unfaelle-wietmarschen-fuenfkoepfige-familie-bei-unfall-zum-teil-schwer-verletzt-dpa.urn-newsml-dpa-com-20090101-220116-99-727949,Unfälle - Wietmarschen,dpa,,,16012022,Sueddeutsche
Sieben-Tage-Inzidenz in Brandenburg erneut gestiegen,16012022_09:23,https://www.sueddeutsche.de/gesundheit/gesundheit-potsdam-sieben-tage-inzidenz-in-brandenburg-erneut-gestiegen-dpa.urn-newsml-dpa-com-20090101-220116-99-727930,Gesundheit - Potsdam,dpa,,,16012022,Sueddeutsche
Corona: Sieben-Tage-Inzidenz steuert auf 1000er-Marke zu,16012022_09:23,https://www.sueddeutsche.de/gesundheit/gesundheit-berlin-corona-sieben-tage-inzidenz-steuert-auf-1000er-marke-zu-dpa.urn-newsml-dpa-com-20090101-220116-99-727919,Gesundheit - Berlin,dpa,,,16012022,Sueddeutsche
Designer der Stars: Modeschöpfer Nino Cerruti gestorben,16012022_09:22,https://www.sueddeutsche.de/kultur/mode-designer-der-stars-modeschoepfer-nino-cerruti-gestorben-dpa.urn-newsml-dpa-com-20090101-220116-99-727819,Mode,dpa,,,16012022,Sueddeutsche
Eastsides Xiaona Shan verliert WTT Feeder-Finale,16012022_09:22,https://www.sueddeutsche.de/sport/tischtennis-duesseldorf-eastsides-xiaona-shan-verliert-wtt-feeder-finale-dpa.urn-newsml-dpa-com-20090101-220116-99-727914,Tischtennis - Düsseldorf,dpa,,,16012022,Sueddeutsche
Klicks von Kids,16012022_09:22,https://www.sueddeutsche.de/panorama/youtube-video-meistgesehen-baby-shark-1.5507748,"SZ-Kolumne ""Bester Dinge""",,Von Veronika Wulf,"Die Welt ist doch noch im Lot: Der ""Baby Shark Dance"" knackt auf Youtube weiter Rekord um Rekord. 
                        
                            Von Veronika Wulf",16012022,Sueddeutsche
Nino Cerruti ist tot,16012022_09:21,https://www.sueddeutsche.de/kultur/cerruti-designer-gestorben-1.5508281,Mode,,,Er galt als Vorreiter einer eleganten Herrenmode der Sechziger Jahre und prägte Designer wie Giorgio Armani: Der Modedesigner Nino Cerruti ist im Alter von 91 Jahren gestorben.,16012022,Sueddeutsche
AfD scheitert mit Eilantrag gegen Corona-Auflagen im Landtag,16012022_09:21,https://www.sueddeutsche.de/bayern/urteile-muenchen-afd-scheitert-mit-eilantrag-gegen-corona-auflagen-im-landtag-dpa.urn-newsml-dpa-com-20090101-220116-99-727833,Urteile - München,dpa,,,16012022,Sueddeutsche
Corona-Infektionsgeschehen in Sachsen-Anhalt nimmt weiter zu,16012022_09:18,https://www.sueddeutsche.de/gesundheit/gesundheit-berlin-corona-infektionsgeschehen-in-sachsen-anhalt-nimmt-weiter-zu-dpa.urn-newsml-dpa-com-20090101-220116-99-727891,Gesundheit - Berlin,dpa,,,16012022,Sueddeutsche
Italiener Caruso ersetzt Djokovic,16012022_09:18,https://www.sueddeutsche.de/sport/tennis-italiener-caruso-ersetzt-djokovic-dpa.urn-newsml-dpa-com-20090101-220116-99-727874,Tennis,dpa,,,16012022,Sueddeutsche
Polizeihündin findet Ladendieb in Gebüsch,16012022_09:17,https://www.sueddeutsche.de/panorama/kriminalitaet-lage-polizeihuendin-findet-ladendieb-in-gebuesch-dpa.urn-newsml-dpa-com-20090101-220116-99-727866,Kriminalität - Lage,dpa,,,16012022,Sueddeutsche
"Kölns Trainer Baumgart: ""Wir lassen die Vereine sterben""",16012022_09:14,https://www.sueddeutsche.de/sport/fussball-koelns-trainer-baumgart-wir-lassen-die-vereine-sterben-dpa.urn-newsml-dpa-com-20090101-220116-99-727847,Fußball,dpa,,,16012022,Sueddeutsche
"Kölns Trainer Baumgart: ""Wir lassen die Vereine sterben""",16012022_09:13,https://www.sueddeutsche.de/sport/fussball-koeln-koelns-trainer-baumgart-wir-lassen-die-vereine-sterben-dpa.urn-newsml-dpa-com-20090101-220116-99-727840,Fußball - Köln,dpa,,,16012022,Sueddeutsche
Studie: Vor allem höher Gebildete fahren häufig Rad,16012022_09:11,https://www.sueddeutsche.de/bildung/bildung-koeln-studie-vor-allem-hoeher-gebildete-fahren-haeufig-rad-dpa.urn-newsml-dpa-com-20090101-220116-99-727832,Bildung - Köln,dpa,,,16012022,Sueddeutsche
Fahrer kracht in Skulptur: Mann wurde mit Haftbefehl gesucht,16012022_09:10,https://www.sueddeutsche.de/panorama/unfaelle-hersbruck-fahrer-kracht-in-skulptur-mann-wurde-mit-haftbefehl-gesucht-dpa.urn-newsml-dpa-com-20090101-220116-99-727800,Unfälle - Hersbruck,dpa,,,16012022,Sueddeutsche
Feuerwehr rettet Kuh aus Güllegrube,16012022_09:08,https://www.sueddeutsche.de/panorama/notfaelle-olpe-feuerwehr-rettet-kuh-aus-guellegrube-dpa.urn-newsml-dpa-com-20090101-220116-99-727822,Notfälle - Olpe,dpa,,,16012022,Sueddeutsche
Handballer nominieren Wagner für EM nach,16012022_09:06,https://www.sueddeutsche.de/sport/handball-handballer-nominieren-wagner-fuer-em-nach-dpa.urn-newsml-dpa-com-20090101-220116-99-727780,Handball,dpa,,,16012022,Sueddeutsche
Frau bei Brand in Eimsbüttel verletzt,16012022_09:05,https://www.sueddeutsche.de/panorama/braende-hamburg-frau-bei-brand-in-eimsbuettel-verletzt-dpa.urn-newsml-dpa-com-20090101-220116-99-727508,Brände - Hamburg,dpa,,,16012022,Sueddeutsche
Chronologie einer gescheiterten Einreise,16012022_09:04,https://www.sueddeutsche.de/sport/tennis-djokovic-australien-chronologie-1.5505950,Novak Djokovic,,,"Vom ersten, vorläufigen Visum bis zu Djokovics jüngsten Eingeständnissen und der neuerlichen Annullierung des Visums: ein zeitlicher Überblick über die Geschehnisse rund um den serbischen Tennisspieler.",16012022,Sueddeutsche
500 Zuschauer feiern: Kaiserslautern auf Aufstiegskurs,16012022_09:01,https://www.sueddeutsche.de/sport/fussball-kaiserslautern-500zuschauer-feiernkaiserslautern-auf-aufstiegskurs-dpa.urn-newsml-dpa-com-20090101-220115-99-720968,Fußball - Kaiserslautern,dpa,,,16012022,Sueddeutsche
Corona-Inzidenz für Sachsen steigt weiter leicht an,16012022_08:55,https://www.sueddeutsche.de/gesundheit/gesundheit-berlin-corona-inzidenz-fuer-sachsen-steigt-weiter-leicht-an-dpa.urn-newsml-dpa-com-20090101-220116-99-727706,Gesundheit - Berlin,dpa,,,16012022,Sueddeutsche
Vermisste bei Suchaktion gefunden: Unterkühlungen,16012022_08:51,https://www.sueddeutsche.de/panorama/notfaelle-soemmerda-vermisste-bei-suchaktion-gefundenunterkuehlungen-dpa.urn-newsml-dpa-com-20090101-220116-99-727686,Notfälle - Sömmerda,dpa,,,16012022,Sueddeutsche
Drosten sieht Omikron auch als Chance an,16012022_08:50,https://www.sueddeutsche.de/politik/corona-aktuell-drosten-omikron-inzidenz-rki-1.5504136,Meldungen zum Coronavirus,,Corona-News aus Deutschland und aller Welt,"Es bestehe Hoffnung auf ein Leben wie vor der Pandemie, sagt der Chefvirologe der Berliner Charité. Weniger optimistisch äußert sich Gesundheitsminister Lauterbach mit Blick auf die Situation in den Kliniken. Die Sieben-Tage-Inzidenz steigt auf 515. 
                        
                            Corona-News aus Deutschland und aller Welt",16012022,Sueddeutsche
"""Fridays for Future""-Effekt in der Baubranche?",16012022_08:49,https://www.sueddeutsche.de/bayern/holz-ploessberg-fridays-for-future-effekt-in-der-baubranche-dpa.urn-newsml-dpa-com-20090101-220116-99-727676,Holz - Plößberg,dpa,,,16012022,Sueddeutsche
"""Ein Ökohaus bietet zu 95 Prozent Vorteile""",16012022_08:49,https://www.sueddeutsche.de/muenchen/landkreismuenchen/gruenwald-oekohaus-bauen-landkreis-muenchen-achim-zeppenfeld-1.5504680,Bauen,,Von Yannik Schuster,"Der Grünwalder Achim Zeppenfeld lebt seit 23 Jahren in einem Holzbau mit Wasserpufferspeicher und Solaranlagen, die im Sommer sogar den Pool beheizen. Bei seinem Haus fällt ihm nur ein Nachteil ein.
                        
                            Von Yannik Schuster",16012022,Sueddeutsche
Wehen Wiesbaden verliert nach 2:0-Führung,16012022_08:45,https://www.sueddeutsche.de/sport/fussball-muenchen-wehenwiesbaden-verliert-nach-20-fuehrung-dpa.urn-newsml-dpa-com-20090101-220116-99-727616,Fußball - München,dpa,,,16012022,Sueddeutsche
Thüringen weiter mit sinkender Corona-Inzidenz,16012022_08:43,https://www.sueddeutsche.de/gesundheit/gesundheit-erfurt-thueringen-weiter-mit-sinkender-corona-inzidenz-dpa.urn-newsml-dpa-com-20090101-220116-99-727636,Gesundheit - Erfurt,dpa,,,16012022,Sueddeutsche
Schmorbrand im Karlsruher Staatstheater,16012022_08:29,https://www.sueddeutsche.de/panorama/braende-karlsruhe-schmorbrand-im-karlsruher-staatstheater-dpa.urn-newsml-dpa-com-20090101-220116-99-727570,Brände - Karlsruhe,dpa,,,16012022,Sueddeutsche
Wo man sich an der frischen Luft fit halten kann,16012022_08:29,https://www.sueddeutsche.de/muenchen/muenchen-sport-freizeit-tipps-draussen-1.5507533,Freizeit in München,,Von SZ-Autoren,"An kalten Januartagen kann man sich auf die Couch verziehen und einmummeln. Oder man gönnt dem Körper mal wieder Bewegung. Acht Tipps.
                        
                            Von SZ-Autoren",16012022,Sueddeutsche
Ein millionenschwerer Kulturbau auf einstigem NS-Gelände?,16012022_08:27,https://www.sueddeutsche.de/bayern/nuernberg-oper-ns-kongresshalle-denkmalschutz-1.5506891,Nürnberger Staatstheater,,"Von Olaf Przybilla, Nürnberg","Die Denkmalschutzbehörde lässt bei dieser Frage wenig Deutungsspielraum: Ist hochproblematisch und müsste man wohl bald wieder abreißen. Doch das Papier lernt mancher Stadtrat jetzt erst kennen - vier Wochen nach dem Interimsentscheid.
                        
                            Von Olaf Przybilla, Nürnberg",16012022,Sueddeutsche
Frontalzusammenstoß beim Überholen auf B92,16012022_08:24,https://www.sueddeutsche.de/panorama/unfaelle-langenwetzendorf-frontalzusammenstoss-beim-ueberholen-auf-b92-dpa.urn-newsml-dpa-com-20090101-220116-99-727538,Unfälle - Langenwetzendorf,dpa,,,16012022,Sueddeutsche
Tatverdächtiger nach versuchtem Raubüberfall festgenommen,16012022_08:22,https://www.sueddeutsche.de/panorama/kriminalitaet-barsbuettel-tatverdaechtiger-nach-versuchtem-raubueberfall-festgenommen-dpa.urn-newsml-dpa-com-20090101-220116-99-727526,Kriminalität - Barsbüttel,dpa,,,16012022,Sueddeutsche
"Viktoria vor Restsaison: ""Haben nicht große Bauchschmerzen""",16012022_08:21,https://www.sueddeutsche.de/sport/fussball-berlin-viktoria-vor-restsaison-haben-nicht-grosse-bauchschmerzen-dpa.urn-newsml-dpa-com-20090101-220116-99-727519,Fußball - Berlin,dpa,,,16012022,Sueddeutsche
Hochzeitstermine am 2.2 und 22.2 in Sachsen-Anhalt beliebt,16012022_08:18,https://www.sueddeutsche.de/kultur/feste-halle-saale-hochzeitstermine-am-22-und-222-in-sachsen-anhalt-beliebt-dpa.urn-newsml-dpa-com-20090101-220116-99-727504,Feste - Halle (Saale),dpa,,,16012022,Sueddeutsche
Rülke: Merz könnte Schwarz-Gelb möglich machen,16012022_08:17,https://www.sueddeutsche.de/politik/parteien-stuttgart-ruelke-merz-koennte-schwarz-gelb-moeglich-machen-dpa.urn-newsml-dpa-com-20090101-220116-99-727393,Parteien - Stuttgart,dpa,,,16012022,Sueddeutsche
Eine Impfung mit Folgen: Halles OB lässt nicht locker,16012022_08:17,https://www.sueddeutsche.de/politik/kommunen-halle-saale-eine-impfung-mit-folgen-halles-ob-laesst-nicht-locker-dpa.urn-newsml-dpa-com-20090101-220116-99-727492,Kommunen - Halle (Saale),dpa,,,16012022,Sueddeutsche
"Solinger OB zu Woelkis Rückkehr: ""Kein ""Weiter so""!""",16012022_08:14,https://www.sueddeutsche.de/panorama/kirche-solingen-solinger-ob-zu-woelkis-rueckkehr-kein-weiter-so-dpa.urn-newsml-dpa-com-20090101-220116-99-727478,Kirche - Solingen,dpa,,,16012022,Sueddeutsche
Kaum noch Datenklau am Geldautomaten in NRW,16012022_08:13,https://www.sueddeutsche.de/wirtschaft/banken-frankfurt-am-main-kaum-noch-datenklau-am-geldautomaten-in-nrw-dpa.urn-newsml-dpa-com-20090101-220116-99-727466,Banken - Frankfurt am Main,dpa,,,16012022,Sueddeutsche
Besuch vom Eichelhäher: Ergebnisse der Nabu-Vogelzählung,16012022_08:13,https://www.sueddeutsche.de/wissen/naturschutz-mainz-besuch-vom-eichelhaeher-ergebnisse-der-nabu-vogelzaehlung-dpa.urn-newsml-dpa-com-20090101-220116-99-727364,Naturschutz - Mainz,dpa,,,16012022,Sueddeutsche
Teure Tulpen und Tomaten: Holländische Züchter unter Druck,16012022_08:11,https://www.sueddeutsche.de/wirtschaft/agrar-teure-tulpen-und-tomaten-hollaendische-zuechter-unter-druck-dpa.urn-newsml-dpa-com-20090101-220116-99-727020,Agrar,dpa,,,16012022,Sueddeutsche
Fünf Verletzte nach schwerem Unfall,16012022_08:11,https://www.sueddeutsche.de/panorama/unfaelle-halle-westfalen-fuenf-verletzte-nach-schwerem-unfall-dpa.urn-newsml-dpa-com-20090101-220116-99-727460,Unfälle - Halle (Westfalen),dpa,,,16012022,Sueddeutsche
Moritz Wagner gerät mit Doncic aneinander,16012022_08:11,https://www.sueddeutsche.de/sport/basketball-moritz-wagner-geraet-mit-doncic-aneinander-1.5508267,Basketball,,Meldungen im Überblick,"Der NBA-Basketballer der Orlando Magic zofft sich mit dem Mann der Mavericks. In Spaniens Fußball kommt es zu einem Eklat beim Derby in Sevilla. Ein junger norwegischer Skifahrer überrascht alle. 
                        
                            Meldungen im Überblick",16012022,Sueddeutsche
Flüchtlingszahlen steigen: Stamp für Rückführungsabkommen,16012022_08:10,https://www.sueddeutsche.de/politik/migration-duesseldorf-fluechtlingszahlen-steigen-stamp-fuer-rueckfuehrungsabkommen-dpa.urn-newsml-dpa-com-20090101-220116-99-727443,Migration - Düsseldorf,dpa,,,16012022,Sueddeutsche
Februar lockt mit zwei besonderen Hochzeitsterminen,16012022_08:10,https://www.sueddeutsche.de/leben/gesellschaft-leipzig-februar-lockt-mit-zwei-besonderen-hochzeitsterminen-dpa.urn-newsml-dpa-com-20090101-220116-99-727375,Gesellschaft - Leipzig,dpa,,,16012022,Sueddeutsche
NRW-Konditor verblüfft mit Torten: Farbeimer zum Reinbeißen,16012022_08:08,https://www.sueddeutsche.de/service/handwerk-krefeld-nrw-konditor-verbluefft-mit-torten-farbeimer-zum-reinbeissen-dpa.urn-newsml-dpa-com-20090101-220116-99-727421,Handwerk - Krefeld,dpa,,,16012022,Sueddeutsche
