Titel,Date_Info,URL,Overline,Breadcrumb,author,detailed_informations,Zugriff_Datum,News_page
Bundesweiter Inzidenzwert steigt auf 1220,05032022_03:33,https://www.sueddeutsche.de/politik/corona-aktuell-rki-inzidenzwert-neuinfektionen-1.5533259,Meldungen zum Coronavirus,,Nachrichten aus Deutschland und aller Welt,"Das RKI meldet damit zum dritten Mal in Folge einen leichten Anstieg der bundesweiten Sieben-Tage-Inzidenz. Bundesgesundheitsminister Lauterbach warnt vor einer Corona-Welle im Sommer.
                        
                            Nachrichten aus Deutschland und aller Welt",05032022,Sueddeutsche
Ökonom Hüther warnt vor Hyperinflation in Russland,05032022_03:31,https://www.sueddeutsche.de/wirtschaft/konjunktur-oekonom-huether-warnt-vor-hyperinflation-in-russland-dpa.urn-newsml-dpa-com-20090101-220305-99-392392,Konjunktur,dpa,,,05032022,Sueddeutsche
Erste Biathlon-Medaille verpasst: Wicker wird Fünfte,05032022_03:28,https://www.sueddeutsche.de/leben/behindertensport-erste-biathlon-medaille-verpasstwicker-wird-fuenfte-dpa.urn-newsml-dpa-com-20090101-220305-99-392442,Behindertensport,dpa,,,05032022,Sueddeutsche
Eichner hofft nach Pokal-Aus auf Reaktion in der Liga,05032022_02:21,https://www.sueddeutsche.de/sport/fussball-hamburg-eichner-hofft-nach-pokal-aus-auf-reaktion-in-der-liga-dpa.urn-newsml-dpa-com-20090101-220304-99-388247,Fußball - Hamburg,dpa,,,05032022,Sueddeutsche
Nordkorea testet erneut Rakete,05032022_02:18,https://www.sueddeutsche.de/politik/konflikte-nordkorea-testet-erneut-rakete-dpa.urn-newsml-dpa-com-20090101-220305-99-392114,Konflikte,dpa,,,05032022,Sueddeutsche
Bundesvorstand beendet Klausurtagung,05032022_02:11,https://www.sueddeutsche.de/politik/parteien-sankt-ingbert-bundesvorstand-beendet-klausurtagung-dpa.urn-newsml-dpa-com-20090101-220304-99-388365,Parteien - Sankt Ingbert,dpa,,,05032022,Sueddeutsche
Lauterbach: Müssen mit einer Corona-Sommerwelle rechnen,05032022_02:06,https://www.sueddeutsche.de/gesundheit/gesundheit-lauterbach-muessen-mit-einer-corona-sommerwelle-rechnen-dpa.urn-newsml-dpa-com-20090101-220305-99-391849,Gesundheit,dpa,,,05032022,Sueddeutsche
"""Aida""-Premiere mit Solidaritätsadresse an die Ukraine",05032022_01:41,https://www.sueddeutsche.de/kultur/musik-dresden-aida-premiere-mit-solidaritaetsadresse-an-die-ukraine-dpa.urn-newsml-dpa-com-20090101-220304-99-388224,Musik - Dresden,dpa,,,05032022,Sueddeutsche
SSW will Programm für die Landtagswahl beschließen,05032022_01:31,https://www.sueddeutsche.de/politik/landtag-harrislee-ssw-will-programm-fuer-die-landtagswahl-beschliessen-dpa.urn-newsml-dpa-com-20090101-220304-99-388404,Landtag - Harrislee,dpa,,,05032022,Sueddeutsche
"Berichte, Anträge und Wahlen bei Landesparteitag",05032022_01:15,https://www.sueddeutsche.de/politik/parteien-mainz-berichte-antraege-und-wahlen-bei-landesparteitag-dpa.urn-newsml-dpa-com-20090101-220304-99-388321,Parteien - Mainz,dpa,,,05032022,Sueddeutsche
VfB hofft auf Befreiungsschlag im Krisen-Duell mit Gladbach,05032022_01:13,https://www.sueddeutsche.de/sport/fussball-stuttgart-vfb-hofft-auf-befreiungsschlag-im-krisen-duell-mit-gladbach-dpa.urn-newsml-dpa-com-20090101-220304-99-388222,Fußball - Stuttgart,dpa,,,05032022,Sueddeutsche
"Lindners Appell: ""Kein Appeasement"" gegenüber Putin",05032022_01:12,https://www.sueddeutsche.de/politik/konflikte-lindners-appell-kein-appeasement-gegenueber-putin-dpa.urn-newsml-dpa-com-20090101-220305-99-391852,Konflikte,dpa,,,05032022,Sueddeutsche
"BBC, CNN und Bloomberg stellen Arbeit in Russland ein",05032022_01:06,https://www.sueddeutsche.de/politik/konflikte-bbc-cnn-und-bloomberg-stellen-arbeit-in-russland-ein-dpa.urn-newsml-dpa-com-20090101-220304-99-391331,Konflikte,dpa,,,05032022,Sueddeutsche
Wieder geht es um Kruse: Union spielt auswärts bei Wolfsburg,05032022_00:43,https://www.sueddeutsche.de/sport/fussball-berlin-wieder-geht-es-um-kruse-union-spielt-auswaerts-bei-wolfsburg-dpa.urn-newsml-dpa-com-20090101-220304-99-388219,Fußball - Berlin,dpa,,,05032022,Sueddeutsche
S&P Dow Jones streicht russische Aktien aus Börsenindizes,05032022_00:35,https://www.sueddeutsche.de/politik/krieg-sp-dow-jones-streicht-russische-aktien-aus-boersenindizes-dpa.urn-newsml-dpa-com-20090101-220305-99-391762,Krieg,dpa,,,05032022,Sueddeutsche
SC Freiburg ohne Mittelfeldspieler Höfler bei RB Leipzig,05032022_00:18,https://www.sueddeutsche.de/sport/fussball-leipzig-sc-freiburg-ohne-mittelfeldspieler-hoefler-bei-rb-leipzig-dpa.urn-newsml-dpa-com-20090101-220304-99-388759,Fußball - Leipzig,dpa,,,05032022,Sueddeutsche
"Falk Richter inszeniert ""Die Freiheit einer Frau""",05032022_00:16,https://www.sueddeutsche.de/kultur/theater-hamburg-falk-richter-inszeniert-die-freiheit-einer-frau-dpa.urn-newsml-dpa-com-20090101-220304-99-388295,Theater - Hamburg,dpa,,,05032022,Sueddeutsche
Wiedersehen für Kruse: VfL Wolfsburg empfängt Union Berlin,05032022_00:07,https://www.sueddeutsche.de/sport/fussball-wolfsburg-wiedersehen-fuer-kruse-vfl-wolfsburg-empfaengt-union-berlin-dpa.urn-newsml-dpa-com-20090101-220304-99-389641,Fußball - Wolfsburg,dpa,,,05032022,Sueddeutsche
Hertha-Trainer Korkut will Richtungsänderung gegen Frankfurt,04032022_23:41,https://www.sueddeutsche.de/sport/fussball-berlin-hertha-trainer-korkut-will-richtungsaenderung-gegen-frankfurt-dpa.urn-newsml-dpa-com-20090101-220304-99-388220,Fußball - Berlin,dpa,,,05032022,Sueddeutsche
"Zverev siegt, Struff patzt: Deutschland nur 1:1 in Brasilien",04032022_23:38,https://www.sueddeutsche.de/sport/tennis-zverev-siegt-struff-patzt-deutschland-nur-11-inbrasilien-dpa.urn-newsml-dpa-com-20090101-220304-99-390553,Tennis,dpa,,,05032022,Sueddeutsche
Europäische Fußball-Ligen schließen Russland aus,04032022_23:01,https://www.sueddeutsche.de/sport/fussball-europaeische-fussball-ligen-schliessen-russland-aus-dpa.urn-newsml-dpa-com-20090101-220304-99-391397,Fußball,dpa,,,05032022,Sueddeutsche
Kalenderblatt 2022: 5. März,04032022_22:55,https://www.sueddeutsche.de/wissen/geschichte-kalenderblatt-2022-5-maerz-dpa.urn-newsml-dpa-com-20090101-220221-99-220789,Geschichte,dpa,,,05032022,Sueddeutsche
AKW-Brand: Lage laut Botschafterin weiter sehr riskant,04032022_22:23,https://www.sueddeutsche.de/politik/konflikte-akw-brand-lage-laut-botschafterin-weiter-sehr-riskant-dpa.urn-newsml-dpa-com-20090101-220304-99-378428,Konflikte,dpa,,,05032022,Sueddeutsche
Bayern verpasst Überraschung,04032022_22:01,https://www.sueddeutsche.de/sport/euroleague-bayern-verpasst-ueberraschung-1.5541670,Euroleague,,,,05032022,Sueddeutsche
EHC München gewinnt knapp,04032022_22:01,https://www.sueddeutsche.de/sport/eishockey-ehc-muenchen-gewinnt-knapp-1.5541672,Eishockey,,,,05032022,Sueddeutsche
Augsburger Uduokhai droht Pause,04032022_21:58,https://www.sueddeutsche.de/bayern/fussball-bielefeld-augsburger-uduokhai-droht-pause-dpa.urn-newsml-dpa-com-20090101-220304-99-391051,Fußball - Bielefeld,dpa,,,05032022,Sueddeutsche
Bayern kassieren Heimniederlage gegen Olympiakos,04032022_21:56,https://www.sueddeutsche.de/bayern/basketball-muenchen-bayern-kassieren-heimniederlage-gegen-olympiakos-dpa.urn-newsml-dpa-com-20090101-220304-99-391052,Basketball - München,dpa,,,05032022,Sueddeutsche
Riesenschritt für Augsburg Richtung Klassenverbleib,04032022_21:56,https://www.sueddeutsche.de/sport/augsburg-bielefeld-bundesliga-1.5541726,Bundesliga,,,Abstiegskampf pur auf der Bielefelder Alm: In einem Spiel mit vielen Zweikämpfen und wenig fußballerischem Glanz holt Augsburg wichtige drei Punkte. Am Ende steht es 1:0.,05032022,Sueddeutsche
Bayern kassieren Heimniederlage gegen Olympiakos,04032022_21:52,https://www.sueddeutsche.de/sport/basketball-bayern-kassieren-heimniederlage-gegen-olympiakos-dpa.urn-newsml-dpa-com-20090101-220304-99-391029,Basketball,dpa,,,05032022,Sueddeutsche
Riesenschritt für Augsburg - Sieg in Bielefeld,04032022_21:46,https://www.sueddeutsche.de/sport/fussball-riesenschritt-fuer-augsburg-sieg-in-bielefeld-dpa.urn-newsml-dpa-com-20090101-220304-99-390807,Fußball,dpa,,,05032022,Sueddeutsche
MAD Lions hält Chance auf Playoffs in LoL-Liga LEC aufrecht,04032022_21:41,https://www.sueddeutsche.de/sport/e-sport-mad-lions-haelt-chance-auf-playoffs-in-lol-liga-lec-aufrecht-dpa.urn-newsml-dpa-com-20090101-220304-99-390935,E-Sport,dpa,,,05032022,Sueddeutsche
Augsburg gewinnt in Bielefeld und verbessert sich: Platz 14,04032022_21:31,https://www.sueddeutsche.de/sport/fussball-bielefeld-augsburg-gewinnt-in-bielefeld-und-verbessert-sich-platz-14-dpa.urn-newsml-dpa-com-20090101-220304-99-390836,Fußball - Bielefeld,dpa,,,05032022,Sueddeutsche
Auto prallt gegen Straßenbahn: Ein Schwerverletzter,04032022_21:10,https://www.sueddeutsche.de/wirtschaft/verkehr-seeheim-jugenheim-auto-prallt-gegen-strassenbahn-ein-schwerverletzter-dpa.urn-newsml-dpa-com-20090101-220304-99-390654,Verkehr - Seeheim-Jugenheim,dpa,,,05032022,Sueddeutsche
Russland blockiert Facebook und Twitter,04032022_21:09,https://www.sueddeutsche.de/politik/krieg-russland-blockiert-facebook-und-twitter-dpa.urn-newsml-dpa-com-20090101-220304-99-389361,Krieg,dpa,,,05032022,Sueddeutsche
DEL beeinflusst von Corona - Düsseldorfer EG holt Sieg,04032022_21:06,https://www.sueddeutsche.de/sport/eishockey-del-beeinflusst-von-corona-duesseldorfer-eg-holt-sieg-dpa.urn-newsml-dpa-com-20090101-220304-99-390583,Eishockey,dpa,,,05032022,Sueddeutsche
Nato beobachtet Einsatz von Streubomben,04032022_21:02,https://www.sueddeutsche.de/politik/international-nato-beobachtet-einsatz-von-streubomben-dpa.urn-newsml-dpa-com-20090101-220304-99-385339,International,dpa,,,05032022,Sueddeutsche
Merz zum Ukraine-Krieg: Jetzt Realitätsschock ernst nehmen,04032022_21:01,https://www.sueddeutsche.de/politik/parteien-saarbruecken-merz-zum-ukraine-krieg-jetzt-realitaetsschock-ernst-nehmen-dpa.urn-newsml-dpa-com-20090101-220304-99-390560,Parteien - Saarbrücken,dpa,,,05032022,Sueddeutsche
Ukraine-Krieg: HHLA bleibt trotz Einschränkungen gelassen,04032022_20:59,https://www.sueddeutsche.de/wirtschaft/schifffahrt-hamburg-ukraine-krieg-hhla-bleibt-trotz-einschraenkungen-gelassen-dpa.urn-newsml-dpa-com-20090101-220304-99-390454,Schifffahrt - Hamburg,dpa,,,05032022,Sueddeutsche
"""Er hat an uns geglaubt"": Auszeichnung für Laumann",04032022_20:39,https://www.sueddeutsche.de/leben/auszeichnungen-herne-er-hat-an-uns-geglaubt-auszeichnung-fuer-laumann-dpa.urn-newsml-dpa-com-20090101-220304-99-390291,Auszeichnungen - Herne,dpa,,,05032022,Sueddeutsche
Brücke zwischen Parallelwelten,04032022_20:39,https://www.sueddeutsche.de/muenchen/ebersberg/altes-kino-ebersberg-weltraum-1.5541266,Kultur in Ebersberg,,,"Ein Projekt im Alten Kino bringt Hörende und Gehörlose zusammen. Nun ist auch ein Stadtspaziergang geplant, der die Gäste an verschiedenen Orten in Ebersberg persönliche Geschichten entdecken lässt.",05032022,Sueddeutsche
Lasst Euch nicht erwischen,04032022_20:39,https://www.sueddeutsche.de/muenchen/ebersberg/landkreis-ebersberg-poing-erregung-oeffentlichen-aergernisses-1.5541260,Mitten in Poing,,Glosse von Wieland Bögel,"Das oben zitierte elfte Gebot einzuhalten ist in vielen Lebenslagen hilfreich, wie ein aktueller Fall aus Poing zeigt.
                        
                            Glosse von Wieland Bögel",05032022,Sueddeutsche
Gelb-blaue Solidarität,04032022_20:39,https://www.sueddeutsche.de/muenchen/ebersberg/krieg-in-der-ukraine-gelb-blaue-solidaritaet-1.5541543,Krieg in der Ukraine,,,"Menschen im Landkreis Ebersberg bekunden auf unterschiedliche Weise, dass sie zu den Menschen in der Ukraine stehen.",05032022,Sueddeutsche
"""Wir testen seit Monaten Produkte""",04032022_20:39,https://www.sueddeutsche.de/muenchen/ebersberg/unverpackt-laden-poing-marktplatz-plastikfrei-nachhaltigkeit-1.5541272,Poinger Unverpackt-Laden,,"Interview von Johanna Feckl, Poing","Wo früher ein Sonnenstudio war, soll in Poing demnächst der zweite Unverpackt-Laden im Landkreis Ebersberg öffnen. Maria Lindner und Annika Krätschmer sprechen vorab über den Umbau, ihr Sortiment und wie sie es auswählen. 
                        
                            Interview von Johanna Feckl, Poing",05032022,Sueddeutsche
Infektionszahlen sinken nicht,04032022_20:39,https://www.sueddeutsche.de/muenchen/ebersberg/corona-ebersberg-infektionszahlen-1.5541562,Corona im Landkreis Ebersberg,,,,05032022,Sueddeutsche
Wieder im Dialog,04032022_20:38,https://www.sueddeutsche.de/muenchen/ebersberg/brenner-nordzulauf-landkreis-ebersberg-verkehrsminister-christian-bernreiter-1.5541614,Brenner-Zulauf,,,"Der neue Verkehrsminister lädt zu einem Runden Tisch über die Zulaufstrecke zum Brenner. Er macht dabei auch klar, dass die Einflussmöglichkeiten des Freistaats begrenzt sind.",05032022,Sueddeutsche
Sperrung Garten- und Rathausstraße,04032022_20:38,https://www.sueddeutsche.de/muenchen/dachau/karlsfeld-gartenstrasse-sperrung-1.5541578,Straßenverkehr in Karlsfeld,,,,05032022,Sueddeutsche
Pfarrverband sammelt Sachspenden für Menschen in der Ukraine,04032022_20:38,https://www.sueddeutsche.de/muenchen/dachau/karlsfeld-pfarrverband-ukraine-1.5541576,Spendenaktion,,,,05032022,Sueddeutsche
Weg mit den Blumen!,04032022_20:38,https://www.sueddeutsche.de/muenchen/dachau/glosse-hebertshausen-spd-1.5541387,Mitten in Hebertshausen,,,"Der 8. März ist der Internationale Frauentag. Die Heberthausener SPD nimmt das zum Anlass, um am 5. März Rosen und Nelken zu verteilen. Warum nur?",05032022,Sueddeutsche
Beinahe-Crash auf der Autobahn,04032022_20:38,https://www.sueddeutsche.de/muenchen/wolfratshausen/unfall-ueberholmanoever-verkehrspolizei-autobahn-a95-1.5541281,Aus dem Polizeibericht,,,Auf der A95 zeigt der Fahrer eines weißen Kleintransporters den Mittelfinger nach einem gefährlichen Überholmanöver.,05032022,Sueddeutsche
Graffito am Gymnasium Icking,04032022_20:38,https://www.sueddeutsche.de/muenchen/wolfratshausen/sachbeschaedigung-graffito-am-gymnasium-icking-1.5541160,Sachbeschädigung,,,Die Rückwand der Schule wurde in der Nacht auf Mittwoch beschmiert. Der Schriftzug nimmt Bezug auf den Ukraine-Krieg.,05032022,Sueddeutsche
