Titel,Date_Info,URL,Overline,Breadcrumb,author,detailed_informations,Zugriff_Datum,News_page,Kategorie
Thioune mit Hennings und Ginczek gegen Schalke,13022022_13:17,https://www.sueddeutsche.de/sport/fussball-duesseldorf-thioune-mit-hennings-und-ginczek-gegen-schalke-dpa.urn-newsml-dpa-com-20090101-220213-99-107935,Fußball - Düsseldorf,dpa,,,14022022,Sueddeutsche,sport
Betrunkener Fahrradfahrer von Polizei erwischt: Zwei Mal,13022022_13:16,https://www.sueddeutsche.de/panorama/kriminalitaet-tangerhuette-betrunkener-fahrradfahrer-von-polizei-erwischt-zwei-mal-dpa.urn-newsml-dpa-com-20090101-220213-99-108290,Kriminalität - Tangerhütte,dpa,,,14022022,Sueddeutsche,panorama
Die Fantasie ist ein Fluchttier,13022022_13:15,https://www.sueddeutsche.de/leben/alexander-kluge-filmemacher-schriftsteller-erinnerung-fantasie-1.5525540,Alexander Kluge im Porträt,,Essay von Kurt Kister,"Der Schriftsteller, Filmkünstler und Geschichtensammler Alexander Kluge über vertikales Erzählen und das Bergwerk der Erinnerung. Ein Besuch in Schwabing.
                        
                            Essay von Kurt Kister",14022022,Sueddeutsche,leben
Unfall mit sieben Verletzten auf Straße im Zittauer Gebirge,13022022_13:14,https://www.sueddeutsche.de/panorama/unfaelle-oybin-unfall-mit-sieben-verletzten-auf-strasse-im-zittauer-gebirge-dpa.urn-newsml-dpa-com-20090101-220213-99-108277,Unfälle - Oybin,dpa,,,14022022,Sueddeutsche,panorama
Röiseland auf Rekordjagd: Norwegerin sammelt Medaillen,13022022_13:12,https://www.sueddeutsche.de/sport/biathlon-roeiseland-auf-rekordjagd-norwegerin-sammelt-medaillen-dpa.urn-newsml-dpa-com-20090101-220213-99-108231,Biathlon,dpa,,,14022022,Sueddeutsche,sport
Havertz schießt Chelsea dank Elfmeter-Trick zum Sieg,13022022_13:10,https://www.sueddeutsche.de/sport/fussball-havertz-schiesst-chelsea-dank-elfmeter-trick-zum-sieg-dpa.urn-newsml-dpa-com-20090101-220212-99-99094,Fußball,dpa,,,14022022,Sueddeutsche,sport
Schweiz muss Tabakwerbung einschränken,13022022_13:10,https://www.sueddeutsche.de/wissen/forschung-schweiz-muss-tabakwerbung-einschraenken-dpa.urn-newsml-dpa-com-20090101-220213-99-108139,Forschung,dpa,,,14022022,Sueddeutsche,wissen
Die Woche von Katharina Marie Schubert,13022022_13:08,https://www.sueddeutsche.de/muenchen/muenchen-katharina-marie-schubert-freizeit-kultur-tipps-kammerspiele-1.5525187,Kultur- und Freizeittipps,,,"Spaziergänge im Glockenbachviertel, ein Besuch in der Pinakothek der Moderne - oder der Start ihres Langfilmdebüts: Die Schauspielerin und Regisseurin gibt Tipps für die Woche vom 14. bis 20. Februar. Ein Gastbeitrag.",14022022,Sueddeutsche,muenchen
"""Rabiye Kurnaz gegen George W. Bush"" im Rennen um den Goldenen Bären",13022022_13:04,https://www.sueddeutsche.de/kultur/rabiye-kurnaz-gegen-george-w-bush-im-rennen-um-den-goldenen-baeren-1.5527816,,,,"Video
                    
                    
                        Der Film von Andreas Dresen erzählt vom Kampf einer Mutter um die Freilassung ihres Sohnes aus dem Gefangenenlager Guantanamo.",14022022,Sueddeutsche,kultur
Extremschwimmer Bieber bricht Eismeilen-Rekord,13022022_13:03,https://www.sueddeutsche.de/leben/leute-extremschwimmer-bieber-bricht-eismeilen-rekord-dpa.urn-newsml-dpa-com-20090101-220213-99-108124,Leute,dpa,,,14022022,Sueddeutsche,leben
Golfer Long Dritter in V.A.E. - Siem und Kieffer auch stark,13022022_13:02,https://www.sueddeutsche.de/sport/golf-golfer-long-dritter-in-vae-siem-und-kieffer-auch-stark-dpa.urn-newsml-dpa-com-20090101-220213-99-107707,Golf,dpa,,,14022022,Sueddeutsche,sport
Personelle Wechsel im Eishockey-Team - Aus den Birken im Tor,13022022_13:02,https://www.sueddeutsche.de/sport/olympia-personelle-wechsel-im-eishockey-team-aus-den-birken-im-tor-dpa.urn-newsml-dpa-com-20090101-220213-99-108115,Olympia,dpa,,,14022022,Sueddeutsche,sport
Ein Teufelspakt?,13022022_13:01,https://www.sueddeutsche.de/politik/prantls-blick-1.5525836,Prantls Blick,,"Von Heribert Prantl, München","Nord Stream 2 im Licht der Geschichte: Vor hundert Jahren wurde der Rapallo-Vertrag zwischen Deutschland und Sowjetrussland geschlossen.
                        
                            Von Heribert Prantl, München",14022022,Sueddeutsche,politik
Chef von Motorenbauer Deutz muss abtreten,13022022_12:55,https://www.sueddeutsche.de/wirtschaft/maschinenbau-chef-von-motorenbauer-deutz-muss-abtreten-dpa.urn-newsml-dpa-com-20090101-220213-99-107968,Maschinenbau,dpa,,,14022022,Sueddeutsche,wirtschaft
Acht Deutsche bei Biathlon-Massenstarts dabei,13022022_12:52,https://www.sueddeutsche.de/sport/olympia-acht-deutsche-beibiathlon-massenstarts-dabei-dpa.urn-newsml-dpa-com-20090101-220213-99-106021,Olympia,dpa,,,14022022,Sueddeutsche,sport
Colson Baker: Frauen haben starken Einfluss auf mich,13022022_12:49,https://www.sueddeutsche.de/kultur/film-colson-baker-frauen-haben-starken-einfluss-auf-mich-dpa.urn-newsml-dpa-com-20090101-220213-99-107903,Film,dpa,,,14022022,Sueddeutsche,kultur
Warten aufs große Beben,13022022_12:47,https://www.sueddeutsche.de/wissen/istanbul-erdbeben-gefahr-wissenschaft-vorzeichen-1.5526916,Geowissenschaften,,Von Benjamin von Brackel,"Istanbul droht ein Jahrhundertbeben, das die größte Stadt Europas ins Chaos stürzen würde. Wissenschaftler aus Deutschland versuchen herauszufinden, was genau sich im Marmarameer abspielt.
                        
                            Von Benjamin von Brackel",14022022,Sueddeutsche,wissen
"Gut 26 Millionen aus Programm ""Sofort-Kredit-Saarland""",13022022_12:46,https://www.sueddeutsche.de/gesundheit/gesundheit-saarbruecken-gut-26-millionen-aus-programm-sofort-kredit-saarland-dpa.urn-newsml-dpa-com-20090101-220213-99-107966,Gesundheit - Saarbrücken,dpa,,,14022022,Sueddeutsche,gesundheit
Freier Platz für Frau nach Stühlerücken im Deutz-Vorstand,13022022_12:45,https://www.sueddeutsche.de/wirtschaft/unternehmen-koeln-freier-platz-fuer-frau-nach-stuehleruecken-im-deutz-vorstand-dpa.urn-newsml-dpa-com-20090101-220213-99-107141,Unternehmen - Köln,dpa,,,14022022,Sueddeutsche,wirtschaft
Frühe Krönung eines Frühbegabten,13022022_12:45,https://www.sueddeutsche.de/sport/olympia-ski-alpin-riesenslalom-marco-odermatt-1.5527761,Marco Odermatt bei Olympia,,Von Johannes Knuth,"Er könne alles gewinnen, wurde Marco Odermatt prophezeit: Nun wird der Schweizer im Alter von 24 Jahren Olympiasieger im Riesenslalom, weil er so fährt, wie er ist: frech, gewitzt, ohne Angst vor Fehlern.
                        
                            Von Johannes Knuth",14022022,Sueddeutsche,sport
"Wird der Humor im Alter besser, Rocko Schamoni?",13022022_12:44,https://sz-magazin.sueddeutsche.de/sagen-sie-jetzt-nichts/rocko-schamoni-interview-ohne-worte-91208,Sagen Sie jetzt nichts,,Fotos: Axel Martens,"Der Musiker, Autor und Regisseur Rocko Schamoni im Interview ohne Worte über die Hamburger-Nachtszene, die Liebe und warum er sich selbst als King bezeichnet.
                        
                            Fotos: Axel Martens",14022022,Sueddeutsche,sagen-sie-jetzt-nichts
Unzulässige Durchsuchung: Grüne wollen Havliza befragen,13022022_12:42,https://www.sueddeutsche.de/politik/landtag-hannover-unzulaessige-durchsuchung-gruene-wollen-havliza-befragen-dpa.urn-newsml-dpa-com-20090101-220213-99-107907,Landtag - Hannover,dpa,,,14022022,Sueddeutsche,politik
20-Jähriger bei Messerattacke lebensgefährlich verletzt,13022022_12:40,https://www.sueddeutsche.de/panorama/kriminalitaet-frankfurt-am-main-20-jaehriger-bei-messerattacke-lebensgefaehrlich-verletzt-dpa.urn-newsml-dpa-com-20090101-220213-99-107899,Kriminalität - Frankfurt am Main,dpa,,,14022022,Sueddeutsche,panorama
Ex-Bundeswehroffizier Franco A. kurzzeitig festgenommen,13022022_12:39,https://www.sueddeutsche.de/panorama/terrorismus-ex-bundeswehroffizier-franco-a-kurzzeitig-festgenommen-dpa.urn-newsml-dpa-com-20090101-220213-99-101199,Terrorismus,dpa,,,14022022,Sueddeutsche,panorama
Heimpleite bei Fan-Rückkehr: Eintracht im Stimmungstief,13022022_12:39,https://www.sueddeutsche.de/sport/fussball-frankfurt-am-main-heimpleite-bei-fan-rueckkehr-eintracht-im-stimmungstief-dpa.urn-newsml-dpa-com-20090101-220212-99-97755,Fußball - Frankfurt am Main,dpa,,,14022022,Sueddeutsche,sport
Feuerwehr rettet mehrere Menschen aus brennendem Haus,13022022_12:38,https://www.sueddeutsche.de/panorama/braende-frankfurt-am-main-feuerwehr-rettet-mehrere-menschen-aus-brennendem-haus-dpa.urn-newsml-dpa-com-20090101-220213-99-107880,Brände - Frankfurt am Main,dpa,,,14022022,Sueddeutsche,panorama
Günther: Bis Ostern Maskenpflicht-Ende angehen,13022022_12:37,https://www.sueddeutsche.de/gesundheit/gesundheit-kiel-guenther-bis-ostern-maskenpflicht-ende-angehen-dpa.urn-newsml-dpa-com-20090101-220213-99-107850,Gesundheit - Kiel,dpa,,,14022022,Sueddeutsche,gesundheit
"Von Narren, Lust und alten Liebhabern",13022022_12:36,https://www.sueddeutsche.de/panorama/iris-berben-kai-wiesinger-emma-thompson-claire-denis-promi-promi-news-1.5527787,Leute,,,"Iris Berben sieht sich als Vertreterin der ""IG Clowns"", Kai Wiesinger findet es dumm, sich neben einem Hund zu fotografieren und Emma Thompson hat Gesprächsbedarf.",14022022,Sueddeutsche,panorama
Großeinsatz: Feuerwehr löschen brennenden Reifenhaufen,13022022_12:35,https://www.sueddeutsche.de/panorama/braende-bilsen-grosseinsatz-feuerwehr-loeschen-brennenden-reifenhaufen-dpa.urn-newsml-dpa-com-20090101-220213-99-107814,Brände - Bilsen,dpa,,,14022022,Sueddeutsche,panorama
Zwei Frauen nach Brand in Chossewitz im Krankenhaus,13022022_12:33,https://www.sueddeutsche.de/panorama/braende-friedland-zwei-frauen-nach-brand-in-chossewitz-im-krankenhaus-dpa.urn-newsml-dpa-com-20090101-220213-99-107800,Brände - Friedland,dpa,,,14022022,Sueddeutsche,panorama
Colson Baker: Frauen haben starken Einfluss auf mich,13022022_12:32,https://www.sueddeutsche.de/kultur/film-berlin-colson-baker-frauen-haben-starken-einfluss-auf-mich-dpa.urn-newsml-dpa-com-20090101-220213-99-107781,Film - Berlin,dpa,,,14022022,Sueddeutsche,kultur
Wie zu heiß gewaschene Clowns,13022022_12:31,https://www.sueddeutsche.de/sport/olympia-deutsches-team-outfits-mode-1.5527757,Stilkritik zu deutschen Olympia-Outfits,,Von Tanja Rest,"Die Designer des deutschen Olympia-Dresses wollten etwas Besonderes - doch das Fazit fällt vernichtend aus. Deutschlands Sportkleidung wirkt auch in China unglücklich und schrankartig. 
                        
                            Von Tanja Rest",14022022,Sueddeutsche,sport
Sattelzugfahrer verbrennt in Fahrerkabine,13022022_12:30,https://www.sueddeutsche.de/bayern/verkehr-pegnitz-sattelzugfahrer-verbrennt-in-fahrerkabine-dpa.urn-newsml-dpa-com-20090101-220213-99-104671,Verkehr - Pegnitz,dpa,,,14022022,Sueddeutsche,bayern
Innenministerin Faeser: Bayern soll Impfpflicht umsetzen,13022022_12:29,https://www.sueddeutsche.de/bayern/gesundheit-berlin-innenministerin-faeser-bayern-soll-impfpflicht-umsetzen-dpa.urn-newsml-dpa-com-20090101-220213-99-107758,Gesundheit - Berlin,dpa,,,14022022,Sueddeutsche,bayern
Ukraine übt den Ernstfall,13022022_12:25,https://www.sueddeutsche.de/panorama/ukraine-uebt-den-ernstfall-1.5527780,,,,"Video
                    
                    
                        In der Nähe zur Krim wurde ein Training von Sicherheitskräften durchgeführt, bei dem die Situation von eskalierenden Protesten simuliert wurde.",14022022,Sueddeutsche,panorama
Kriegsangst in Europa: Moskau und Kiew wiegeln ab,13022022_12:17,https://www.sueddeutsche.de/panorama/kriegsangst-in-europa-moskau-und-kiew-wiegeln-ab-1.5527768,,,,"Video
                    
                    
                        Die US-Warnungen vor einem Krieg um die Ukraine werden dramatischer. Staaten rufen ihre Bürger auf, das Land zu verlassen, weil es nach einem Angriff Russlands zu spät sein könnte. Moskau spricht von einer ""Propaganda-Kampagne"" ohne Beweise.",14022022,Sueddeutsche,panorama
Stau beim Landeanflug zum Super Bowl,13022022_12:17,https://www.sueddeutsche.de/reise/super-bowl-los-angeles-privatjet-kurioses-1.5524241,"Kolumne ""Ende der Reise""",,Glosse von Stefan Fischer,"Zehntausende Zuschauer kommen zum Super Bowl nach Los Angeles. Viele davon in ihrem Privatjet. Rund um das Football-Endspiel wird es also eng am Himmel über der Stadt.
                        
                            Glosse von Stefan Fischer",14022022,Sueddeutsche,reise
Sattelzugfahrer verbrennt in Fahrerkabine,13022022_12:15,https://www.sueddeutsche.de/bayern/bayreuth-lastwagen-a9-unfall-1.5527592,Bayreuth,,,Der Lastwagen ist am frühen Sonntagmorgen auf der A9 von der Fahrbahn abgekommen und auf die linke Seite gekippt. Der Beifahrer konnte sich selbst aus der brennenden Kabine befreien.,14022022,Sueddeutsche,bayern
Bilder des Tages,13022022_12:15,https://www.sueddeutsche.de/leben/momentaufnahmen-im-februar-1.5519616,Momentaufnahmen im Februar,,,"Bilder
                    
                    
                        Schönes, Erschreckendes, Absurdes und ganz Alltägliches: Momentaufnahmen aus allen Ecken der Welt, laufend aktualisiert.",14022022,Sueddeutsche,leben
Finnen ringen Schweden nieder - Beide Teams im Viertelfinale,13022022_12:09,https://www.sueddeutsche.de/sport/olympia-finnen-ringen-schweden-nieder-beide-teams-im-viertelfinale-dpa.urn-newsml-dpa-com-20090101-220213-99-107337,Olympia,dpa,,,14022022,Sueddeutsche,sport
"Der Mann, der ihm die Schmerzen zufügte",13022022_12:08,https://www.sueddeutsche.de/sport/formel-1-lewis-hamilton-michael-masi-1.5527077,Hamilton in der Formel 1,,Von Philipp Schneider,"Nach dem denkwürdigen Finale der Formel-1-Saison tauchte Lewis Hamilton für zwei Monate ab. Nun ist er zurück - und dürfte mit Spannung ein Urteil über Rennleiter Michael Masi erwarten.
                        
                            Von Philipp Schneider",14022022,Sueddeutsche,sport
"Hertha-Trainer Korkut: ""Befindlichkeiten neu regulieren""",13022022_12:08,https://www.sueddeutsche.de/sport/fussball-hertha-trainer-korkut-befindlichkeiten-neu-regulieren-dpa.urn-newsml-dpa-com-20090101-220213-99-106533,Fußball,dpa,,,14022022,Sueddeutsche,sport
CDU-Fraktionschef für höhere Pendlerpauschale von 38 Cent,13022022_11:59,https://www.sueddeutsche.de/wirtschaft/energie-erfurt-cdu-fraktionschef-fuer-hoehere-pendlerpauschale-von-38-cent-dpa.urn-newsml-dpa-com-20090101-220212-99-93267,Energie - Erfurt,dpa,,,14022022,Sueddeutsche,wirtschaft
Weltkriegsbombe auf Baustelle in Hakenfelde entschärft,13022022_11:58,https://www.sueddeutsche.de/panorama/notfaelle-berlin-weltkriegsbombe-auf-baustelle-in-hakenfelde-entschaerft-dpa.urn-newsml-dpa-com-20090101-220213-99-107295,Notfälle - Berlin,dpa,,,14022022,Sueddeutsche,panorama
"Geiger zum Mixed-Aus: Da hatte einer ein ""Ego-Problem""",13022022_11:57,https://www.sueddeutsche.de/sport/skispringen-geiger-zum-mixed-aus-da-hatte-einer-ein-ego-problem-dpa.urn-newsml-dpa-com-20090101-220213-99-106980,Skispringen,dpa,,,14022022,Sueddeutsche,sport
Deutsches Team Rogue in Playoffs des Six Invitational,13022022_11:56,https://www.sueddeutsche.de/sport/e-sport-deutsches-team-rogue-in-playoffs-des-six-invitational-dpa.urn-newsml-dpa-com-20090101-220213-99-107198,E-Sport,dpa,,,14022022,Sueddeutsche,sport
"Sophie Rois über Sex-Szenen im Film: ""Es ist ganz leicht""",13022022_11:55,https://www.sueddeutsche.de/kultur/film-sophie-rois-ueber-sex-szenen-im-film-es-ist-ganz-leicht-dpa.urn-newsml-dpa-com-20090101-220213-99-107112,Film,dpa,,,14022022,Sueddeutsche,kultur
Ist das Schweizer Modell immer noch ein Vorbild?,13022022_11:55,https://www.sueddeutsche.de/politik/schweiz-volksinitiativen-mitbestimmung-1.5526959,Mitbestimmung,,"Von Isabel Pfaff, Bern","Schweiz ist das Paradebeispiel für direkte Demokratie. An diesem Sonntag sollen die Bürger über vier Vorlagen befinden. Mal wieder. Die Zahl der Initiativen und Referenden ist stark angestiegen. So stark, dass sich die Frage stellt: Wie sinnvoll ist das System eigentlich noch?
                        
                            Von Isabel Pfaff, Bern",14022022,Sueddeutsche,politik
"""Krimi mit Happy End"": Silber-Coup der Langläuferinnen",13022022_11:52,https://www.sueddeutsche.de/sport/ski-nordisch-krimi-mit-happy-end-silber-coup-der-langlaeuferinnen-dpa.urn-newsml-dpa-com-20090101-220213-99-105557,Ski nordisch,dpa,,,14022022,Sueddeutsche,sport
Medien: Schüsse nahe Justin-Bieber-Party in Los Angeles,13022022_11:49,https://www.sueddeutsche.de/panorama/kriminalitaet-medienschuesse-nahe-justin-bieber-party-in-los-angeles-dpa.urn-newsml-dpa-com-20090101-220213-99-106184,Kriminalität,dpa,,,14022022,Sueddeutsche,panorama
