Titel,Date_Info,URL,Overline,Breadcrumb,author,detailed_informations,Zugriff_Datum,News_page
Mehr Sozialwohnungen: Trendwende laut Al-Wazir geschafft,26012022_13:40,https://www.sueddeutsche.de/wirtschaft/wohnen-wiesbaden-mehr-sozialwohnungen-trendwende-laut-al-wazir-geschafft-dpa.urn-newsml-dpa-com-20090101-220126-99-852192,Wohnen - Wiesbaden,dpa,,,26012022,Sueddeutsche
Tagespflegemutter führt Hund aus - Erlaubnis entzogen,26012022_13:40,https://www.sueddeutsche.de/panorama/urteile-tagespflegemutter-fuehrt-hund-aus-erlaubnis-entzogen-dpa.urn-newsml-dpa-com-20090101-220126-99-859231,Urteile,dpa,,,26012022,Sueddeutsche
Söder fordert Rückkehr zu längerem Genesenenstatus,26012022_13:39,https://www.sueddeutsche.de/bayern/corona-bayern-aktuell-inzidenz-genesenenstatus-lauterbach-1.5512150,Coronavirus-Newsblog für Bayern,,Alle Entwicklungen im Überblick,"Der Bund solle die Verkürzung von sechs auf drei Monate zurücknehmen, sagt Bayerns Regierungschef - und übt Kritik an Gesundheitsminister Lauterbach. Die Inzidenz springt auf mehr als 1000.
                        
                            Alle Entwicklungen im Überblick",26012022,Sueddeutsche
Defektes Weichenstück stört Straßenbahnverkehr,26012022_13:39,https://www.sueddeutsche.de/wirtschaft/verkehr-karlsruhe-defektes-weichenstueck-stoert-strassenbahnverkehr-dpa.urn-newsml-dpa-com-20090101-220126-99-859531,Verkehr - Karlsruhe,dpa,,,26012022,Sueddeutsche
Noch kein Termin zwischen IOC-Chef Bach und Peng Shuai,26012022_13:37,https://www.sueddeutsche.de/politik/sportpolitik-noch-kein-termin-zwischen-ioc-chef-bach-und-peng-shuai-dpa.urn-newsml-dpa-com-20090101-220126-99-859464,Sportpolitik,dpa,,,26012022,Sueddeutsche
Darum geht's in der großen Impfpflicht-Debatte im Bundestag,26012022_13:36,https://www.sueddeutsche.de/gesundheit/gesundheit-darum-gehts-in-der-grossen-impfpflicht-debatte-im-bundestag-dpa.urn-newsml-dpa-com-20090101-220126-99-858948,Gesundheit,dpa,,,26012022,Sueddeutsche
Corona-Fälle: Europapokal-Spiel in Stuttgart abgesagt,26012022_13:34,https://www.sueddeutsche.de/sport/volleyball-schwerin-corona-faelle-europapokal-spiel-in-stuttgart-abgesagt-dpa.urn-newsml-dpa-com-20090101-220126-99-859488,Volleyball - Schwerin,dpa,,,26012022,Sueddeutsche
Stammstrecke wird zwischen Ostbahnhof und Hackerbrücke gesperrt,26012022_13:34,https://www.sueddeutsche.de/muenchen/muenchen-stammstrecke-s-bahn-bauarbeiten-verkehr-1.5515677,S-Bahn München,,,"Weil neun Kilometer Schienen ausgetauscht werden müssen, fährt die S-Bahn an den kommenden beiden Wochenenden nur eingeschränkt. Passagiere müssen mitunter auf Trambahnen und Busse ausweichen und längere Fahrzeiten einplanen.",26012022,Sueddeutsche
Ministerium: Testpflicht-Änderung ist rechtlich geboten,26012022_13:33,https://www.sueddeutsche.de/gesundheit/gesundheit-schwerin-ministerium-testpflicht-aenderung-ist-rechtlich-geboten-dpa.urn-newsml-dpa-com-20090101-220126-99-859471,Gesundheit - Schwerin,dpa,,,26012022,Sueddeutsche
"Ermittlungsgruppe ""Booster"" mit positiver Zwischenbilanz",26012022_13:32,https://www.sueddeutsche.de/panorama/kriminalitaet-luebeck-ermittlungsgruppe-booster-mit-positiver-zwischenbilanz-dpa.urn-newsml-dpa-com-20090101-220126-99-859461,Kriminalität - Lübeck,dpa,,,26012022,Sueddeutsche
"Kahn: Salihamidzic ""eine lange Zeit"" beim FC Bayern",26012022_13:32,https://www.sueddeutsche.de/bayern/fussball-muenchen-kahn-salihamidzic-eine-lange-zeit-beim-fc-bayern-dpa.urn-newsml-dpa-com-20090101-220126-99-859420,Fußball - München,dpa,,,26012022,Sueddeutsche
Landesbank Baden-Württemberg übernimmt Berlin Hyp,26012022_13:32,https://www.sueddeutsche.de/wirtschaft/banken-stuttgart-landesbank-baden-wuerttemberg-uebernimmt-berlin-hyp-dpa.urn-newsml-dpa-com-20090101-220126-99-859329,Banken - Stuttgart,dpa,,,26012022,Sueddeutsche
CDU und FDP wollen bei Maßnahmen an einem Strang ziehen,26012022_13:32,https://www.sueddeutsche.de/politik/landtag-duesseldorf-cdu-und-fdp-wollen-bei-massnahmen-an-einem-strang-ziehen-dpa.urn-newsml-dpa-com-20090101-220126-99-855443,Landtag - Düsseldorf,dpa,,,26012022,Sueddeutsche
Freispruch im Prozess um Waffenverkauf an Lübcke-Mörder,26012022_13:31,https://www.sueddeutsche.de/politik/extremismus-paderborn-freispruch-im-prozess-um-waffenverkauf-an-luebcke-moerder-dpa.urn-newsml-dpa-com-20090101-220126-99-857353,Extremismus - Paderborn,dpa,,,26012022,Sueddeutsche
Otte lässt Amt als Chef der Werteunion ruhen,26012022_13:30,https://www.sueddeutsche.de/politik/cdu-otte-afd-werteunion-1.5515605,Kandidat für Bundespräsidentenwahl,,,"Er tritt auf Vorschlag der AfD bei der Bundespräsidentenwahl an, die CDU hat deshalb ein Parteiausschlussverfahren eingeleitet. Er habe dies zur Kenntnis genommen, so Otte.",26012022,Sueddeutsche
"""Geboostert-Band"" soll Zugang zur Gastronomie vereinfachen",26012022_13:30,https://www.sueddeutsche.de/gesundheit/krankheiten-bremen-geboostert-band-soll-zugang-zur-gastronomie-vereinfachen-dpa.urn-newsml-dpa-com-20090101-220126-99-859406,Krankheiten - Bremen,dpa,,,26012022,Sueddeutsche
RKI meldet 164.000 Neuinfektionen binnen 24 Stunden,26012022_13:30,https://www.sueddeutsche.de/gesundheit/gesundheit-rki-meldet-164000-neuinfektionen-binnen-24-stunden-dpa.urn-newsml-dpa-com-20090101-220126-99-852187,Gesundheit,dpa,,,26012022,Sueddeutsche
Polizei versucht Rekonstruktion des Heidelberger Amoklaufs,26012022_13:30,https://www.sueddeutsche.de/panorama/kriminalitaet-mannheim-polizei-versucht-rekonstruktion-des-heidelberger-amoklaufs-dpa.urn-newsml-dpa-com-20090101-220126-99-857652,Kriminalität - Mannheim,dpa,,,26012022,Sueddeutsche
EU-Gericht erklärt Milliardenstrafe gegen Intel für nichtig,26012022_13:28,https://www.sueddeutsche.de/politik/eu-eu-gericht-erklaert-milliardenstrafe-gegen-intel-fuer-nichtig-dpa.urn-newsml-dpa-com-20090101-220126-99-856944,EU,dpa,,,26012022,Sueddeutsche
Wirt verliert Streit über Betriebsschließungsversicherung,26012022_13:28,https://www.sueddeutsche.de/wirtschaft/gastgewerbe-karlsruhe-wirt-verliert-streit-ueber-betriebsschliessungsversicherung-dpa.urn-newsml-dpa-com-20090101-220125-99-848475,Gastgewerbe - Karlsruhe,dpa,,,26012022,Sueddeutsche
Ex-Musiker von In Extremo: Boris Pfeiffer gestorben,26012022_13:28,https://www.sueddeutsche.de/kultur/musik-wandlitz-ex-musiker-von-in-extremo-boris-pfeiffer-gestorben-dpa.urn-newsml-dpa-com-20090101-220126-99-856750,Musik - Wandlitz,dpa,,,26012022,Sueddeutsche
"""Bin offensiv ausgerichtet"": Björkan ist angriffslustig",26012022_13:27,https://www.sueddeutsche.de/sport/fussball-berlin-bin-offensiv-ausgerichtet-bjoerkan-ist-angriffslustig-dpa.urn-newsml-dpa-com-20090101-220126-99-859306,Fußball - Berlin,dpa,,,26012022,Sueddeutsche
"Fakultät nach Amoklauf ""im Schockmodus"" - Hörsaal bleibt zu",26012022_13:27,https://www.sueddeutsche.de/panorama/kriminalitaet-heidelberg-fakultaet-nach-amoklauf-im-schockmodus-hoersaal-bleibt-zu-dpa.urn-newsml-dpa-com-20090101-220126-99-852182,Kriminalität - Heidelberg,dpa,,,26012022,Sueddeutsche
Verbände: Mehr Tempo beim Ausbau der erneuerbaren Energien,26012022_13:26,https://www.sueddeutsche.de/wirtschaft/energie-kiel-verbaende-mehr-tempo-beim-ausbau-der-erneuerbaren-energien-dpa.urn-newsml-dpa-com-20090101-220126-99-859309,Energie - Kiel,dpa,,,26012022,Sueddeutsche
"Kahn froh über Fans: ""Wichtig, dieses Signal zu setzen""",26012022_13:25,https://www.sueddeutsche.de/bayern/fussball-muenchen-kahn-froh-ueber-fans-wichtig-dieses-signal-zu-setzen-dpa.urn-newsml-dpa-com-20090101-220126-99-859308,Fußball - München,dpa,,,26012022,Sueddeutsche
Spuren von Pflanzenschutzmitteln: Yamswurzeln zurückgerufen,26012022_13:24,https://www.sueddeutsche.de/bayern/lebensmittel-unterschleissheim-spuren-von-pflanzenschutzmittelnyamswurzeln-zurueckgerufen-dpa.urn-newsml-dpa-com-20090101-220126-99-859297,Lebensmittel - Unterschleißheim,dpa,,,26012022,Sueddeutsche
Freispruch im Prozess um Waffenverkauf an Lübcke-Mörder,26012022_13:24,https://www.sueddeutsche.de/politik/extremismus-freispruch-im-prozess-um-waffenverkauf-an-luebcke-moerder-dpa.urn-newsml-dpa-com-20090101-220126-99-857334,Extremismus,dpa,,,26012022,Sueddeutsche
Landesbeteiligungen rauschen wegen Corona tief ins Minus,26012022_13:23,https://www.sueddeutsche.de/bayern/landtag-muenchen-landesbeteiligungen-rauschen-wegen-corona-tief-ins-minus-dpa.urn-newsml-dpa-com-20090101-220126-99-858018,Landtag - München,dpa,,,26012022,Sueddeutsche
Landesparlament passt Regeln für von Corona Genesene an,26012022_13:22,https://www.sueddeutsche.de/politik/landtag-magdeburg-landesparlament-passt-regeln-fuer-von-corona-genesene-an-dpa.urn-newsml-dpa-com-20090101-220126-99-859280,Landtag - Magdeburg,dpa,,,26012022,Sueddeutsche
Experten suchen weitere Missbrauchsopfer von früherem Arzt,26012022_13:22,https://www.sueddeutsche.de/panorama/kriminalitaet-saarbruecken-experten-suchen-weitere-missbrauchsopfer-von-frueherem-arzt-dpa.urn-newsml-dpa-com-20090101-220125-99-847911,Kriminalität - Saarbrücken,dpa,,,26012022,Sueddeutsche
Roth: Erinnerung an Nazi-Terror im Gedächtnis verankern,26012022_13:21,https://www.sueddeutsche.de/wissen/geschichte-berlin-roth-erinnerung-an-nazi-terror-im-gedaechtnis-verankern-dpa.urn-newsml-dpa-com-20090101-220126-99-859248,Geschichte - Berlin,dpa,,,26012022,Sueddeutsche
Höhere Zulagen für Eurowings-Personal,26012022_13:21,https://www.sueddeutsche.de/karriere/tarife-hoehere-zulagen-fuer-eurowings-personal-dpa.urn-newsml-dpa-com-20090101-220126-99-858195,Tarife,dpa,,,26012022,Sueddeutsche
Adidas kündigt Einstellung von 2800 Mitarbeitern an,26012022_13:17,https://www.sueddeutsche.de/bayern/sportartikel-herzogenaurach-adidas-kuendigt-einstellung-von-2800-mitarbeitern-an-dpa.urn-newsml-dpa-com-20090101-220126-99-859203,Sportartikel - Herzogenaurach,dpa,,,26012022,Sueddeutsche
Bildungsverwaltung plant Studie zu Konflikten an Schulen,26012022_13:17,https://www.sueddeutsche.de/bildung/schulen-berlin-bildungsverwaltung-plant-studie-zu-konflikten-an-schulen-dpa.urn-newsml-dpa-com-20090101-220126-99-859206,Schulen - Berlin,dpa,,,26012022,Sueddeutsche
CSU-Politiker Mayer gibt sein Amt als DOSB-Vizepräsident auf,26012022_13:16,https://www.sueddeutsche.de/politik/sportpolitik-csu-politiker-mayer-gibt-sein-amt-als-dosb-vizepraesident-auf-dpa.urn-newsml-dpa-com-20090101-220126-99-859136,Sportpolitik,dpa,,,26012022,Sueddeutsche
Pferdesport: Final-Turnier in Leipzig trotz Weltcup-Absagen,26012022_13:16,https://www.sueddeutsche.de/sport/pferdesport-lausanne-pferdesport-final-turnier-in-leipzig-trotz-weltcup-absagen-dpa.urn-newsml-dpa-com-20090101-220126-99-859192,Pferdesport - Lausanne,dpa,,,26012022,Sueddeutsche
Weil warnt vor frühzeitigen Corona-Lockerungen,26012022_13:14,https://www.sueddeutsche.de/politik/landtag-hannover-weil-warnt-vor-fruehzeitigen-corona-lockerungen-dpa.urn-newsml-dpa-com-20090101-220126-99-855905,Landtag - Hannover,dpa,,,26012022,Sueddeutsche
Grünen-Parteitag verspricht digitale Harmonie,26012022_13:12,https://www.sueddeutsche.de/politik/parteien-gruenen-parteitag-verspricht-digitale-harmonie-dpa.urn-newsml-dpa-com-20090101-220126-99-859041,Parteien,dpa,,,26012022,Sueddeutsche
"Sex avisiert, Geld geraubt: Verdächtigen Handwerk gelegt",26012022_13:10,https://www.sueddeutsche.de/panorama/kriminalitaet-offenburg-sex-avisiert-geld-geraubtverdaechtigen-handwerk-gelegt-dpa.urn-newsml-dpa-com-20090101-220126-99-859104,Kriminalität - Offenburg,dpa,,,26012022,Sueddeutsche
Bildungsstätte: Erinnerungskultur kein Selbstbedienungsladen,26012022_13:08,https://www.sueddeutsche.de/wissen/geschichte-frankfurt-am-main-bildungsstaette-erinnerungskultur-kein-selbstbedienungsladen-dpa.urn-newsml-dpa-com-20090101-220126-99-859086,Geschichte - Frankfurt am Main,dpa,,,26012022,Sueddeutsche
Kahn bestätigt Abgang von Süle am Saisonende,26012022_13:08,https://www.sueddeutsche.de/sport/fussball-kahn-bestaetigt-abgang-von-suele-am-saisonende-dpa.urn-newsml-dpa-com-20090101-220126-99-858298,Fußball,dpa,,,26012022,Sueddeutsche
Flut an Kirchenaustritten erwartet,26012022_13:08,https://www.sueddeutsche.de/bayern/kirchenaustritt-bayern-missbrauchsgutachten-1.5515608,Nach Missbrauchsgutachten,,,In München hat sich die Zahl der Austritte in kurzer Zeit verdoppelt. Auch andere Städte in Bayern bereiten sich auf deutlich mehr Arbeit vor.,26012022,Sueddeutsche
"Wir spenden, ihr macht Werbung",26012022_13:08,https://www.sueddeutsche.de/muenchen/muenchen-benefizaktion-oktoberfest-werbung-koa-wiesn-1.5514982,Benefiz-Aktion für Wiesn-Musikanten,,Von Franz Kotteder,"Auftritt abgesagt, und nun? Ein Händler von Wiesn-Devotionalien will die Oktoberfest-Musiker mit einer Spendenaktion unterstützen. Wenn da nicht das Finanzamt wäre. Aber man hat eine Idee. 
                        
                            Von Franz Kotteder",26012022,Sueddeutsche
"Kahn will Lewandowski, Neuer und Müller halten",26012022_13:07,https://www.sueddeutsche.de/bayern/fussball-muenchen-kahn-will-lewandowski-neuer-und-mueller-halten-dpa.urn-newsml-dpa-com-20090101-220126-99-859051,Fußball - München,dpa,,,26012022,Sueddeutsche
Banken erwarten Verteuerung von Immobilienkrediten,26012022_13:05,https://www.sueddeutsche.de/wirtschaft/energie-banken-erwarten-verteuerung-von-immobilienkrediten-dpa.urn-newsml-dpa-com-20090101-220126-99-857984,Energie,dpa,,,26012022,Sueddeutsche
Pro Asyl: Ampel-Pläne für Bleiberecht jetzt schon umsetzen,26012022_13:05,https://www.sueddeutsche.de/politik/migration-frankfurt-am-main-pro-asyl-ampel-plaene-fuer-bleiberecht-jetzt-schon-umsetzen-dpa.urn-newsml-dpa-com-20090101-220126-99-858968,Migration - Frankfurt am Main,dpa,,,26012022,Sueddeutsche
Eiskletterer stürzt am Jochberg ab,26012022_13:05,https://www.sueddeutsche.de/muenchen/wolfratshausen/eiskletterer-stuerzt-am-jochberg-ab-aufwendiger-einsatz-der-bergwacht-kochel-am-see-1.5515503,Kochel am See,,Claudia Koestler,"Mit Hubschrauber und vielen Rettungskräften hatte die Kochler Bergwacht einen aufwendigen Einsatz.
                        
                            Claudia Koestler",26012022,Sueddeutsche
Razzia wegen Schwarzarbeit und Schleuserkriminalität,26012022_13:04,https://www.sueddeutsche.de/panorama/kriminalitaet-saarbruecken-razzia-wegen-schwarzarbeit-und-schleuserkriminalitaet-dpa.urn-newsml-dpa-com-20090101-220126-99-856254,Kriminalität - Saarbrücken,dpa,,,26012022,Sueddeutsche
Bedrohter Allesfresser: Pustelschwein ist Zootier des Jahres,26012022_13:04,https://www.sueddeutsche.de/leben/tiere-landau-in-der-pfalz-bedrohter-allesfresser-pustelschwein-ist-zootier-des-jahres-dpa.urn-newsml-dpa-com-20090101-220126-99-857113,Tiere - Landau in der Pfalz,dpa,,,26012022,Sueddeutsche
Innenverteidiger Chabot kommt auf Leihbasis zum 1. FC Köln,26012022_13:03,https://www.sueddeutsche.de/sport/fussball-innenverteidiger-chabot-kommt-auf-leihbasis-zum-1-fc-koeln-dpa.urn-newsml-dpa-com-20090101-220126-99-858901,Fußball,dpa,,,26012022,Sueddeutsche
