Titel,Date_Info,URL,Overline,Breadcrumb,author,detailed_informations,Zugriff_Datum,News_page,Kategorie
103 Geflüchtete aus Ukraine sind in Aufnahmeeinrichtungen,03032022_08:52,https://www.sueddeutsche.de/politik/konflikte-mainz-103-gefluechtete-aus-ukraine-sind-in-aufnahmeeinrichtungen-dpa.urn-newsml-dpa-com-20090101-220303-99-364987,Konflikte - Mainz,dpa,,,03032022,Sueddeutsche,politik
Außenwerber Ströer peilt zweistelliges Umsatzwachstum an,03032022_08:47,https://www.sueddeutsche.de/wirtschaft/medien-leverkusen-aussenwerber-stroeer-peilt-zweistelliges-umsatzwachstum-an-dpa.urn-newsml-dpa-com-20090101-220303-99-364472,Medien - Leverkusen,dpa,,,03032022,Sueddeutsche,wirtschaft
Kremlkritischer Radiosender Echo Moskwy wird geschlossen,03032022_08:47,https://www.sueddeutsche.de/politik/krieg-kremlkritischer-radiosender-echo-moskwy-wird-geschlossen-dpa.urn-newsml-dpa-com-20090101-220303-99-364395,Krieg,dpa,,,03032022,Sueddeutsche,politik
Abramowitsch kündigt Verkauf von FC Chelsea an,03032022_08:45,https://www.sueddeutsche.de/panorama/abramowitsch-kuendigt-verkauf-von-fc-chelsea-an-1.5540333,,,,"Video
                    
                    
                        Mit der milliardenschweren Unterstützung von Roman Abramowitsch stieg der FC Chelsea zu einem der erfolgreichsten Fußball-Clubs der Welt auf. Im Zuge des Ukraine-Kriegs bekommt der Verein von Trainer Thomas Tuchel nun einen neuen Besitzer.",03032022,Sueddeutsche,panorama
Jugendherbergen wollen Unterkünfte Geflüchteten anbieten,03032022_08:44,https://www.sueddeutsche.de/bayern/krieg-muenchen-jugendherbergen-wollen-unterkuenfte-gefluechteten-anbieten-dpa.urn-newsml-dpa-com-20090101-220303-99-364897,Krieg - München,dpa,,,03032022,Sueddeutsche,bayern
SG-Coach nach Unentschieden in Champions League ratlos,03032022_08:43,https://www.sueddeutsche.de/sport/handball-flensburg-sg-coach-nach-unentschieden-in-champions-league-ratlos-dpa.urn-newsml-dpa-com-20090101-220303-99-364876,Handball - Flensburg,dpa,,,03032022,Sueddeutsche,sport
Thomas-Wimmer-Haus wartet auf die Abrissbirne,03032022_08:41,https://www.sueddeutsche.de/muenchen/muenchen-laim-thomas-wimmer-haus-alte-heimat-abriss-1.5539734,Laim,,Von Christina Seipel,"Das Laimer Wahrzeichen in der Siedlung Alte Heimat soll für 50 Millionen Euro neu errichtet werden - barrierefrei und mit deutlich mehr Wohnungen. 
                        
                            Von Christina Seipel",03032022,Sueddeutsche,muenchen
Deutschland liefert Flugabwehrraketen an die Ukraine,03032022_08:40,https://www.sueddeutsche.de/panorama/deutschland-liefert-flugabwehrraketen-an-die-ukraine-1.5540331,,,,"Video
                    
                    
                        Am Samstag vollzog die Bundesregierung nach dem russischen Einmarsch in die Ukraine einen Kurswechsel. Erste Waffenlieferungen wurden bereits an die Ukraine übergeben. Es sollen weitere folgen.",03032022,Sueddeutsche,panorama
Lufthansa erwartet starkes Reisejahr und Kriegsprobleme,03032022_08:39,https://www.sueddeutsche.de/wirtschaft/luftverkehr-frankfurt-am-main-lufthansa-erwartet-starkes-reisejahr-und-kriegsprobleme-dpa.urn-newsml-dpa-com-20090101-220303-99-363143,Luftverkehr - Frankfurt am Main,dpa,,,03032022,Sueddeutsche,wirtschaft
"Eisbären-Coach: Siegesserie hat ""nichts mit Glück zu tun""",03032022_08:35,https://www.sueddeutsche.de/sport/eishockey-bremerhaven-eisbaeren-coach-siegesserie-hat-nichts-mit-glueck-zu-tun-dpa.urn-newsml-dpa-com-20090101-220302-99-359868,Eishockey - Bremerhaven,dpa,,,03032022,Sueddeutsche,sport
Weitere DEL-Spiele abgesagt - Schwenningen in Teamquarantäne,03032022_08:33,https://www.sueddeutsche.de/sport/eishockey-weitere-del-spiele-abgesagt-schwenningen-in-teamquarantaene-dpa.urn-newsml-dpa-com-20090101-220303-99-364682,Eishockey,dpa,,,03032022,Sueddeutsche,sport
Der verlorene Sohn,03032022_08:33,https://www.sueddeutsche.de/leben/tichborne-geheimnis-raetsel-david-yates-1.5536548,Dem Geheimnis auf der Spur,,Von Carolin Werthmann,"1854 verschwand Roger Tichborne, ein englischer Adeliger, auf See und wurde für tot erklärt. Zehn Jahre später kehrte er zurück. Doch war er es wirklich?
                        
                            Von Carolin Werthmann",03032022,Sueddeutsche,leben
"Ein Immobilien-Deal, der politisch heikel wäre",03032022_08:33,https://www.sueddeutsche.de/muenchen/muenchen-bayernlb-verkauf-zentrale-brienner-strasse-1.5539909,Zentrale der BayernLB,,Von Sebastian Krass,"Die BayernLB plant den Verkauf ihrer Zentrale in München - und könnte damit mehr als eine Milliarde Euro einnehmen. Aber ist es richtig, dieses historisch belastete Grundstück einem privaten Investor zu übergeben?
                        
                            Von Sebastian Krass",03032022,Sueddeutsche,muenchen
"Selig, taumelnd, selbstverliebt",03032022_08:32,https://sz-magazin.sueddeutsche.de/getraenkemarkt/bier-koelsch-karneval-koeln-91255,Getränkemarkt,,Von Lara Fritzsche,"Zu jedem Kölsch kommen unserer Autorin Kölsche Lieder in den Sinn. Keine Stadt, glaubt sie, wird so oft besungen. Eine besonders perfide Form der Städte-PR.
                        
                            Von Lara Fritzsche",03032022,Sueddeutsche,getraenkemarkt
Vater soll 17-jährigen Sohn mit Messer schwer verletzt haben,03032022_08:32,https://www.sueddeutsche.de/bayern/kriminalitaet-bayreuth-vater-soll-17-jaehrigen-sohn-mit-messer-schwer-verletzt-haben-dpa.urn-newsml-dpa-com-20090101-220303-99-364716,Kriminalität - Bayreuth,dpa,,,03032022,Sueddeutsche,bayern
Weitere DEL-Spiele abgesagt: Schwenningen in Teamquarantäne,03032022_08:31,https://www.sueddeutsche.de/sport/eishockey-neuss-weitere-del-spiele-abgesagt-schwenningen-in-teamquarantaene-dpa.urn-newsml-dpa-com-20090101-220303-99-364681,Eishockey - Neuss,dpa,,,03032022,Sueddeutsche,sport
"Zipsers Basketball-Rückkehr: ""15 Sekunden wie 150 Minuten""",03032022_08:28,https://www.sueddeutsche.de/sport/basketball-zipsers-basketball-rueckkehr-15sekunden-wie-150-minuten-dpa.urn-newsml-dpa-com-20090101-220303-99-364356,Basketball,dpa,,,03032022,Sueddeutsche,sport
Einfachere Corona-Regeln für Urlaubsheimkehrer,03032022_08:27,https://www.sueddeutsche.de/gesundheit/gesundheit-einfachere-corona-regeln-fuer-urlaubsheimkehrer-dpa.urn-newsml-dpa-com-20090101-220301-99-341394,Gesundheit,dpa,,,03032022,Sueddeutsche,gesundheit
"Hardy Krüger Jr. darf bei ""Let's Dance"" nicht antanzen",03032022_08:26,https://www.sueddeutsche.de/leben/leute-hardy-krueger-jr-darf-bei-lets-dance-nicht-antanzen-dpa.urn-newsml-dpa-com-20090101-220302-99-360482,Leute,dpa,,,03032022,Sueddeutsche,leben
"""Kinder rennen sofort zu ihren Müttern""",03032022_08:25,https://www.sueddeutsche.de/muenchen/freising/freising-corona-kinder-und-jugendliche-psychische-folgen-1.5539918,Folgen der Pandemie,,"Von Gudrun Regelein, Freising","Vereinsamt, verunsichert und abgehängt: Zwei Jahre Corona haben bei Kindergartenkindern und Schülern Spuren hinterlassen. Eltern, Jugendliche und Erzieherinnen berichten, wie sich das bemerkbar macht.
                        
                            Von Gudrun Regelein, Freising",03032022,Sueddeutsche,muenchen
Sieg gegen Münster: Schwerins Coach lobt Team für Comeback,03032022_08:25,https://www.sueddeutsche.de/sport/volleyball-schwerin-sieg-gegen-muenster-schwerins-coach-lobt-team-fuer-comeback-dpa.urn-newsml-dpa-com-20090101-220303-99-364629,Volleyball - Schwerin,dpa,,,03032022,Sueddeutsche,sport
Polizei findet Toten und vermutet Gewalttat in Drogenmilieu,03032022_08:23,https://www.sueddeutsche.de/panorama/kriminalitaet-giessen-polizei-findet-toten-und-vermutet-gewalttat-in-drogenmilieu-dpa.urn-newsml-dpa-com-20090101-220303-99-364612,Kriminalität - Gießen,dpa,,,03032022,Sueddeutsche,panorama
Niederlage der Hamburg Towers bei München nur Randnotiz,03032022_08:22,https://www.sueddeutsche.de/sport/basketball-muenchen-niederlage-der-hamburg-towers-bei-muenchen-nur-randnotiz-dpa.urn-newsml-dpa-com-20090101-220302-99-359480,Basketball - München,dpa,,,03032022,Sueddeutsche,sport
Starachitekt Libeskind will Gedenkstätte in Kaufering entwerfen,03032022_08:19,https://www.sueddeutsche.de/muenchen/dachau/kaufering-gedenkstaette-daniel-libeskind-dachau-1.5539907,Ehemaliges Dachauer KZ-Außenlager,,"Von Helmut Zeller, Dachau/Kaufering","Das ehemalige Dachauer KZ-Außenlager Kaufering VII im oberbayerischen Landsberg am Lech ist ein bedeutsamer Ort der Shoah. Ein Vertrag mit dem New Yorker Architekten ist noch nicht unterzeichnet - in der Politik scheint es Widerstände zu geben. 
                        
                            Von Helmut Zeller, Dachau/Kaufering",03032022,Sueddeutsche,muenchen
Gabelstapler-Hersteller Kion blickt optimistisch auf 2022,03032022_08:17,https://www.sueddeutsche.de/wirtschaft/maschinenbau-frankfurt-am-main-gabelstapler-hersteller-kion-blickt-optimistisch-auf-2022-dpa.urn-newsml-dpa-com-20090101-220303-99-363443,Maschinenbau - Frankfurt am Main,dpa,,,03032022,Sueddeutsche,wirtschaft
Alle Ermittlungen gegen Spaniens Altkönig eingestellt,03032022_08:17,https://www.sueddeutsche.de/leben/adel-alle-ermittlungen-gegen-spaniens-altkoenig-eingestellt-dpa.urn-newsml-dpa-com-20090101-220303-99-363362,Adel,dpa,,,03032022,Sueddeutsche,leben
Skispringerin Althaus nach Corona-Infektion wieder zurück,03032022_08:17,https://www.sueddeutsche.de/sport/skispringen-skispringerin-althaus-nach-corona-infektion-wieder-zurueck-dpa.urn-newsml-dpa-com-20090101-220303-99-364478,Skispringen,dpa,,,03032022,Sueddeutsche,sport
Zehntausende demonstrieren in München,03032022_08:13,https://www.sueddeutsche.de/politik/zehntausende-demonstrieren-in-muenchen-1.5540323,,,,"Video
                    
                    
                        In Deutschland gibt es laut Innenministerin Nancy Faeser bislang keine Hinweise dafür, dass die russische Invasion in der Ukraine zu Spannungen zwischen Bevölkerungsgruppen der beiden Kriegsparteien führen könnte.",03032022,Sueddeutsche,politik
Droht der Weltwirtschaft der ganz große Crash?,03032022_08:05,https://www.sueddeutsche.de/wirtschaft/ukraine-russland-weltwirtschaft-inflation-1.5539892,Konjunktur,,Von Claus Hulverscheidt,"Der Krieg in der Ukraine trifft die Wirtschaft zu einem heiklen Zeitpunkt. Der coronabedingte Konjunktureinbruch ist längst nicht überwunden. Und erste Experten befürchten bereits die nächste Krise: Stagflation.
                        
                            Von Claus Hulverscheidt",03032022,Sueddeutsche,wirtschaft
"Zipsers Basketball-Rückkehr: ""15 Sekunden wie 150 Minuten""",03032022_08:05,https://www.sueddeutsche.de/bayern/basketball-muenchen-zipsers-basketball-rueckkehr-15-sekunden-wie-150-minuten-dpa.urn-newsml-dpa-com-20090101-220303-99-364372,Basketball - München,dpa,,,03032022,Sueddeutsche,bayern
"Ausstellung über Klassiker ""Das andere Geschlecht""",03032022_08:03,https://www.sueddeutsche.de/kultur/ausstellungen-bonn-ausstellung-ueber-klassiker-das-andere-geschlecht-dpa.urn-newsml-dpa-com-20090101-220303-99-364337,Ausstellungen - Bonn,dpa,,,03032022,Sueddeutsche,kultur
Kremlkritischer Radiosender Echo Moskwy wird geschlossen,03032022_08:03,https://www.sueddeutsche.de/politik/krieg-kremlkritischer-radiosender-echo-moskwy-wird-geschlossen-dpa.urn-newsml-dpa-com-20090101-220303-99-364365,Krieg,dpa,,,03032022,Sueddeutsche,politik
Grauer Star: Augen-OP bei Tasmanischem Teufel erfolgreich,03032022_08:02,https://www.sueddeutsche.de/leben/tiere-grauer-star-augen-op-bei-tasmanischem-teufel-erfolgreich-dpa.urn-newsml-dpa-com-20090101-220303-99-361670,Tiere,dpa,,,03032022,Sueddeutsche,leben
Wucherpreise bei Ersatzversorgung mit Strom unzulässig,03032022_08:00,https://www.sueddeutsche.de/wirtschaft/finanzen-wucherpreise-bei-ersatzversorgung-mit-strom-unzulaessig-dpa.urn-newsml-dpa-com-20090101-220302-99-356744,Finanzen,dpa,,,03032022,Sueddeutsche,wirtschaft
Appell für unbürokratischen Wohnraum für Flüchtlinge,03032022_07:56,https://www.sueddeutsche.de/politik/konflikte-stuttgart-appell-fuer-unbuerokratischen-wohnraum-fuer-fluechtlinge-dpa.urn-newsml-dpa-com-20090101-220303-99-364265,Konflikte - Stuttgart,dpa,,,03032022,Sueddeutsche,politik
Regierungschef Weil für schnellere Energiewende,03032022_07:53,https://www.sueddeutsche.de/politik/konflikte-hannover-regierungschef-weil-fuer-schnellere-energiewende-dpa.urn-newsml-dpa-com-20090101-220303-99-364229,Konflikte - Hannover,dpa,,,03032022,Sueddeutsche,politik
Abramowitsch verkauft FC Chelsea,03032022_07:51,https://www.sueddeutsche.de/sport/abramowitsch-verkauft-fc-chelsea-1.5540319,,,,"Video
                    
                    
                        Die britische Regierung arbeitet einer Zeitung zufolge an Plänen, um den Besitz von russischen Oligarchen im Land beschlagnahmen zu können.",03032022,Sueddeutsche,sport
Laienvertreter kritisiert Rückkehr von Kardinal Woelki,03032022_07:49,https://www.sueddeutsche.de/panorama/kirche-koeln-laienvertreter-kritisiert-rueckkehr-von-kardinal-woelki-dpa.urn-newsml-dpa-com-20090101-220303-99-364190,Kirche - Köln,dpa,,,03032022,Sueddeutsche,panorama
Stille nach dem Paukenschlag,03032022_07:42,https://www.sueddeutsche.de/muenchen/muenchen-kuendigung-chefdirigent-gergiev-folgen-konzerte-1.5540091,Rauswurf von Gergiev,,Von Anna Hoben und Michael Zirnstein,"Trotz der Trennung von Chefdirigent Valery Gergiev sollen die betroffenen Konzerte der Münchner Philharmoniker stattfinden. Nach einem Nachfolger wird gesucht.
                        
                            Von Anna Hoben und Michael Zirnstein",03032022,Sueddeutsche,muenchen
Handwerker bei Sturz auf Baustelle schwer verletzt,03032022_07:42,https://www.sueddeutsche.de/bayern/notfaelle-vilshofen-an-der-donau-handwerker-bei-sturz-auf-baustelle-schwer-verletzt-dpa.urn-newsml-dpa-com-20090101-220303-99-364110,Notfälle - Vilshofen an der Donau,dpa,,,03032022,Sueddeutsche,bayern
Schweinepest-Fall unweit der Grenze: Backhaus mahnt,03032022_07:37,https://www.sueddeutsche.de/wirtschaft/agrar-schwerin-schweinepest-fall-unweit-der-grenze-backhaus-mahnt-dpa.urn-newsml-dpa-com-20090101-220303-99-364077,Agrar - Schwerin,dpa,,,03032022,Sueddeutsche,wirtschaft
"Sonniges Wetter für Sachsen, Sachsen-Anhalt und Thüringen",03032022_07:34,https://www.sueddeutsche.de/panorama/wetter-sonniges-wetter-fuer-sachsen-sachsen-anhalt-und-thueringen-dpa.urn-newsml-dpa-com-20090101-220303-99-364080,Wetter,dpa,,,03032022,Sueddeutsche,panorama
Ihr seid nicht allein mit eurer Wut und euren Sorgen,03032022_07:25,https://www.sueddeutsche.de/muenchen/muenchen-koenigsplatz-ukraine-demo-kommentar-1.5540278,Ukraine-Demo in München,,Kommentar von René Hofmann,"Meinung
                    
                    
                        Es ist eine beispiellose Geste: Auf dem Königsplatz demonstrieren 45 000 Menschen für den Frieden - und Politikerinnen und Politiker tun sich parteiübergreifend zusammen. Ihre Botschaft geht jeden an. 
                        
                            Kommentar von René Hofmann",03032022,Sueddeutsche,muenchen
Selenskyj sagt Feinden der Ukraine heftige Gegenwehr an,03032022_07:24,https://www.sueddeutsche.de/panorama/selenskyj-sagt-feinden-der-ukraine-heftige-gegenwehr-an-1.5540317,,,,"Video
                    
                    
                        ""Sie werden hier keinen Frieden haben, sie werden hier kein Essen haben, sie werden hier keine ruhige Minute haben"", sagte der 44-Jährige in der Nacht zu Donnerstag in einer Videobotschaft und droht den Russen ""heftige Gegenwehr"" an.",03032022,Sueddeutsche,panorama
Russland und Belarus nun doch von Paralympics ausgeschlossen,03032022_07:22,https://www.sueddeutsche.de/sport/paralympics-russland-belarus-rauswurf-putin-1.5540315,Paralympics,,,"Zuerst hieß es, die Athleten beider Länder dürfen unter neutraler Flagge starten. Doch das Komitee beugt sich dem internationalen Druck - Russland zieht als Reaktion vor den CAS.",03032022,Sueddeutsche,sport
Geburtsvorbereitung im Hörsaal,03032022_07:20,https://www.sueddeutsche.de/bayern/regensburg-hochschule-hebamme-studiengang-geburtshelfer-1.5539932,Hebammenmangel,,"Von Sonja Hößl, Regensburg","In Bayern werden wieder mehr Babys geboren, aber die Hebammen fehlen. Für den Beruf wird bald ein akademischer Abschluss notwendig sein - in Regensburg werden Geburtshelfer schon an der Hochschule ausgebildet.
                        
                            Von Sonja Hößl, Regensburg",03032022,Sueddeutsche,bayern
Russland und Belarus von Paralympics in Peking ausgeschlossen,03032022_07:16,https://www.sueddeutsche.de/leben/paralympics-russland-und-belarus-von-paralympics-inpeking-ausgeschlossen-dpa.urn-newsml-dpa-com-20090101-220303-99-363682,Paralympics,dpa,,,03032022,Sueddeutsche,leben
Radrennställe aus Russland und Belarus suspendiert,03032022_07:16,https://www.sueddeutsche.de/sport/radsport-radrennstaelle-aus-russland-und-belarus-suspendiert-dpa.urn-newsml-dpa-com-20090101-220301-99-343107,Radsport,dpa,,,03032022,Sueddeutsche,sport
Das sind die Regeln für Urlaub in Europa,03032022_07:10,https://www.sueddeutsche.de/reise/urlaub-reise-europa-corona-regeln-1.5303333,Reisen und Corona,,"Von Daniela Gorgs (Daten), Benedict Witzenberger (Daten), Eva Dignös, Irene Helmes und Birgit Kruse","Welche Tests muss man an der Grenze vorlegen, wen erwartet nach der Einreise die Quarantäne? Der Überblick über die Regeln in den Urlaubsländern in einer Karte.
                        
                            Von Daniela Gorgs (Daten), Benedict Witzenberger (Daten), Eva Dignös, Irene Helmes und Birgit Kruse",03032022,Sueddeutsche,reise
Russische Soldaten dringen in Ratsgebäude von Cherson ein,03032022_07:07,https://www.sueddeutsche.de/politik/russische-soldaten-dringen-in-ratsgebaeude-von-cherson-ein-1.5540313,,,,"Video
                    
                    
                        Der Generalinspekteur der Bundeswehr, Eberhard Zorn, rechnet indessen nicht mit einem schnellen Sieg der russischen Armee in der Ukraine.",03032022,Sueddeutsche,politik
