Titel,Date_Info,URL,Overline,Breadcrumb,author,detailed_informations,Zugriff_Datum,News_page,Kategorie
Bericht: RB Leipzig an Sturm-Talent Cho interessiert,12012022_10:34,https://www.sueddeutsche.de/sport/fussball-leipzig-bericht-rb-leipzig-an-sturm-talent-cho-interessiert-dpa.urn-newsml-dpa-com-20090101-220112-99-679290,Fußball - Leipzig,dpa,,,13012022,Sueddeutsche,sport
Neue Finanzierungsrunde bei Back Market,12012022_10:31,https://www.sueddeutsche.de/wirtschaft/elektronik-neue-finanzierungsrunde-bei-back-market-dpa.urn-newsml-dpa-com-20090101-220112-99-678478,Elektronik,dpa,,,13012022,Sueddeutsche,wirtschaft
Heidi Klum singt mit US-Rapper Snoop Dogg,12012022_10:29,https://www.sueddeutsche.de/leben/leute-heidi-klum-singt-mit-us-rapper-snoop-dogg-dpa.urn-newsml-dpa-com-20090101-220112-99-677372,Leute,dpa,,,13012022,Sueddeutsche,leben
Arzt soll falsche Corona-Impfnachweise ausgestellt haben,12012022_10:29,https://www.sueddeutsche.de/panorama/kriminalitaet-tuebingen-arzt-soll-falsche-corona-impfnachweise-ausgestellt-haben-dpa.urn-newsml-dpa-com-20090101-220112-99-679135,Kriminalität - Tübingen,dpa,,,13012022,Sueddeutsche,panorama
Inzidenz in Berlin steigt weiter: Zwei Ampeln zeigen Rot,12012022_10:24,https://www.sueddeutsche.de/gesundheit/gesundheit-berlin-inzidenz-in-berlin-steigt-weiter-zwei-ampeln-zeigen-rot-dpa.urn-newsml-dpa-com-20090101-220112-99-676967,Gesundheit - Berlin,dpa,,,13012022,Sueddeutsche,gesundheit
CDU-Politiker Marco Wanderwitz fordert Verbot der AfD,12012022_10:22,https://www.sueddeutsche.de/politik/parteien-berlin-cdu-politiker-marco-wanderwitz-fordert-verbot-der-afd-dpa.urn-newsml-dpa-com-20090101-220112-99-679042,Parteien - Berlin,dpa,,,13012022,Sueddeutsche,politik
"""Die Patienten werden da immer sturer""",12012022_10:21,https://www.sueddeutsche.de/muenchen/ebersberg/landkreis-ebersberg-rettungsdienst-notfallmedizin-corona-sanitaeter-1.5504139,Rettungsdienst und Corona,,"Von Johanna Feckl, Ebersberg","Die verzweifelte Suche nach Betten, keine Pausen und pöbelnde Corona-Leugner: Der Rettungsdienst arbeitet in der Pandemie am Limit. Und die Einsätze dauern immer länger - zu lange für manche Patienten?
                        
                            Von Johanna Feckl, Ebersberg",13012022,Sueddeutsche,muenchen
Gegen Bundestrend: Inzidenz in Brandenburg erneut gesunken,12012022_10:21,https://www.sueddeutsche.de/gesundheit/gesundheit-potsdam-gegen-bundestrend-inzidenz-in-brandenburg-erneut-gesunken-dpa.urn-newsml-dpa-com-20090101-220112-99-679043,Gesundheit - Potsdam,dpa,,,13012022,Sueddeutsche,gesundheit
US-Zerschlagungsklage gegen Facebook vor Gericht zugelassen,12012022_10:20,https://www.sueddeutsche.de/service/internet-us-zerschlagungsklage-gegen-facebook-vor-gericht-zugelassen-dpa.urn-newsml-dpa-com-20090101-220112-99-674483,Internet,dpa,,,13012022,Sueddeutsche,service
Quebec: Impfmuffel sollen zahlen,12012022_10:19,https://www.sueddeutsche.de/politik/quebec-impfmuffel-sollen-zahlen-1.5505732,,,,"Video
                    
                    
                        Der Regierungschef der kanadischen Provinz hat nun eine Gesundheitsabgabe für Menschen angekündigt, die sich nicht gegen Covid-19 impfen lassen wollen.",13012022,Sueddeutsche,politik
Trotz Corona kaum Rückgang bei Organspenden im Saarland,12012022_10:18,https://www.sueddeutsche.de/gesundheit/gesundheit-frankfurt-am-main-trotz-corona-kaum-rueckgang-bei-organspenden-im-saarland-dpa.urn-newsml-dpa-com-20090101-220112-99-679046,Gesundheit - Frankfurt am Main,dpa,,,13012022,Sueddeutsche,gesundheit
"Fast 3000 Beobachter bei Aktion ""Stunde der Wintervögel""",12012022_10:17,https://www.sueddeutsche.de/leben/tiere-magdeburg-fast-3000-beobachter-bei-aktion-stunde-der-wintervoegel-dpa.urn-newsml-dpa-com-20090101-220112-99-679026,Tiere - Magdeburg,dpa,,,13012022,Sueddeutsche,leben
Staatsoper hofft auf 50-Prozent-Auslastung in der Kultur,12012022_10:17,https://www.sueddeutsche.de/bayern/musik-muenchen-staatsoper-hofft-auf-50-prozent-auslastung-in-der-kultur-dpa.urn-newsml-dpa-com-20090101-220112-99-678981,Musik - München,dpa,,,13012022,Sueddeutsche,bayern
OVG verhandelt über Zugang zu tödlichem Betäubungsmittel,12012022_10:16,https://www.sueddeutsche.de/panorama/justiz-muenster-ovg-verhandelt-ueber-zugang-zu-toedlichem-betaeubungsmittel-dpa.urn-newsml-dpa-com-20090101-220112-99-679013,Justiz - Münster,dpa,,,13012022,Sueddeutsche,panorama
Lobbyistin mit exklusivem Zugang zur CDU-Spitze,12012022_10:14,https://www.sueddeutsche.de/politik/astrid-hamker-wirtschaftsrat-gutachten-cdu-1.5505661,Astrid Hamker,,"Von Robert Roßmann, Berlin","Die Präsidentin des Wirtschaftsrates darf qua Amt an allen Sitzungen des CDU-Bundesvorstands teilnehmen, samt Rederecht. Ein Gutachten sieht darin einen Verstoß gegen das Parteiengesetz.
                        
                            Von Robert Roßmann, Berlin",13012022,Sueddeutsche,politik
"Janet Jackson übers Altern: ""Da müssen wir alle durch""",12012022_10:12,https://www.sueddeutsche.de/leben/leute-janet-jackson-uebers-altern-da-muessen-wir-alle-durch-dpa.urn-newsml-dpa-com-20090101-220112-99-677389,Leute,dpa,,,13012022,Sueddeutsche,leben
Im Deutschen Museum gibt es jetzt vegane Burger,12012022_10:11,https://www.sueddeutsche.de/muenchen/muenchen-food-truck-deutsches-museum-1.5505310,"""Blitz Food Truck""",,Von Franz Kotteder,"Im Innenhof steht dort seit Kurzem der ""Blitz Food Truck"", der von Dienstag bis Samstag Mittagsgerichte ohne tierische Zutaten verkauft. Wenn es gut läuft, soll das ""Krisenprojekt"" auch langfristig bleiben.
                        
                            Von Franz Kotteder",13012022,Sueddeutsche,muenchen
Biden kämpft gegen die Bestie,12012022_10:10,https://www.sueddeutsche.de/politik/usa-wahlrecht-biden-republikaner-atlanta-1.5505603,USA,,"Von Hubert Wetzel, Washington","Es kommt einer politischen Kriegserklärung gleich: Der US-Präsident wirft den Republikanern in einer scharfen Rede vor, Amerikas Demokratie ""den Dolch an die Kehle"" zu halten. Auch zwei störrische Parteifreunde fordert er heraus.
                        
                            Von Hubert Wetzel, Washington",13012022,Sueddeutsche,politik
Zahl der Organspenden auch im zweiten Corona-Jahr stabil,12012022_10:09,https://www.sueddeutsche.de/gesundheit/gesundheit-frankfurt-am-main-zahl-der-organspenden-auch-im-zweiten-corona-jahr-stabil-dpa.urn-newsml-dpa-com-20090101-220112-99-678899,Gesundheit - Frankfurt am Main,dpa,,,13012022,Sueddeutsche,gesundheit
Motorradfahrer bei Unfall im Kreis Plön schwer verletzt,12012022_10:09,https://www.sueddeutsche.de/panorama/unfaelle-barmissen-motorradfahrer-bei-unfall-im-kreis-ploen-schwer-verletzt-dpa.urn-newsml-dpa-com-20090101-220112-99-678921,Unfälle - Barmissen,dpa,,,13012022,Sueddeutsche,panorama
25-Jähriger flieht aus Maßregelvollzug: Festnahme in Peine,12012022_10:08,https://www.sueddeutsche.de/panorama/polizei-peine-25-jaehriger-flieht-aus-massregelvollzug-festnahme-in-peine-dpa.urn-newsml-dpa-com-20090101-220112-99-678908,Polizei - Peine,dpa,,,13012022,Sueddeutsche,panorama
Trauer um den Bilderbuch-Künstler Ali Mitgutsch,12012022_10:08,https://www.sueddeutsche.de/kultur/literatur-trauer-um-den-bilderbuch-kuenstler-ali-mitgutsch-dpa.urn-newsml-dpa-com-20090101-220112-99-678769,Literatur,dpa,,,13012022,Sueddeutsche,kultur
5000 neue Termine für Corona-Kinderschutzimpfung in Hamburg,12012022_10:07,https://www.sueddeutsche.de/gesundheit/gesundheit-hamburg-5000-neue-termine-fuer-corona-kinderschutzimpfung-in-hamburg-dpa.urn-newsml-dpa-com-20090101-220112-99-678862,Gesundheit - Hamburg,dpa,,,13012022,Sueddeutsche,gesundheit
Zahl der Organspender in Rheinland-Pfalz leicht rückläufig,12012022_10:06,https://www.sueddeutsche.de/gesundheit/gesundheit-frankfurt-am-main-zahl-der-organspender-in-rheinland-pfalz-leicht-ruecklaeufig-dpa.urn-newsml-dpa-com-20090101-220112-99-678807,Gesundheit - Frankfurt am Main,dpa,,,13012022,Sueddeutsche,gesundheit
SPD nennt Zeitplan für Entscheidung über Impfpflicht,12012022_10:05,https://www.sueddeutsche.de/panorama/spd-nennt-zeitplan-fuer-entscheidung-ueber-impfpflicht-1.5505717,,,,"Video
                    
                    
                        In der Impfpflicht-Debatte ist Kanzler Scholz in den letzten Tagen immer weiter in die Defensive geraten. Jetzt nimmt die SPD Druck aus dem Kessel und legt einen Zeitplan vor. Das Zieldatum ist aber ein anderes als das von Scholz ursprünglich angepeilte.",13012022,Sueddeutsche,panorama
Kopie des Unesco-Welterbes Igeler Säule wird neu gebaut,12012022_10:05,https://www.sueddeutsche.de/kultur/denkmaeler-trier-kopie-des-unesco-welterbes-igeler-saeule-wird-neu-gebaut-dpa.urn-newsml-dpa-com-20090101-220112-99-678808,Denkmäler - Trier,dpa,,,13012022,Sueddeutsche,kultur
"Calles lobt nach Europacup-Erfolg: ""Richtige Mentalität""",12012022_10:04,https://www.sueddeutsche.de/sport/basketball-hamburg-calles-lobt-nach-europacup-erfolg-richtige-mentalitaet-dpa.urn-newsml-dpa-com-20090101-220112-99-678863,Basketball - Hamburg,dpa,,,13012022,Sueddeutsche,sport
Kölner Polizei: Jüngstes missbrauchtes Kind drei Monate alt,12012022_10:04,https://www.sueddeutsche.de/panorama/kriminalitaet-koeln-koelner-polizei-juengstes-missbrauchtes-kind-drei-monate-alt-dpa.urn-newsml-dpa-com-20090101-220112-99-678842,Kriminalität - Köln,dpa,,,13012022,Sueddeutsche,panorama
Lkw-Fahrer schläft: Unbekannte stehlen Flachbildfernseher,12012022_10:03,https://www.sueddeutsche.de/panorama/kriminalitaet-mogendorf-lkw-fahrer-schlaeft-unbekannte-stehlen-flachbildfernseher-dpa.urn-newsml-dpa-com-20090101-220112-99-678809,Kriminalität - Mogendorf,dpa,,,13012022,Sueddeutsche,panorama
"Die ""erste echte Schlacht"" gegen Omikron",12012022_10:03,https://www.sueddeutsche.de/politik/coronavirus-china-omikron-1.5505201,Corona in China,,"Von Christoph Giesen, Peking","Trotz strengster Maßnahmen ist die Corona-Variante in China angekommen. In Tianjin werden für Tests Wohnanlagen abgesperrt und Bürotürme dichtgemacht. Und das keine vier Wochen vor den Olympischen Spielen. 
                        
                            Von Christoph Giesen, Peking",13012022,Sueddeutsche,politik
Die gefährliche Abhängigkeit von Pestiziden,12012022_10:03,https://www.sueddeutsche.de/wirtschaft/pestizidatlas-pflanzenschutz-landwirtschaft-insektensterben-1.5505697,Landwirtschaft,,Von Silvia Liebrich,"Der globale Einsatz von Pflanzenschutzmitteln steigt drastisch, Umweltschützer warnen. Doch die deutsche Politik steckt in einem Konflikt. Denn BASF und Bayer profitieren von dem Boom besonders.
                        
                            Von Silvia Liebrich",13012022,Sueddeutsche,wirtschaft
Wegen Corona-Zahlen: Braunschweig will Kader vergrößern,12012022_10:01,https://www.sueddeutsche.de/sport/fussball-braunschweig-wegen-corona-zahlen-braunschweig-will-kader-vergroessern-dpa.urn-newsml-dpa-com-20090101-220112-99-678764,Fußball - Braunschweig,dpa,,,13012022,Sueddeutsche,sport
Strom-Streit: Mann schlägt Gemeindemitarbeiter mit Schaufel,12012022_10:00,https://www.sueddeutsche.de/bayern/kriminalitaet-kleinkahl-strom-streit-mann-schlaegt-gemeindemitarbeiter-mit-schaufel-dpa.urn-newsml-dpa-com-20090101-220112-99-678732,Kriminalität - Kleinkahl,dpa,,,13012022,Sueddeutsche,bayern
"Bayern-Basketballer schütteln ""Last"" ab",12012022_09:59,https://www.sueddeutsche.de/bayern/basketball-muenchen-bayern-basketballer-schuetteln-last-ab-dpa.urn-newsml-dpa-com-20090101-220112-99-678733,Basketball - München,dpa,,,13012022,Sueddeutsche,bayern
NOFV-Chef weiter für Spielbetriebsaufnahme noch im Januar,12012022_09:59,https://www.sueddeutsche.de/sport/fussball-berlin-nofv-chef-weiter-fuer-spielbetriebsaufnahme-noch-im-januar-dpa.urn-newsml-dpa-com-20090101-220112-99-678720,Fußball - Berlin,dpa,,,13012022,Sueddeutsche,sport
Steinmeier diskutiert mit Bürgerinnen und Bürgern über Impfpflicht,12012022_09:58,https://www.sueddeutsche.de/politik/corona-steinmeier-deutschland-impfpflicht-diskussion-1.5505686,Coronavirus,,,"Der Bundespräsident hat zu einer ""respektvollen"" Diskussion über das Für und Wider einer gesetzlichen Regelung eingeladen. Eine Gegnerin erhielt einen besonders hohen Redeanteil.",13012022,Sueddeutsche,politik
Zweite Strafanzeige gegen Höcke wegen Aussage auf AfD-Demo,12012022_09:57,https://www.sueddeutsche.de/politik/parteien-halle-saale-zweite-strafanzeige-gegen-hoecke-wegen-aussage-auf-afd-demo-dpa.urn-newsml-dpa-com-20090101-220112-99-678692,Parteien - Halle (Saale),dpa,,,13012022,Sueddeutsche,politik
Zweite Strafanzeige gegen Höcke wegen Aussage auf AfD-Demo,12012022_09:57,https://www.sueddeutsche.de/politik/parteien-halle-saale-zweite-strafanzeige-gegen-hoecke-wegen-aussage-auf-afd-demo-dpa.urn-newsml-dpa-com-20090101-220112-99-678639,Parteien - Halle (Saale),dpa,,,13012022,Sueddeutsche,politik
Inflationsrate in Thüringen weiter auf hohem Niveau,12012022_09:55,https://www.sueddeutsche.de/wirtschaft/verbraucher-erfurt-inflationsrate-in-thueringen-weiter-auf-hohem-niveau-dpa.urn-newsml-dpa-com-20090101-220112-99-678693,Verbraucher - Erfurt,dpa,,,13012022,Sueddeutsche,wirtschaft
Polizei wertet nach Rückkehr der Christkind-Figur Spuren aus,12012022_09:54,https://www.sueddeutsche.de/bayern/kriminalitaet-berlin-polizei-wertet-nach-rueckkehr-der-christkind-figur-spuren-aus-dpa.urn-newsml-dpa-com-20090101-220112-99-678412,Kriminalität - Berlin,dpa,,,13012022,Sueddeutsche,bayern
Fauci platzt der Kragen,12012022_09:52,https://www.sueddeutsche.de/politik/fauci-platzt-der-kragen-1.5505703,,,,"Video
                    
                    
                        Während einer Anhörung im US-Kongress rutscht dem Immunologen ein ""Schwachkopf"" raus.",13012022,Sueddeutsche,politik
Spiele während Olympia-Pause zulässig,12012022_09:52,https://www.sueddeutsche.de/sport/eishockey-spiele-waehrend-olympia-pause-zulaessig-dpa.urn-newsml-dpa-com-20090101-220112-99-678531,Eishockey,dpa,,,13012022,Sueddeutsche,sport
Landkreise im Allgäu und Rosenheim haben die meisten Rinder,12012022_09:51,https://www.sueddeutsche.de/bayern/agrar-fuerth-landkreise-im-allgaeu-und-rosenheim-haben-die-meisten-rinder-dpa.urn-newsml-dpa-com-20090101-220112-99-678413,Agrar - Fürth,dpa,,,13012022,Sueddeutsche,bayern
"Schätzung: Bevölkerung schrumpft 2021 um 0,5 Prozent",12012022_09:44,https://www.sueddeutsche.de/leben/bevoelkerung-halle-saale-schaetzung-bevoelkerung-schrumpft-2021-um-05-prozent-dpa.urn-newsml-dpa-com-20090101-220112-99-678500,Bevölkerung - Halle (Saale),dpa,,,13012022,Sueddeutsche,leben
Polizei wertet nach Rückkehr der Christkind-Figur Spuren aus,12012022_09:43,https://www.sueddeutsche.de/panorama/kriminalitaet-berlin-polizei-wertet-nach-rueckkehr-der-christkind-figur-spuren-aus-dpa.urn-newsml-dpa-com-20090101-220112-99-678429,Kriminalität - Berlin,dpa,,,13012022,Sueddeutsche,panorama
Streit zwischen Zirkus-Familie und Anwohnern eskaliert,12012022_09:39,https://www.sueddeutsche.de/panorama/kriminalitaet-stolberg-streit-zwischen-zirkus-familie-und-anwohnern-eskaliert-dpa.urn-newsml-dpa-com-20090101-220112-99-678402,Kriminalität - Stolberg,dpa,,,13012022,Sueddeutsche,panorama
Bayaz widerspricht Kubicki: Mit Impfpflicht Krise überwinden,12012022_09:38,https://www.sueddeutsche.de/gesundheit/gesundheit-stuttgart-bayaz-widerspricht-kubicki-mit-impfpflicht-krise-ueberwinden-dpa.urn-newsml-dpa-com-20090101-220112-99-678365,Gesundheit - Stuttgart,dpa,,,13012022,Sueddeutsche,gesundheit
Einsatz verbotener Wachse: IBU erhebt Sanktionen,12012022_09:37,https://www.sueddeutsche.de/sport/biathlon-einsatz-verbotener-wachse-ibu-erhebt-sanktionen-dpa.urn-newsml-dpa-com-20090101-220112-99-678018,Biathlon,dpa,,,13012022,Sueddeutsche,sport
Werder: Füllkrug aus Isolation - Nankishi positiv getestet,12012022_09:35,https://www.sueddeutsche.de/sport/fussball-werder-fuellkrug-aus-isolation-nankishi-positiv-getestet-dpa.urn-newsml-dpa-com-20090101-220112-99-678287,Fußball,dpa,,,13012022,Sueddeutsche,sport
"Bobic: Fußball wird ""durch Corona gesunden""",12012022_09:31,https://www.sueddeutsche.de/sport/fussball-berlin-bobic-fussball-wird-durch-corona-gesunden-dpa.urn-newsml-dpa-com-20090101-220112-99-678314,Fußball - Berlin,dpa,,,13012022,Sueddeutsche,sport
