Titel,Date_Info,URL,Overline,Breadcrumb,author,detailed_informations,Zugriff_Datum,News_page,Kategorie
Bayerische Schleierfahnder entdecken 24 Kilogramm Kokain,19012022_10:30,https://www.sueddeutsche.de/bayern/kriminalitaet-muenchen-bayerische-schleierfahnder-entdecken-24-kilogramm-kokain-dpa.urn-newsml-dpa-com-20090101-220119-99-766929,Kriminalität - München,dpa,,,19012022,Sueddeutsche,bayern
Lauterbach für Impfpflicht ab April oder Mai,19012022_10:30,https://www.sueddeutsche.de/gesundheit/gesundheit-lauterbach-fuer-impfpflicht-ab-april-oder-mai-dpa.urn-newsml-dpa-com-20090101-220118-99-760991,Gesundheit,dpa,,,19012022,Sueddeutsche,gesundheit
Neues Museum in Berlin widmet sich den Samurai,19012022_10:28,https://www.sueddeutsche.de/kultur/kunst-berlin-neues-museum-in-berlin-widmet-sich-den-samurai-dpa.urn-newsml-dpa-com-20090101-220119-99-766849,Kunst - Berlin,dpa,,,19012022,Sueddeutsche,kultur
Mädchen von Auto angefahren und verletzt,19012022_10:28,https://www.sueddeutsche.de/panorama/unfaelle-mainz-maedchen-von-auto-angefahren-und-verletzt-dpa.urn-newsml-dpa-com-20090101-220119-99-766900,Unfälle - Mainz,dpa,,,19012022,Sueddeutsche,panorama
FDP lehnt flächendeckend Tempo 30 in Berlin ab,19012022_10:25,https://www.sueddeutsche.de/wirtschaft/verkehr-berlin-fdp-lehnt-flaechendeckend-tempo-30-in-berlin-ab-dpa.urn-newsml-dpa-com-20090101-220119-99-766850,Verkehr - Berlin,dpa,,,19012022,Sueddeutsche,wirtschaft
Über 100.000 neue Corona-Fälle - Vor allem Jüngere infiziert,19012022_10:23,https://www.sueddeutsche.de/gesundheit/gesundheit-ueber-100000-neue-corona-faelle-vor-allem-juengere-infiziert-dpa.urn-newsml-dpa-com-20090101-220119-99-762697,Gesundheit,dpa,,,19012022,Sueddeutsche,gesundheit
Rezept für marokkanischen Eintopf,19012022_10:23,https://www.sueddeutsche.de/wirtschaft/ernaehrung-rezept-fuer-marokkanischen-eintopf-dpa.urn-newsml-dpa-com-20090101-220118-99-756512,Ernährung,dpa,,,19012022,Sueddeutsche,wirtschaft
Vor Kiew-Besuch: USA warnen Russland,19012022_10:23,https://www.sueddeutsche.de/panorama/vor-kiew-besuch-usa-warnen-russland-1.5510634,,,,"Video
                    
                    
                        Im Konflikt zwischen Russland und der Ukraine deutet nichts auf Entspannung hin. Der US-Chefdiplomat reist deswegen nach Europa - neben einem Austausch mit dem ukrainischen Präsidenten und der deutschen Außenministerin steht auch ein heikles Treffen in Genf an.",19012022,Sueddeutsche,panorama
2021 war eines der sieben wärmsten Jahre,19012022_10:22,https://www.sueddeutsche.de/politik/international-2021-war-eines-der-sieben-waermsten-jahre-dpa.urn-newsml-dpa-com-20090101-220119-99-765048,International,dpa,,,19012022,Sueddeutsche,politik
Omikron-Variante verbreitet sich weiter in Brandenburg,19012022_10:21,https://www.sueddeutsche.de/gesundheit/gesundheit-potsdam-omikron-variante-verbreitet-sich-weiter-in-brandenburg-dpa.urn-newsml-dpa-com-20090101-220119-99-766697,Gesundheit - Potsdam,dpa,,,19012022,Sueddeutsche,gesundheit
Bei Bitter-Ausfall: Drux wäre ins Tor gegangen,19012022_10:20,https://www.sueddeutsche.de/sport/handball-bei-bitter-ausfall-drux-waere-ins-tor-gegangen-dpa.urn-newsml-dpa-com-20090101-220119-99-766753,Handball,dpa,,,19012022,Sueddeutsche,sport
"Hans-Jürgen ""Dixie"" Dörner ist tot",19012022_10:17,https://www.sueddeutsche.de/sport/dixie-doerner-dynamo-dresden-tod-1.5510578,Fußball,,,Dynamo Dresden trauert um seinen Ehrenspielführer. Dörner lief in 558 Partien für den Klub und in 100 Länderspielen für die DDR auf. Er verstarb im Alter von 70 Jahren.,19012022,Sueddeutsche,sport
Zeitzeuge Ignacy Golik feiert 100. Geburtstag,19012022_10:17,https://www.sueddeutsche.de/panorama/kirche-ockenheim-zeitzeuge-ignacy-golik-feiert-100-geburtstag-dpa.urn-newsml-dpa-com-20090101-220119-99-766780,Kirche - Ockenheim,dpa,,,19012022,Sueddeutsche,panorama
Gestorbener AfD-Landtagsabgeordneten Wiese: Schweigeminute,19012022_10:15,https://www.sueddeutsche.de/politik/landtag-potsdam-gestorbener-afd-landtagsabgeordneten-wiese-schweigeminute-dpa.urn-newsml-dpa-com-20090101-220119-99-766698,Landtag - Potsdam,dpa,,,19012022,Sueddeutsche,politik
Studie: Start-ups weltweit erleben Geldregen,19012022_10:15,https://www.sueddeutsche.de/wirtschaft/finanzen-studie-start-ups-weltweit-erleben-geldregen-dpa.urn-newsml-dpa-com-20090101-220119-99-765056,Finanzen,dpa,,,19012022,Sueddeutsche,wirtschaft
Mehr Geld für öffentlichen Dienst kostet im 51 Millionen,19012022_10:14,https://www.sueddeutsche.de/politik/landtag-saarbruecken-mehr-geld-fuer-oeffentlichen-dienst-kostet-im-51-millionen-dpa.urn-newsml-dpa-com-20090101-220119-99-766553,Landtag - Saarbrücken,dpa,,,19012022,Sueddeutsche,politik
Stellantis-Chef wettert gegen Elektroauto-Strategie der EU,19012022_10:14,https://www.sueddeutsche.de/wirtschaft/auto-stellantis-chef-wettert-gegen-elektroauto-strategie-der-eu-dpa.urn-newsml-dpa-com-20090101-220119-99-766431,Auto,dpa,,,19012022,Sueddeutsche,wirtschaft
Schweden lockert Testpflicht für Reisende,19012022_10:13,https://www.sueddeutsche.de/gesundheit/gesundheit-schweden-lockert-testpflicht-fuer-reisende-dpa.urn-newsml-dpa-com-20090101-220119-99-765586,Gesundheit,dpa,,,19012022,Sueddeutsche,gesundheit
Mann wegen Brandanschlägen auf Funkmasten angeklagt,19012022_10:13,https://www.sueddeutsche.de/panorama/justiz-saarbruecken-mann-wegen-brandanschlaegen-auf-funkmasten-angeklagt-dpa.urn-newsml-dpa-com-20090101-220119-99-766686,Justiz - Saarbrücken,dpa,,,19012022,Sueddeutsche,panorama
Der BVB bestätigt sein eigenes Klischee,19012022_10:13,https://www.sueddeutsche.de/sport/dfb-pokal-bvb-st-pauli-aus-1.5510559,Pokal-Aus der Borussia,,"Von Thomas Hürner, Hamburg","Beim 1:2 gegen den erstklassig auftretenden FC St. Pauli fallen die Dortmunder erneut in ein tiefes Leistungsloch. Das Aus befeuert die Debatten um die Inkonstanz des Teams - und um den möglichen Haaland-Abschied. 
                        
                            Von Thomas Hürner, Hamburg",19012022,Sueddeutsche,sport
Getöteter 19-Jähriger: Haftbefehl für Verdächtigen erlassen,19012022_10:12,https://www.sueddeutsche.de/panorama/kriminalitaet-leipzig-getoeteter-19-jaehriger-haftbefehl-fuer-verdaechtigen-erlassen-dpa.urn-newsml-dpa-com-20090101-220119-99-766690,Kriminalität - Leipzig,dpa,,,19012022,Sueddeutsche,panorama
Umtausch der Führerscheine von 1959 bis 1964,19012022_10:10,https://www.sueddeutsche.de/politik/behoerden-dresden-umtausch-der-fuehrerscheine-von-1959-bis-1964-dpa.urn-newsml-dpa-com-20090101-220119-99-766691,Behörden - Dresden,dpa,,,19012022,Sueddeutsche,politik
Schwerverletzter: Betrunkener Fahrer drängt Auto auf A19 ab,19012022_10:09,https://www.sueddeutsche.de/panorama/unfaelle-kavelstorf-schwerverletzter-betrunkener-fahrer-draengt-auto-auf-a19-ab-dpa.urn-newsml-dpa-com-20090101-220119-99-766535,Unfälle - Kavelstorf,dpa,,,19012022,Sueddeutsche,panorama
Bei Einreiseverbot für Ungeimpfte kein Recht auf Storno?,19012022_10:09,https://www.sueddeutsche.de/leben/tourismus-bei-einreiseverbot-fuer-ungeimpfte-kein-recht-auf-storno-dpa.urn-newsml-dpa-com-20090101-220119-99-766585,Tourismus,dpa,,,19012022,Sueddeutsche,leben
Unpünktliche Münchner S-Bahn: MVV beschwert sich,19012022_10:09,https://www.sueddeutsche.de/bayern/verkehr-muenchen-unpuenktliche-muenchner-s-bahn-mvv-beschwert-sich-dpa.urn-newsml-dpa-com-20090101-220119-99-766666,Verkehr - München,dpa,,,19012022,Sueddeutsche,bayern
Kriegsverbrecherprozess gegen syrischen Arzt eröffnet,19012022_10:09,https://www.sueddeutsche.de/panorama/prozesse-kriegsverbrecherprozess-gegen-syrischen-arzt-eroeffnet-dpa.urn-newsml-dpa-com-20090101-220119-99-766019,Prozesse,dpa,,,19012022,Sueddeutsche,panorama
"Strack-Zimmermann will über Lieferung von Defensivwaffen ""nachdenken""",19012022_10:07,https://www.sueddeutsche.de/politik/ukraine-waffen-fdp-ruestungsexporte-1.5510470,Ukraine-Konflikt,,,"Die Vorsitzende des Verteidigungsausschusses hatte solche Lieferungen erst kürzlich noch ausgeschlossen. Die FDP-Politikerin fordert jetzt eine klare Definition, um welche Waffensysteme es sich handeln würde.",19012022,Sueddeutsche,politik
Stabil auf hohem Niveau: Deutschland und seine Aktienkultur,19012022_10:06,https://www.sueddeutsche.de/wirtschaft/boersen-stabil-auf-hohem-niveau-deutschland-und-seine-aktienkultur-dpa.urn-newsml-dpa-com-20090101-220119-99-766549,Börsen,dpa,,,19012022,Sueddeutsche,wirtschaft
US-Außenminister Blinken zu Gesprächen in Kiew,19012022_10:06,https://www.sueddeutsche.de/politik/konflikte-us-aussenminister-blinken-zu-gespraechen-in-kiew-dpa.urn-newsml-dpa-com-20090101-220119-99-762177,Konflikte,dpa,,,19012022,Sueddeutsche,politik
Corona: Lucas Cordalis zieht nicht ins Dschungelcamp,19012022_10:05,https://www.sueddeutsche.de/leben/leute-corona-lucas-cordalis-zieht-nicht-ins-dschungelcamp-dpa.urn-newsml-dpa-com-20090101-220119-99-765697,Leute,dpa,,,19012022,Sueddeutsche,leben
Lohn für Beschäftigte der Diakonie soll weiter steigen,19012022_10:05,https://www.sueddeutsche.de/karriere/arbeitgeber-schwerin-lohn-fuer-beschaeftigte-der-diakonie-soll-weiter-steigen-dpa.urn-newsml-dpa-com-20090101-220119-99-766534,Arbeitgeber - Schwerin,dpa,,,19012022,Sueddeutsche,karriere
Autofahrer fuhr vermutlich mit erhöhtem Tempo auf Raststätte,19012022_10:03,https://www.sueddeutsche.de/panorama/braende-hammersbach-autofahrer-fuhr-vermutlich-mit-erhoehtem-tempo-auf-raststaette-dpa.urn-newsml-dpa-com-20090101-220119-99-766547,Brände - Hammersbach,dpa,,,19012022,Sueddeutsche,panorama
Empörung über Leitfaden für Touristinnen in Costa Rica,19012022_10:03,https://www.sueddeutsche.de/politik/regierung-empoerung-ueber-leitfaden-fuer-touristinnen-in-costa-rica-dpa.urn-newsml-dpa-com-20090101-220119-99-766037,Regierung,dpa,,,19012022,Sueddeutsche,politik
Über Tausend Fälle gefälschter Impfpässe im Land,19012022_10:02,https://www.sueddeutsche.de/panorama/kriminalitaet-stuttgart-ueber-tausend-faelle-gefaelschter-impfpaesse-im-land-dpa.urn-newsml-dpa-com-20090101-220119-99-762567,Kriminalität - Stuttgart,dpa,,,19012022,Sueddeutsche,panorama
Sächsischer AfD-Parteichef Jörg Urban mit Corona infiziert,19012022_10:00,https://www.sueddeutsche.de/politik/parteien-dresden-saechsischer-afd-parteichef-joerg-urban-mit-corona-infiziert-dpa.urn-newsml-dpa-com-20090101-220119-99-766505,Parteien - Dresden,dpa,,,19012022,Sueddeutsche,politik
"""Nicht zu entschuldigen"": BVB-Coach Rose fehlt Mentalität",19012022_09:59,https://www.sueddeutsche.de/sport/fussball-nicht-zu-entschuldigen-bvb-coach-rose-fehlt-mentalitaet-dpa.urn-newsml-dpa-com-20090101-220119-99-764161,Fußball,dpa,,,19012022,Sueddeutsche,sport
"DFB-Pokal: Das war der Dienstag, das kommt am Mittwoch",19012022_09:58,https://www.sueddeutsche.de/sport/fussball-dfb-pokal-das-war-der-dienstag-das-kommt-am-mittwoch-dpa.urn-newsml-dpa-com-20090101-220119-99-762736,Fußball,dpa,,,19012022,Sueddeutsche,sport
Latzel fordert Veränderungsbereitschaft der Kirche,19012022_09:58,https://www.sueddeutsche.de/panorama/kirche-duesseldorf-latzel-fordert-veraenderungsbereitschaft-der-kirche-dpa.urn-newsml-dpa-com-20090101-220119-99-766359,Kirche - Düsseldorf,dpa,,,19012022,Sueddeutsche,panorama
Saar-Landtag will Französisch-Unterricht in allen Kitas,19012022_09:58,https://www.sueddeutsche.de/politik/landtag-saarbruecken-saar-landtag-will-franzoesisch-unterricht-in-allen-kitas-dpa.urn-newsml-dpa-com-20090101-220119-99-766172,Landtag - Saarbrücken,dpa,,,19012022,Sueddeutsche,politik
Merkel lehnt Jobangebot von UN-Generalsekretär Guterres ab,19012022_09:57,https://www.sueddeutsche.de/politik/regierung-merkel-lehnt-jobangebot-von-un-generalsekretaer-guterres-ab-dpa.urn-newsml-dpa-com-20090101-220119-99-761560,Regierung,dpa,,,19012022,Sueddeutsche,politik
"Wettbewerbsprogramm für ""Goldenen Spatzen"" steht",19012022_09:57,https://www.sueddeutsche.de/wirtschaft/medien-erfurt-wettbewerbsprogramm-fuer-goldenen-spatzen-steht-dpa.urn-newsml-dpa-com-20090101-220119-99-766464,Medien - Erfurt,dpa,,,19012022,Sueddeutsche,wirtschaft
Weitere Corona-Fälle bei den Nürnberger Ice Tigers,19012022_09:54,https://www.sueddeutsche.de/bayern/eishockey-nuernberg-weitere-corona-faelle-bei-den-nuernberger-ice-tigers-dpa.urn-newsml-dpa-com-20090101-220119-99-766448,Eishockey - Nürnberg,dpa,,,19012022,Sueddeutsche,bayern
Rheinischer Präses: Veränderungsbereitschaft der Kirche,19012022_09:53,https://www.sueddeutsche.de/panorama/kirche-duesseldorf-rheinischer-praesesveraenderungsbereitschaft-der-kirche-dpa.urn-newsml-dpa-com-20090101-220119-99-766410,Kirche - Düsseldorf,dpa,,,19012022,Sueddeutsche,panorama
Corona-Lage bei Handballern angespannt: Training unklar,19012022_09:52,https://www.sueddeutsche.de/sport/handball-corona-lage-bei-handballern-angespannt-training-unklar-dpa.urn-newsml-dpa-com-20090101-220119-99-766339,Handball,dpa,,,19012022,Sueddeutsche,sport
Erstmals mehr als 100 000 Neuinfektionen,19012022_09:46,https://www.sueddeutsche.de/politik/corona-aktuell-rki-inzidenz-neuinfektionen-deutschland-1.5508908,Meldungen zum Coronavirus,,Nachrichten aus Deutschland und aller Welt,"Die Gesundheitsämter in Deutschland melden 112 323 positive Tests innerhalb von 24 Stunden. Das Robert-Koch-Institut registriert eine bundesweite Inzidenz von 584,4 und 239 neue Todesfälle.
                        
                            Nachrichten aus Deutschland und aller Welt",19012022,Sueddeutsche,politik
Stau auf A60 nach Unfall auf angrenzender Landstraße,19012022_09:43,https://www.sueddeutsche.de/panorama/unfaelle-ginsheim-gustavsburg-stau-auf-a60-nach-unfall-auf-angrenzender-landstrasse-dpa.urn-newsml-dpa-com-20090101-220119-99-766264,Unfälle - Ginsheim-Gustavsburg,dpa,,,19012022,Sueddeutsche,panorama
Stellantis-Chef wettert gegen Elektroauto-Strategie der EU,19012022_09:41,https://www.sueddeutsche.de/wirtschaft/auto-duesseldorf-stellantis-chef-wettert-gegen-elektroauto-strategie-der-eu-dpa.urn-newsml-dpa-com-20090101-220119-99-766230,Auto - Düsseldorf,dpa,,,19012022,Sueddeutsche,wirtschaft
Dreijähriger bei Unfall in Wolfen schwer verletzt,19012022_09:38,https://www.sueddeutsche.de/panorama/unfaelle-bitterfeld-wolfen-dreijaehriger-bei-unfall-in-wolfen-schwer-verletzt-dpa.urn-newsml-dpa-com-20090101-220119-99-766200,Unfälle - Bitterfeld-Wolfen,dpa,,,19012022,Sueddeutsche,panorama
Tennis-Duell zwischen Barty und Osaka rückt näher,19012022_09:38,https://www.sueddeutsche.de/sport/tennis-tennis-duell-zwischen-barty-und-osaka-rueckt-naeher-dpa.urn-newsml-dpa-com-20090101-220119-99-762166,Tennis,dpa,,,19012022,Sueddeutsche,sport
Corona-Inzidenz in Niedersachsen steigt minimal,19012022_09:37,https://www.sueddeutsche.de/gesundheit/gesundheit-hannover-corona-inzidenz-in-niedersachsen-steigt-minimal-dpa.urn-newsml-dpa-com-20090101-220119-99-766165,Gesundheit - Hannover,dpa,,,19012022,Sueddeutsche,gesundheit
