Titel,Date_Info,URL,Overline,Breadcrumb,author,detailed_informations,Zugriff_Datum,News_page
Bahn: Strecke Hannover-Hamburg wieder komplett frei,23022022_15:31,https://www.sueddeutsche.de/wirtschaft/bahn-uelzen-bahn-strecke-hannover-hamburg-wieder-komplett-frei-dpa.urn-newsml-dpa-com-20090101-220223-99-249759,Bahn - Uelzen,dpa,,,23022022,Sueddeutsche
Polizei nimmt mutmaßliche Autodiebe fest,23022022_15:30,https://www.sueddeutsche.de/panorama/kriminalitaet-dortmund-polizei-nimmt-mutmassliche-autodiebe-fest-dpa.urn-newsml-dpa-com-20090101-220223-99-255065,Kriminalität - Dortmund,dpa,,,23022022,Sueddeutsche
Grüne und SPD begrüßen geplante Mindestlohnerhöhung,23022022_15:30,https://www.sueddeutsche.de/karriere/arbeitsmarkt-schwerin-gruene-und-spd-begruessen-geplante-mindestlohnerhoehung-dpa.urn-newsml-dpa-com-20090101-220223-99-254957,Arbeitsmarkt - Schwerin,dpa,,,23022022,Sueddeutsche
MV mit zweithöchster Impfquote bei Kleinkindern,23022022_15:29,https://www.sueddeutsche.de/gesundheit/gesundheit-schwerin-mv-mit-zweithoechster-impfquote-bei-kleinkindern-dpa.urn-newsml-dpa-com-20090101-220223-99-251293,Gesundheit - Schwerin,dpa,,,23022022,Sueddeutsche
Sieben Jahre Haft für Vergewaltigung einer Elfjährigen,23022022_15:29,https://www.sueddeutsche.de/panorama/prozesse-schwerin-sieben-jahre-haft-fuer-vergewaltigung-einer-elfjaehrigen-dpa.urn-newsml-dpa-com-20090101-220223-99-254958,Prozesse - Schwerin,dpa,,,23022022,Sueddeutsche
Gefahrguttransporter verunglückt: Autobahn Stunden gesperrt,23022022_15:28,https://www.sueddeutsche.de/wirtschaft/verkehr-gefahrguttransporter-verunglueckt-autobahn-stunden-gesperrt-dpa.urn-newsml-dpa-com-20090101-220223-99-246391,Verkehr,dpa,,,23022022,Sueddeutsche
Die Angst der Despoten,23022022_15:27,https://www.sueddeutsche.de/kultur/putin-ukraine-donbass-psychologie-literatur-tanja-maljartschuk-1.5535205,Ukraine-Konflikt,,Gastbeitrag von Tanja Maljartschuk,"Diktatoren gefallen sich in der Rolle des dämonischen Genies. Diese Inszenierung sollten wir ihnen nicht zugestehen. Sie sind gewöhnliche Gewalttäter ohne jedes Geheimnis. 
                        
                            Gastbeitrag von Tanja Maljartschuk",23022022,Sueddeutsche
Das schwarze Guernica,23022022_15:27,https://www.sueddeutsche.de/kultur/faith-ringgold-ausstellung-rassismus-usa-gemaelde-picasso-1.5535089,Ausstellung über Faith Ringgold,,Von Sebastian Moll,"Eine Retrospektive in New York würdigt Faith Ringgold und ihr außerordentliches Werk, im Museum of Modern Art hängt sie nun neben Picasso. 
                        
                            Von Sebastian Moll",23022022,Sueddeutsche
Streit um Taxipreis: Rangelei und rassistische Beleidigung,23022022_15:26,https://www.sueddeutsche.de/panorama/kriminalitaet-berlin-streit-um-taxipreis-rangelei-und-rassistische-beleidigung-dpa.urn-newsml-dpa-com-20090101-220223-99-254910,Kriminalität - Berlin,dpa,,,23022022,Sueddeutsche
Bundeskabinett beschließt Mindestlohnerhöhung auf 12 Euro,23022022_15:26,https://www.sueddeutsche.de/politik/kabinett-bundeskabinett-beschliesst-mindestlohnerhoehung-auf-12-euro-dpa.urn-newsml-dpa-com-20090101-220223-99-247197,Kabinett,dpa,,,23022022,Sueddeutsche
Zwei Schiffe kollidieren auf der Ems bei Haren,23022022_15:25,https://www.sueddeutsche.de/wirtschaft/schifffahrt-haren-ems-zwei-schiffe-kollidieren-auf-der-ems-bei-haren-dpa.urn-newsml-dpa-com-20090101-220223-99-251521,Schifffahrt - Haren (Ems),dpa,,,23022022,Sueddeutsche
Harzer Schmalspurbahnen nehmen Verkehr wieder auf,23022022_15:23,https://www.sueddeutsche.de/wirtschaft/verkehr-wernigerode-harzer-schmalspurbahnen-nehmen-verkehr-wieder-auf-dpa.urn-newsml-dpa-com-20090101-220223-99-254860,Verkehr - Wernigerode,dpa,,,23022022,Sueddeutsche
Autos stoßen frontal zusammen: Autofahrer stirbt,23022022_15:22,https://www.sueddeutsche.de/panorama/unfaelle-schwanebeck-autos-stossen-frontal-zusammen-autofahrer-stirbt-dpa.urn-newsml-dpa-com-20090101-220223-99-254861,Unfälle - Schwanebeck,dpa,,,23022022,Sueddeutsche
Alles ist verwurstet,23022022_15:21,https://www.sueddeutsche.de/kultur/senthuran-varatharajah-rot-hunger-true-crime-literatur-rezension-1.5535267,"Senthuran Varatharajahs Roman ""Rot (Hunger)""",,Von Birthe Mühlhoff,"Hauptsache Abstand: Senthuran Varatharajah macht aus der Geschichte des ""Kannibalen von Rotenburg"" einen aphoristischen Liebesroman.
                        
                            Von Birthe Mühlhoff",23022022,Sueddeutsche
Heil: Mindestlohn-Erhöhung bedeutet Respekt,23022022_15:21,https://www.sueddeutsche.de/karriere/arbeit-wolmirstedt-heil-mindestlohn-erhoehung-bedeutet-respekt-dpa.urn-newsml-dpa-com-20090101-220223-99-254862,Arbeit - Wolmirstedt,dpa,,,23022022,Sueddeutsche
EU-Ratspräsident beruft Sondergipfel wegen Ukraine-Krise ein,23022022_15:21,https://www.sueddeutsche.de/politik/eu-eu-ratspraesident-beruft-sondergipfel-wegenukraine-krise-ein-dpa.urn-newsml-dpa-com-20090101-220223-99-254978,EU,dpa,,,23022022,Sueddeutsche
Weiterer Corona-Fall bei Eintracht Braunschweig,23022022_15:20,https://www.sueddeutsche.de/sport/fussball-braunschweig-weiterer-corona-fall-bei-eintracht-braunschweig-dpa.urn-newsml-dpa-com-20090101-220223-99-254960,Fußball - Braunschweig,dpa,,,23022022,Sueddeutsche
Chance Naturkatastrophe: Munich Re will Geschäft ausbauen,23022022_15:19,https://www.sueddeutsche.de/wirtschaft/versicherungen-chance-naturkatastrophe-munich-re-will-geschaeft-ausbauen-dpa.urn-newsml-dpa-com-20090101-220223-99-252965,Versicherungen,dpa,,,23022022,Sueddeutsche
Explosionsgefahr im Biertragerl,23022022_15:17,https://www.sueddeutsche.de/muenchen/ebersberg/landkreis-ebersberg-brauerei-schweiger-rueckruf-1.5535246,Markt Schwaben,,"Von Wieland Bögel, Markt Schwaben","Die Markt Schwabener Brauerei Schweiger ruft Flaschen zurück. Im ""Schweiger Goaßal"" braut sich was zusammen.
                        
                            Von Wieland Bögel, Markt Schwaben",23022022,Sueddeutsche
Rapper Fler im Zeugenstand,23022022_15:15,https://www.sueddeutsche.de/panorama/bushido-arafat-abou-chaker-prozess-berlin-fler-zeugenaussage-1.5535290,Berlin,,,"Im Prozess zwischen Bushido und seinem ehemaligen Geschäftspartner Arafat Abou-Chaker sagt Fler aus, die beiden seien ""ein perfektes Team"" gewesen.",23022022,Sueddeutsche
Lufthansa will Piloten zu Einsparungen drängen,23022022_15:14,https://www.sueddeutsche.de/wirtschaft/lufthansa-piloten-gehalt-1.5535145,Fluggesellschaft,,"Von Jens Flottau, Frankfurt","Die Airline erwägt, einen neuen Billig-Ableger zu gründen, wenn die Piloten sich nicht auf niedrigere Kosten einlassen. Es geht um Einsparungen von 20 bis 30 Prozent.
                        
                            Von Jens Flottau, Frankfurt",23022022,Sueddeutsche
Kölner Kirchenrichter empört mit Goebbels-Vergleich,23022022_15:14,https://www.sueddeutsche.de/panorama/kirche-koeln-koelner-kirchenrichter-empoert-mit-goebbels-vergleich-dpa.urn-newsml-dpa-com-20090101-220223-99-254879,Kirche - Köln,dpa,,,23022022,Sueddeutsche
Dynamo Dresden kann Zuschauerkapazität erhöhen,23022022_15:11,https://www.sueddeutsche.de/sport/fussball-dresden-dynamo-dresden-kann-zuschauerkapazitaet-erhoehen-dpa.urn-newsml-dpa-com-20090101-220223-99-254829,Fußball - Dresden,dpa,,,23022022,Sueddeutsche
"""Wir ahnen oft gar nicht, wie reich manche sind""",23022022_15:10,https://www.sueddeutsche.de/muenchen/muenchen-max-planck-institut-ungleichheit-reichtum-gerechtigkeit-1.5535257,Soziale Ungleichheit,,Interview von Bernd Kramer,"Simone Schneider erforscht, wie wir Ungleichheit wahrnehmen. Ein Gespräch über Millionäre, die sich zur Mittelschicht zählen, und darüber, warum Vergleiche nicht automatisch unglücklich machen.
                        
                            Interview von Bernd Kramer",23022022,Sueddeutsche
Ermittlungen wegen mutmaßlichen Verrats bei Flutkatastrophe,23022022_15:10,https://www.sueddeutsche.de/panorama/justiz-trier-ermittlungen-wegen-mutmasslichen-verrats-bei-flutkatastrophe-dpa.urn-newsml-dpa-com-20090101-220223-99-254828,Justiz - Trier,dpa,,,23022022,Sueddeutsche
Weiterer Untersuchungsausschuss befasst sich mit Unikliniken,23022022_15:10,https://www.sueddeutsche.de/politik/landtag-schwerin-weiterer-untersuchungsausschuss-befasst-sich-mit-unikliniken-dpa.urn-newsml-dpa-com-20090101-220223-99-252190,Landtag - Schwerin,dpa,,,23022022,Sueddeutsche
Verkehrsminister fordert mehr Bundesmittel für besseren ÖPNV,23022022_15:09,https://www.sueddeutsche.de/politik/regierung-bremen-verkehrsminister-fordert-mehr-bundesmittel-fuer-besseren-oepnv-dpa.urn-newsml-dpa-com-20090101-220223-99-254711,Regierung - Bremen,dpa,,,23022022,Sueddeutsche
Hoffenheim - VfB nicht ausverkauft,23022022_15:08,https://www.sueddeutsche.de/sport/fussball-zuzenhausen-hoffenheim-vfb-nicht-ausverkauft-dpa.urn-newsml-dpa-com-20090101-220223-99-253898,Fußball - Zuzenhausen,dpa,,,23022022,Sueddeutsche
46-Jähriger in Itzehoe getötet: Haftbefehl gegen Bekannten,23022022_15:07,https://www.sueddeutsche.de/panorama/kriminalitaet-itzehoe-46-jaehriger-in-itzehoe-getoetet-haftbefehl-gegen-bekannten-dpa.urn-newsml-dpa-com-20090101-220223-99-247555,Kriminalität - Itzehoe,dpa,,,23022022,Sueddeutsche
Berlin und Brandenburg: Parks und Schlösser wieder geöffnet,23022022_15:07,https://www.sueddeutsche.de/panorama/wetter-potsdam-berlin-und-brandenburg-parks-und-schloesser-wieder-geoeffnet-dpa.urn-newsml-dpa-com-20090101-220223-99-254712,Wetter - Potsdam,dpa,,,23022022,Sueddeutsche
Nord Stream 2: Uniper plant keine juristischen Schritte,23022022_15:07,https://www.sueddeutsche.de/wirtschaft/energie-nord-stream-2-uniper-plant-keine-juristischen-schritte-dpa.urn-newsml-dpa-com-20090101-220223-99-253074,Energie,dpa,,,23022022,Sueddeutsche
Razzia in Clan-Milieu nach Überfall: Schmuck entdeckt,23022022_15:06,https://www.sueddeutsche.de/panorama/kriminalitaet-duisburg-razzia-in-clan-milieu-nach-ueberfall-schmuck-entdeckt-dpa.urn-newsml-dpa-com-20090101-220223-99-254131,Kriminalität - Duisburg,dpa,,,23022022,Sueddeutsche
Berliner Linke spenden Diätenerhöhung für Frauenprojekte,23022022_15:05,https://www.sueddeutsche.de/politik/abgeordnetenhaus-berlin-berliner-linke-spenden-diaetenerhoehung-fuer-frauenprojekte-dpa.urn-newsml-dpa-com-20090101-220223-99-254713,Abgeordnetenhaus - Berlin,dpa,,,23022022,Sueddeutsche
"Bizarre Wendung im Rechtsstreit um ""Das Boot""",23022022_15:04,https://www.sueddeutsche.de/kultur/jost-vacano-rechtsstreit-das-boot-1.5535277,Klage von Kameramann Jost Vacano,,Von Tobias Kniebe,"Bavaria Film und Eurovideo erklären die gerichtliche Auseinandersetzung für beendet. Stimmt aber nicht, sagt der Kläger und Kameramann Jost Vacano.
                        
                            Von Tobias Kniebe",23022022,Sueddeutsche
Berliner Immobilienmarkt: Gutachter verzeichnen Rekordumsatz,23022022_15:04,https://www.sueddeutsche.de/wirtschaft/immobilien-berlin-berliner-immobilienmarkt-gutachter-verzeichnen-rekordumsatz-dpa.urn-newsml-dpa-com-20090101-220223-99-254714,Immobilien - Berlin,dpa,,,23022022,Sueddeutsche
Klimaschützer protestieren an drei Flughäfen,23022022_15:04,https://www.sueddeutsche.de/politik/demonstrationen-klimaschuetzer-protestieren-an-drei-flughaefen-dpa.urn-newsml-dpa-com-20090101-220223-99-249582,Demonstrationen,dpa,,,23022022,Sueddeutsche
Der Spion mit der Lizenz zum Geldmachen,23022022_15:04,https://www.sueddeutsche.de/wirtschaft/suisse-secrets-geheimdienste-schweiz-flowtex-korruption-1.5532524,Suisse Secrets,,Von Jörg Schmitt,"Exklusiv
                    
                    
                        Wie die Schmiergeldspur eines ägyptischen Geheimdienstlers, Waffenhändlers und Multiunternehmers über die Genfer Credit- Suisse-Filiale direkt in einen der großen Korruptionsskandale der deutschen Geschichte führte.
                        
                            Von Jörg Schmitt",23022022,Sueddeutsche
Reiseregeln sollen gelockert werden,23022022_15:03,https://www.sueddeutsche.de/reise/reiseregeln-hochrisikogebiete-corona-kinder-1.5533402,Hochrisikogebiete,,Von Irene Helmes und Monika Maier-Albang,"Die Einstufung von Hochrisikogebieten war lange umstritten. Nun sollen neue Bestimmungen in Kraft treten - eine gute Nachricht vor allem für Familien mit ungeimpften Kindern.
                        
                            Von Irene Helmes und Monika Maier-Albang",23022022,Sueddeutsche
VW besorgt wegen Zuschärfung des Russland-Ukraine-Konflikts,23022022_15:03,https://www.sueddeutsche.de/politik/konflikte-wolfsburg-vw-besorgt-wegen-zuschaerfung-des-russland-ukraine-konflikts-dpa.urn-newsml-dpa-com-20090101-220223-99-252144,Konflikte - Wolfsburg,dpa,,,23022022,Sueddeutsche
Welche Filme sich lohnen - und welche nicht,23022022_15:03,https://www.sueddeutsche.de/kultur/filmstarts-kino-streaming-1.5534903,Neu in Kino & Streaming,,Von den SZ-Kritikern,"Will Smith spielt den Vater von Venus und Serena Williams im Tennisdrama ""King Richard"". Kenneth Branagh erzählt in ""Belfast"" von seiner Kindheit. Die Starts der Woche in Kürze.
                        
                            Von den SZ-Kritikern",23022022,Sueddeutsche
Budget für Abgeordnete: Kritik vom Bund der Steuerzahler,23022022_15:03,https://www.sueddeutsche.de/politik/abgeordnetenhaus-berlin-budget-fuer-abgeordnete-kritik-vom-bund-der-steuerzahler-dpa.urn-newsml-dpa-com-20090101-220223-99-254003,Abgeordnetenhaus - Berlin,dpa,,,23022022,Sueddeutsche
Ajax glänzt unter grauem Schleier,23022022_15:02,https://www.sueddeutsche.de/sport/fussball-champions-league-ajax-amsterdam-1.5534487,Champions League,,Von Ulrich Hartmann,"Sportlich läuft es für das Team aus Amsterdam blendend. Doch diverse Themen sorgen für schlechte Stimmung - unter anderem das Aus für Sportchef Overmars nach pikanten Vorwürfen.
                        
                            Von Ulrich Hartmann",23022022,Sueddeutsche
"Helfen Biokraftstoffe wirklich, das Klima zu entlasten?",23022022_15:02,https://www.sueddeutsche.de/wissen/umweltpolitik-helfen-biokraftstoffe-wirklich-das-klima-zu-entlasten-dpa.urn-newsml-dpa-com-20090101-220223-99-254509,Umweltpolitik,dpa,,,23022022,Sueddeutsche
Das sind die Regeln für Urlaub in Europa,23022022_15:01,https://www.sueddeutsche.de/reise/urlaub-reise-europa-corona-regeln-1.5303333,Reisen und Corona,,"Von Daniela Gorgs (Daten), Benedict Witzenberger (Daten), Eva Dignös, Irene Helmes und Birgit Kruse","Welche Tests muss man an der Grenze vorlegen, wen erwartet nach der Einreise die Quarantäne? Der Überblick über die Regeln in den Urlaubsländern in einer Karte.
                        
                            Von Daniela Gorgs (Daten), Benedict Witzenberger (Daten), Eva Dignös, Irene Helmes und Birgit Kruse",23022022,Sueddeutsche
Kammern in MV fordern Steuersenkung für Energie,23022022_15:01,https://www.sueddeutsche.de/wirtschaft/energie-rostock-kammern-in-mv-fordern-steuersenkung-fuer-energie-dpa.urn-newsml-dpa-com-20090101-220223-99-254494,Energie - Rostock,dpa,,,23022022,Sueddeutsche
Dreijähriger nach Sturz in den Neckar gestorben,23022022_15:01,https://www.sueddeutsche.de/panorama/notfaelle-hassmersheim-dreijaehriger-nach-sturz-in-den-neckar-gestorben-dpa.urn-newsml-dpa-com-20090101-220223-99-254678,Notfälle - Haßmersheim,dpa,,,23022022,Sueddeutsche
Insolvente MV Werften: Handwerk kann Fachkräfte aufnehmen,23022022_15:00,https://www.sueddeutsche.de/wirtschaft/schiffbau-schwerin-insolvente-mv-werften-handwerk-kann-fachkraefte-aufnehmen-dpa.urn-newsml-dpa-com-20090101-220223-99-254495,Schiffbau - Schwerin,dpa,,,23022022,Sueddeutsche
Kaputter Zauber,23022022_14:58,https://www.sueddeutsche.de/kultur/mark-lanegan-nachruf-1.5535265,Nachruf auf Rocksänger Mark Lanegan,,Von Jens-Christian Rabe,"Zum Tod des amerikanischen Rocksängers und Grunge-Pioniers Mark Lanegan.
                        
                            Von Jens-Christian Rabe",23022022,Sueddeutsche
Ploß: Niederlage Schwesigs ist Sieg für die Meinungsfreiheit,23022022_14:56,https://www.sueddeutsche.de/panorama/justiz-hamburg-ploss-niederlage-schwesigs-ist-sieg-fuer-die-meinungsfreiheit-dpa.urn-newsml-dpa-com-20090101-220223-99-249026,Justiz - Hamburg,dpa,,,23022022,Sueddeutsche
Lkw-Anhänger brennt aus: A3 zeitweise voll gesperrt,23022022_14:56,https://www.sueddeutsche.de/panorama/braende-seligenstadt-lkw-anhaenger-brennt-aus-a3-zeitweise-voll-gesperrt-dpa.urn-newsml-dpa-com-20090101-220223-99-254576,Brände - Seligenstadt,dpa,,,23022022,Sueddeutsche
