Titel,Date_Info,URL,Overline,Breadcrumb,author,detailed_informations,Zugriff_Datum,News_page,Kategorie
Bayern besiegt Fürth mit 4:1,20022022_14:20,https://liveticker.sueddeutsche.de/fussball/1bundesliga/bayern-muenchen/spvgg-gr-fuerth/2022-02-20.html,Bundesliga,,Die Partie in der Liveticker-Nachlese,"Für eine Halbzeit sah es so aus, als könne Greuther Fürth den Tabellenführer ärgern. Doch dann drehte der FC Bayern auf - und wie.
                        
                            Die Partie in der Liveticker-Nachlese",21022022,Sueddeutsche,fussball
Versuchte Unfallflucht: Polizei ermittelt gegen Radfahrer,20022022_14:20,https://www.sueddeutsche.de/panorama/kriminalitaet-berlin-versuchte-unfallflucht-polizei-ermittelt-gegen-radfahrer-dpa.urn-newsml-dpa-com-20090101-220220-99-216627,Kriminalität - Berlin,dpa,,,21022022,Sueddeutsche,panorama
Metronom stellt Zugverkehr schrittweise wieder ein,20022022_14:16,https://www.sueddeutsche.de/panorama/unwetter-uelzen-metronom-stellt-zugverkehr-schrittweise-wieder-ein-dpa.urn-newsml-dpa-com-20090101-220220-99-216512,Unwetter - Uelzen,dpa,,,21022022,Sueddeutsche,panorama
Mutmaßlicher Schleuser baut Unfall: vier Schwerverletzte,20022022_14:15,https://www.sueddeutsche.de/panorama/kriminalitaet-bautzen-mutmasslicher-schleuser-baut-unfall-vier-schwerverletzte-dpa.urn-newsml-dpa-com-20090101-220220-99-216584,Kriminalität - Bautzen,dpa,,,21022022,Sueddeutsche,panorama
Polizeischutz für die Medien,20022022_14:14,https://www.sueddeutsche.de/medien/presse-polizeischutz-corona-proteste-1.5532939,Übergriffe bei Corona-Protesten,,,"Wie ""Safe Spaces"" Journalisten gegen Angriffe bei Corona-Protestkundgebungen sichern sollen.",21022022,Sueddeutsche,medien
Lauterbach warnt vor zu schnellen Öffnungsschritten,20022022_14:12,https://www.sueddeutsche.de/gesundheit/gesundheit-berlin-lauterbach-warnt-vor-zu-schnellen-oeffnungsschritten-dpa.urn-newsml-dpa-com-20090101-220220-99-216553,Gesundheit - Berlin,dpa,,,21022022,Sueddeutsche,gesundheit
"""God Save the Queen"" - Königin Elizabeth II. hat Corona",20022022_14:12,https://www.sueddeutsche.de/leben/adel-god-save-the-queen-koenigin-elizabeth-ii-hat-corona-dpa.urn-newsml-dpa-com-20090101-220220-99-214996,Adel,dpa,,,21022022,Sueddeutsche,leben
"Woran glauben Sie, Herbert Knaup?",20022022_14:11,https://sz-magazin.sueddeutsche.de/sagen-sie-jetzt-nichts/herbert-knaup-interview-ohne-worte-91230,Sagen Sie jetzt nichts,,,"Der Schauspieler und Musiker im Interview ohne Worte über seinen Teenager-Sohn, die nervigen Seiten des Allgäus und die größte aller Fragen: Lennon oder McCartney?",21022022,Sueddeutsche,sagen-sie-jetzt-nichts
"Betrunkener bedroht Frau, Tochter und Polizei mit Beil",20022022_14:09,https://www.sueddeutsche.de/bayern/kriminalitaet-stein-betrunkener-bedroht-frau-tochter-und-polizei-mit-beil-dpa.urn-newsml-dpa-com-20090101-220220-99-216515,Kriminalität - Stein,dpa,,,21022022,Sueddeutsche,bayern
Mehrere Jugendliche bei Schlägerei in Frankfurt verletzt,20022022_14:06,https://www.sueddeutsche.de/panorama/kriminalitaet-frankfurt-am-main-mehrere-jugendliche-bei-schlaegerei-in-frankfurt-verletzt-dpa.urn-newsml-dpa-com-20090101-220220-99-213121,Kriminalität - Frankfurt am Main,dpa,,,21022022,Sueddeutsche,panorama
Mattscheiben in Vorgärten,20022022_14:06,https://www.sueddeutsche.de/kultur/dan-graham-kuenstler-nachruf-1.5532944,Künstler Dan Graham im Alter von 79 Jahren gestorben,,Von Catrin Lorch,"Zum Tod des amerikanischen Bildhauers, Architekten, Theoretikers und Popkultur-Enthusiasten Dan Graham.
                        
                            Von Catrin Lorch",21022022,Sueddeutsche,kultur
Kretschmer gratuliert sächsischen Sportlern zu Medaillen,20022022_14:05,https://www.sueddeutsche.de/sport/olympia-dresden-kretschmer-gratuliert-saechsischen-sportlern-zu-medaillen-dpa.urn-newsml-dpa-com-20090101-220220-99-216474,Olympia - Dresden,dpa,,,21022022,Sueddeutsche,sport
Nach Evakuierung wegen Sturm: keine Verletzten in Klinik,20022022_14:02,https://www.sueddeutsche.de/panorama/wetter-bad-zwischenahn-nach-evakuierung-wegen-sturm-keine-verletzten-in-klinik-dpa.urn-newsml-dpa-com-20090101-220220-99-216445,Wetter - Bad Zwischenahn,dpa,,,21022022,Sueddeutsche,panorama
Ohne Kontraste,20022022_14:01,https://www.sueddeutsche.de/medien/bel-air-drama-serie-sky-1.5532636,"Serie ""Bel-Air"" auf Sky",,"Von Jürgen Schmieder, Los Angeles","Die Neuauflage der Sitcom ""Der Prinz von Bel-Air"" ist eine Drama-Serie - und sie scheitert an Mutlosigkeit.
                        
                            Von Jürgen Schmieder, Los Angeles",21022022,Sueddeutsche,medien
TSV Havelse verliert Kellerduell mit Würzburg,20022022_13:58,https://www.sueddeutsche.de/sport/fussball-hannover-tsv-havelse-verliert-kellerduell-mit-wuerzburg-dpa.urn-newsml-dpa-com-20090101-220220-99-216397,Fußball - Hannover,dpa,,,21022022,Sueddeutsche,sport
Hoffnung auf 25.000 Zuschauer beim DFB-Pokal-Viertelfinale,20022022_13:57,https://www.sueddeutsche.de/sport/fussball-hamburg-hoffnung-auf-25000-zuschauer-beim-dfb-pokal-viertelfinale-dpa.urn-newsml-dpa-com-20090101-220220-99-214244,Fußball - Hamburg,dpa,,,21022022,Sueddeutsche,sport
Echt wie Lipgloss,20022022_13:56,https://www.sueddeutsche.de/medien/diese-ochsenknechts-reality-sky-1.5532855,"""Diese Ochsenknechts"" bei Sky",,Von Hilmar Klute,"Die begnadete Selbstdarstellerfamilie Ochsenknecht kann man jetzt in einer Reality-Soap besichtigen. Alle sind da. Bis auf einen.
                        
                            Von Hilmar Klute",21022022,Sueddeutsche,medien
Partygäste gehen aufeinander los: Großes Polizeiaufgebot,20022022_13:55,https://www.sueddeutsche.de/panorama/kriminalitaet-koeln-partygaeste-gehen-aufeinander-los-grosses-polizeiaufgebot-dpa.urn-newsml-dpa-com-20090101-220220-99-216347,Kriminalität - Köln,dpa,,,21022022,Sueddeutsche,panorama
"""Außergewöhnliche Spiele"": Olympia in Peking ist Geschichte",20022022_13:52,https://www.sueddeutsche.de/sport/olympia-aussergewoehnliche-spiele-olympia-in-peking-ist-geschichte-dpa.urn-newsml-dpa-com-20090101-220220-99-215157,Olympia,dpa,,,21022022,Sueddeutsche,sport
China feiert Erfolg bei Winterspielen gegen Rivale USA,20022022_13:43,https://www.sueddeutsche.de/sport/olympia-china-feiert-erfolg-bei-winterspielen-gegen-rivale-usa-dpa.urn-newsml-dpa-com-20090101-220220-99-214845,Olympia,dpa,,,21022022,Sueddeutsche,sport
Universum-Boxer Larduet holt Titel,20022022_13:40,https://www.sueddeutsche.de/sport/boxen-hamburg-universum-boxer-larduet-holt-titel-dpa.urn-newsml-dpa-com-20090101-220220-99-215107,Boxen - Hamburg,dpa,,,21022022,Sueddeutsche,sport
Jugendliche verabreden sich online zur Schlägerei,20022022_13:40,https://www.sueddeutsche.de/panorama/kriminalitaet-hannover-jugendliche-verabreden-sich-online-zur-schlaegerei-dpa.urn-newsml-dpa-com-20090101-220220-99-216210,Kriminalität - Hannover,dpa,,,21022022,Sueddeutsche,panorama
Dressur-Weltcup: Zwei Siege für von Bredow-Werndl,20022022_13:38,https://www.sueddeutsche.de/sport/pferdesport-neumuenster-dressur-weltcup-zwei-siege-fuer-von-bredow-werndl-dpa.urn-newsml-dpa-com-20090101-220220-99-216194,Pferdesport - Neumünster,dpa,,,21022022,Sueddeutsche,sport
Mehr Ausbildungsverträge: Effekt von Förderprogramm,20022022_13:38,https://www.sueddeutsche.de/karriere/ausbildung-hannover-mehr-ausbildungsvertraege-effekt-von-foerderprogramm-dpa.urn-newsml-dpa-com-20090101-220220-99-216162,Ausbildung - Hannover,dpa,,,21022022,Sueddeutsche,karriere
Winterspiele beendet: Olympische Flamme in Peking ist erloschen,20022022_13:37,https://www.sueddeutsche.de/sport/olympia-winterspiele-beendet-olympische-flamme-in-peking-ist-erloschen-dpa.urn-newsml-dpa-com-20090101-220220-99-216187,Olympia,dpa,,,21022022,Sueddeutsche,sport
Unbekannte zerstören Tramscheibe in Berlin-Marzahn,20022022_13:36,https://www.sueddeutsche.de/panorama/kriminalitaet-berlin-unbekannte-zerstoeren-tramscheibe-in-berlin-marzahn-dpa.urn-newsml-dpa-com-20090101-220220-99-216154,Kriminalität - Berlin,dpa,,,21022022,Sueddeutsche,panorama
Zwei leichte Erdbeben in Baden-Württemberg: Keine Schäden,20022022_13:35,https://www.sueddeutsche.de/panorama/erdbeben-albstadt-zwei-leichte-erdbeben-in-baden-wuerttemberg-keine-schaeden-dpa.urn-newsml-dpa-com-20090101-220220-99-216145,Erdbeben - Albstadt,dpa,,,21022022,Sueddeutsche,panorama
"Keine Falten, keine Brille: Pumuckl wird 60",20022022_13:34,https://www.sueddeutsche.de/panorama/keine-falten-keine-brille-pumuckl-wird-60-1.5532904,,,,"Video
                    
                    
                        Jetzt gehts stramm aufs Rentenalter zu: Der Pumuckl wird 60 Jahre alt. So richtig erwachsen wirkt er bis heute nicht. Altern Kobolde eigentlich? Haben sie überhaupt Geburtstag - und wenn ja: wann?",21022022,Sueddeutsche,panorama
Klimaschutz im Krankenhaus,20022022_13:33,https://www.sueddeutsche.de/muenchen/wolfratshausen/konzept-mit-auszeichnung-klimaschutz-im-krankenhaus-1.5532786,Konzept mit Auszeichnung,,Von  Veronika Ellecosta,"Die Fachklinik Gaißach will bis 2030 ihre Emissionen auf Null setzen. Das ist auch deshalb eine Herausforderung, weil die Patientenzahlen mit der Erderwärmung steigen. 
                        
                            Von  Veronika Ellecosta",21022022,Sueddeutsche,muenchen
"Schneiden, föhnen, Meere retten",20022022_13:32,https://www.sueddeutsche.de/muenchen/wolfratshausen/aktion-fuer-die-umwelt-schneiden-foehnen-meere-retten-1.5532839,Aktion für die Umwelt,,Von Tilman Voss,"Martina Lederer sammelt in ihrem Tölzer Friseursalon Haare, damit aus ihnen Filter für die Ozeane hergestellt werden können.
                        
                            Von Tilman Voss",21022022,Sueddeutsche,muenchen
Krisenhilfe für Jugendherbergen und Unternehmen verlängert,20022022_13:29,https://www.sueddeutsche.de/muenchen/wolfratshausen/coronakrise-kurzarbeitergeld-krisenhilfe-jugendherbergen-unternehmen-verlaengerung-bundestag-1.5532710,Nach Hilferuf aus Königsdorf,,Von Claudia Koestler,"Die Einrichtungen hatten sich wegen der derzeitigen Beschränkungen an Bundestagsabgeordnete gewandt. Nun ist eine Entscheidung gefallen.
                        
                            Von Claudia Koestler",21022022,Sueddeutsche,muenchen
Dressur-Weltcup: Zwei Siege für von Bredow-Werndl,20022022_13:28,https://www.sueddeutsche.de/sport/pferdesport-dressur-weltcup-zwei-siege-fuer-von-bredow-werndl-dpa.urn-newsml-dpa-com-20090101-220219-99-206778,Pferdesport,dpa,,,21022022,Sueddeutsche,sport
Benin-Bronzen kehren zurück,20022022_13:26,https://www.sueddeutsche.de/kultur/benin-bronzen-kehren-zurueck-1.5532887,,,,"Video
                    
                    
                        Ende des 19. Jahrhunderts raubten Briten Tausende der wertvollen Werke und verkauften sie an Sammler und Museen, auch nach Deutschland.",21022022,Sueddeutsche,kultur
Gesuchter Mann durch fehlende Corona-Maske gefasst,20022022_13:23,https://www.sueddeutsche.de/panorama/kriminalitaet-hamburg-gesuchter-mann-durch-fehlende-corona-maske-gefasst-dpa.urn-newsml-dpa-com-20090101-220220-99-215947,Kriminalität - Hamburg,dpa,,,21022022,Sueddeutsche,panorama
Eine Fußgängerzone für die Altstadt?,20022022_13:22,https://www.sueddeutsche.de/muenchen/dachau/altstadt-dachau-fussgaengerzone-1.5532872,Dachau,,,Nach dem vorzeitigen Aus der Einbahnstraßenregelung in der Dachauer Altstadt schlägt das Bündnis für Dachau eine Fußgängerzone vor.,21022022,Sueddeutsche,muenchen
Holetschek kündigt Offensive zur Verbesserung der Pflege an,20022022_13:21,https://www.sueddeutsche.de/bayern/augsburg-pflege-offensive-seniorenheim-1.5532758,Senioren,,,Nach monatelanger Kritik ist ein umstrittenes Pflegeheim in Augsburg nun geschlossen. Der Gesundheitsminister will Lehren aus dem Fall ziehen.,21022022,Sueddeutsche,bayern
Betrunkener soll Obdachlosen attackiert haben,20022022_13:17,https://www.sueddeutsche.de/panorama/kriminalitaet-berlin-betrunkener-soll-obdachlosen-attackiert-haben-dpa.urn-newsml-dpa-com-20090101-220220-99-215882,Kriminalität - Berlin,dpa,,,21022022,Sueddeutsche,panorama
"Hölle, Hölle, Hölle",20022022_13:02,https://www.sueddeutsche.de/kultur/geschlossene-gesellschaft-kusej-burgtheater-1.5532874,Theater,,Von Wolfgang Kralicek,"Ein Stück wie ein Lockdown: Sartres ""Geschlossene Gesellschaft"" am Wiener Burgtheater.
                        
                            Von Wolfgang Kralicek",21022022,Sueddeutsche,kultur
Nasenbeinbruch: Düsseldorf ohne Hoffmann gegen Aue,20022022_12:58,https://www.sueddeutsche.de/sport/fussball-merkur-spiel-arena-nasenbeinbruch-duesseldorf-ohne-hoffmann-gegen-aue-dpa.urn-newsml-dpa-com-20090101-220220-99-215670,Fußball - Merkur Spiel-Arena,dpa,,,21022022,Sueddeutsche,sport
Geist ohne Materie,20022022_12:57,https://www.sueddeutsche.de/kultur/papiermangel-papierpreis-vinyl-rohstoffpreise-1.5532867,Rohstoffmangel in der Kulturbranche,,Von Leo Kilz,"Scheinbar endlose Lieferzeiten, Papiermangel und rasant steigende Rohstoffpreise: Mit welchen Problemen Verlage und Plattenfirmen gerade zu kämpfen haben.
                        
                            Von Leo Kilz",21022022,Sueddeutsche,kultur
Mann mit Samuraischwert verletzt: Spezialkräfte greifen ein,20022022_12:57,https://www.sueddeutsche.de/panorama/kriminalitaet-bremen-mann-mit-samuraischwert-verletzt-spezialkraefte-greifen-ein-dpa.urn-newsml-dpa-com-20090101-220220-99-215658,Kriminalität - Bremen,dpa,,,21022022,Sueddeutsche,panorama
"Hamburg bei ""Zeynep"" glimpflich davongekommen: Nun ""Antonia""",20022022_12:56,https://www.sueddeutsche.de/panorama/wetter-hamburg-hamburg-bei-zeynep-glimpflich-davongekommen-nun-antonia-dpa.urn-newsml-dpa-com-20090101-220219-99-201124,Wetter - Hamburg,dpa,,,21022022,Sueddeutsche,panorama
"""Aus allen Löchern geschwitzt"": KSC mit Sieg nach Sturm",20022022_12:55,https://www.sueddeutsche.de/sport/fussball-kiel-aus-allen-loechern-geschwitzt-ksc-mit-sieg-nach-sturm-dpa.urn-newsml-dpa-com-20090101-220219-99-205715,Fußball - Kiel,dpa,,,21022022,Sueddeutsche,sport
Queen hat Corona und spürt milde Symptome,20022022_12:55,https://www.sueddeutsche.de/panorama/queen-hat-corona-und-spuert-milde-symptome-1.5532870,,,,"Video
                    
                    
                        Queen hat Corona und spürt milde Symptome, Über große Teile der Pandemie schirmte sich die Queen auf Schloss Windsor vor dem Virus ab. Nun, kurz bevor der britische Premier Boris Johnson auch die letzten Corona-Maßnahmen aufheben will, hat sie sich dennoch infiziert. Die Sorge um die Monarchin ist groß.",21022022,Sueddeutsche,panorama
"Klarheit bei Petersen-Vertrag ""in den nächsten Wochen""",20022022_12:54,https://www.sueddeutsche.de/bayern/fussball-augsburg-klarheit-bei-petersen-vertrag-in-den-naechsten-wochen-dpa.urn-newsml-dpa-com-20090101-220219-99-207892,Fußball - Augsburg,dpa,,,21022022,Sueddeutsche,bayern
"Bund kritisiert ""erbarmungslose Dialektdiskriminierung""",20022022_12:53,https://www.sueddeutsche.de/bayern/sprache-konzell-bund-kritisiert-erbarmungslose-dialektdiskriminierung-dpa.urn-newsml-dpa-com-20090101-220219-99-200671,Sprache - Konzell,dpa,,,21022022,Sueddeutsche,bayern
Guter Ton,20022022_12:52,https://www.sueddeutsche.de/stil/design-keramik-valencia-weltdesignhauptstadt-ana-illueca-xavier-monsalvatje-1.5526049,Kunsthandwerk,,"Von Karin Janker, Valencia","Valencia lässt sich in diesem Jahr als ""Weltdesignhauptstadt"" feiern. Besonders machen dabei Keramikkünstler auf sich aufmerksam, die Traditionen auf den Kopf stellen
                        
                            Von Karin Janker, Valencia",21022022,Sueddeutsche,stil
Ehemann wird handgreiflich und wirft Beil gegen Polizeiauto,20022022_12:52,https://www.sueddeutsche.de/bayern/kriminalitaet-stein-ehemann-wird-handgreiflich-und-wirft-beil-gegen-polizeiauto-dpa.urn-newsml-dpa-com-20090101-220220-99-215595,Kriminalität - Stein,dpa,,,21022022,Sueddeutsche,bayern
Corona-Inzidenz in Bayern sinkt auch am Sonntag leicht,20022022_12:51,https://www.sueddeutsche.de/bayern/gesundheit-berlin-corona-inzidenz-in-bayern-sinkt-auch-am-sonntag-leicht-dpa.urn-newsml-dpa-com-20090101-220220-99-215584,Gesundheit - Berlin,dpa,,,21022022,Sueddeutsche,bayern
Klima-Initiative: Proteste auf Häfen und Flughäfen ausweiten,20022022_12:49,https://www.sueddeutsche.de/politik/demonstrationen-berlin-klima-initiative-proteste-auf-haefen-und-flughaefen-ausweiten-dpa.urn-newsml-dpa-com-20090101-220220-99-215559,Demonstrationen - Berlin,dpa,,,21022022,Sueddeutsche,politik
